ten_san_pham,gia_sale,gia_goc,rating,so_review,link_anh,shop,category,url_san_pham
Suits workwear color xanh-đồ military school for male/female,159000,265000,4.75,60,https://vn-live-01.slatic.net/p/35b5e8a3fd9c3759e168b84cc397a766.jpg,Thời trang trẻ em 365,Suits,https://www.lazada.vn/products/pdp-i1458611100.html
"[Wholesale price super cheap] suits workwear, pants, workwear fabric khaki type 1 Lake Blue",60000,100000,5.0,17,https://vn-live-01.slatic.net/p/2bbbfaee8a0249d83b3164982f1e54d6.png,BHLĐ BAO YEN,Suits,https://www.lazada.vn/products/pdp-i1916927462.html
"Women's Suits, Kitty Set for Fall-Winter, Long-Sleeve, Loose Format, Matching with 3-Color Ruffled Pants, Bigsize 45-85kg",189000,299000,,,https://vn-live-01.slatic.net/p/27b7ccb3e9860a5f87cf1008e0234a11.jpg,LINH STORE ĐỒ BỘ VÀ MỸ PHẨM,Suits,https://www.lazada.vn/products/pdp-i3281632258.html
"Suits workwear bandanna ri Sapper forest, uniform, workwear soldiers, go phượt, jungle travel for both male and female",113850,264000,4.111111111111111,9,https://vn-live-01.slatic.net/p/fe84aa8fc2a69abcefbfc678b1830cba.png,BẢO HỘ LAO ĐỘNG D&Y,Suits,https://www.lazada.vn/products/pdp-i2133939425.html
Suits workwear bandanna ri Brown,109320,264000,4.5256410256410255,78,https://vn-live-01.slatic.net/p/99c359076d55f767605b1dfa281b6015.png,BẢO HỘ LAO ĐỘNG D&Y,Suits,https://www.lazada.vn/products/pdp-i1317091365.html
"Summer Sportswear for Men and Women High-Quality Foam Material, Short-Sleeved Suits for Men and Women, Short-Sleeved Suits for Men and Women with Round Neck Hottrend Summer 2024 Bo21 - Minhstore66",155000,290000,4.949275362318841,138,https://vn-live-01.slatic.net/p/6673e22bb98b66c73623ea2a123273c6.jpg,MINHSTORE66 Xưởng Thời Trang,Suits,https://www.lazada.vn/products/pdp-i2616142619.html
"Women's Suits, Long-Sleeve Round-Necklace Tole Set with Pockets, Youthful, Cool, Soft, and Soft Form, Bigsize 45-85kg",179000,269000,5.0,4,https://vn-live-01.slatic.net/p/66c5cb86dcb60afeba1b6c48fe1c5b08.jpg,Lynh Clothing Store ,Suits,https://www.lazada.vn/products/pdp-i3239302922.html
FULLBELIEF | Asymmetric Straps Leotard Dance Practice Suit,305000,,4.5,6,https://filebroker-cdn.lazada.vn/kf/S8291004063d34fd48d357deceb2da1e5k.png,FULLBELIEF,Suits,https://www.lazada.vn/products/pdp-i3206672042.html
Joya middle-aged and elderly women's suit cotton and linen T-shirt two-piece set large size women's clothing,109000,238000,4.69811320754717,54,https://my-live-02.slatic.net/p/bfb7eb617f87d99d30d26418d11933d7.jpg,DUOHANZI,Suits,https://www.lazada.vn/products/pdp-i1732565389.html
"Women's Suits, Long-Sleeve Round-Necklace Tole Set with Pockets, Youthful, Loose Form, Cool and Soft Material Bigsize 45-85kg",179000,269000,,,https://vn-live-01.slatic.net/p/7294aa36327c1493e4e4180348f98e5b.jpg,LINH STORE ĐỒ BỘ VÀ MỸ PHẨM,Suits,https://www.lazada.vn/products/pdp-i3255558763.html
lontakids 4Pcs Kids Boys Formal Vest Suits (Long Sleeve Shirt + Vest + Pants + Bow Tie) Child Clothes Sets Wedding Piano Performance Outfits 3-12 Years,319770,495000,4.742857142857143,137,https://my-live-01.slatic.net/p/bb18f32fd9a9e253046c59b7388739b5.jpg,YiQI Kids Formal Wear,Suits,https://www.lazada.vn/products/pdp-i1501046216.html
JOSEN LIGHTING | Infant One-piece Clothing 52,218000,,,,https://filebroker-cdn.lazada.vn/kf/S006c9ae9b60d47c9b19100695eeee39av.jpg,josenlighting,Suits,https://www.lazada.vn/products/pdp-i3231294008.html
lontakids Kids Boys 2Pcs(Jacket+Pants )/3Pcs(Jacket+Pants+ T-shirt) Wedding Party Suit Toddlers Birthday Dresswear Formal Attire Set for 2-12 Years,296503,462000,5.0,66,https://my-live-01.slatic.net/p/f1f60a209281d33175ab8d5c7db145d9.jpg,YiQI Kids Formal Wear,Suits,https://www.lazada.vn/products/pdp-i1529522226.html
INCERUN Men's Stylish Minimalist Two-piece Suits Short Sleeve Shirt Shorts Leisure Sets (Korean Style)#250325,436922,873844,5.0,5,https://sg-test-11.slatic.net/p/d69c6818dafe20cbae38bdd68a6f2695.jpg,INCERUN Official Store,Suits,https://www.lazada.vn/products/pdp-i3057465196.html
Two-Color Vest Set - Slim-Leg Trousers - Code Um75,140000,185000,5.0,1,https://vn-live-01.slatic.net/p/8c13fd20838c7d1d72d7cbe1570616b9.jpg,ĐỒ BỘ XINH AN CHI,Suits,https://www.lazada.vn/products/pdp-i3035884469.html
Set bộ áo blazer + quần ống suông,599000,1350000,,,https://sg-test-11.slatic.net/p/a65f99d1caf1eb0d177d813643a8c26f.jpg,Thời Trang MMoutfit,Suits,https://www.lazada.vn/products/pdp-i2590640941.html
"Guzado Brand High Quality Men's Suit Made of Windproof Fabric, Slim Fit, Luxurious Basic Colors Gbg01",739000,1165000,5.0,9,https://vn-live-01.slatic.net/p/b38ef2d35a9a1ac859aa0aa0ce9d04b1.png,Guzado Fashion,Suits,https://www.lazada.vn/products/pdp-i3216009820.html
Zebina Elegant Office Lady Suit Set with Blazer and Pants for Spring,206000,448800,,,https://sg-test-11.slatic.net/p/8f477da2f79f625bd5c6c8b7ad322dbe.png,Zebina ,Suits,https://www.lazada.vn/products/pdp-i3107754123.html
"Dx_luxury middle set, shirt and mother gift set scratch flower pattern shift sleeve elegant long straight pants suit",205000,399000,5.0,4,https://vn-live-01.slatic.net/p/1f3c827f4c4c237770f802b7d1142fa7.jpg,Shop Đông Nghi,Suits,https://www.lazada.vn/products/pdp-i3169056313.html
ZANZEA Women Summer Pant Sets 2 Piece Sets Crew Neck Half Sleeve Floral Print Shirt Long Pants Suits OL Work Tracksuit #1008,315000,643150,,,https://sg-test-11.slatic.net/p/57b5ae032dae8c9e5094f54b0c09bb27.jpg,ZANZEA,Suits,https://www.lazada.vn/products/pdp-i3212514444.html
【Best value for money】 Cosplay Lolita Sailor suit Outfit Lady temptation costumes Games Clothes,567578,738530,,,https://ae01.alicdn.com/kf/HTB1prJ9bUUIL1JjSZFrq6z3xFXaW.jpg,Wall Warriors,Suits,https://www.lazada.vn/products/pdp-i3263365957.html
Professional Women's Two-Piece Suit Set Elegant Performance Outerwear Top And Pants Long Sleeve Polyester Fiber Workwear,251000,,5.0,1,https://filebroker-cdn.lazada.vn/kf/Sfc89bda090914ca58be265e978a1de70b.jpg,TB FASHION STORE,Suits,https://www.lazada.vn/products/pdp-i2999463564.html
Cool Handsome Boys Suit Set Autumn Fashionable Trendy Kids Clothing Long Sleeve Pants Korean Style Children Outfits for Boys,502000,586000,,,https://filebroker-cdn.lazada.vn/kf/Sa4608cd3da574455af46f58cf559dd62p.jpg,Lazada Global,Suits,https://www.lazada.vn/products/pdp-i2420142016.html
INCERUN Two-piece Suits For Men Trendy Plain Stitching Color Long Sleeve Midi Blazer Pants Western Style Sets #1013,506481,955932,5.0,1,https://sg-test-11.slatic.net/p/77a78994ab5b332beee3a8d8f7279a18.jpg,INCERUN Official Store,Suits,https://www.lazada.vn/products/pdp-i3217897883.html
ZANZEA Korean Style Women's 2pcs Suit Office Double Breasted Long Sleeve Blazer Elastic Waist Straight Pants Sets #10,342185,684370,5.0,22,https://sg-test-11.slatic.net/p/39acf03f26a21fec8131dd134b34e9a6.jpg,ZANZEA,Suits,https://www.lazada.vn/products/pdp-i2474281039.html
Elegant Casual Women's Three-Piece Suit Set Spring Autumn New Style High-End Professional Outfit Long Sleeve Polyester Fiber,285000,548000,,,https://filebroker-cdn.lazada.vn/kf/S9012622127904581b7d4950a33722afdm.jpg,Lazada Global,Suits,https://www.lazada.vn/products/pdp-i3253101644.html
ZANZEA Korean Style Women Two-piece Suits Autumn Long Sleeve Stand Collar Zipper Jacket Long Skirts Solid Sets #1117,348000,808042,,,https://sg-test-11.slatic.net/p/c87e8cff6d692b7d2b87f9aaa7c5c49f.jpg,ZANZEA,Suits,https://www.lazada.vn/products/pdp-i3253410970.html
INCERUN Two-piece Suits For Men Trendy Long Sleeve Blazer Striped Deconstructed Trousers Korean Style Sets #1013,490292,1132400,,,https://sg-test-11.slatic.net/p/5efaa763304e04acb9f8e56df6c8e537.jpg,INCERUN Official Store,Suits,https://www.lazada.vn/products/pdp-i3216990115.html
Bộ Đồ Thể Thao Nam Hai Mảnh Áo Dài Tay Và Quần Dài Chất Liệu Polyester Thoải Mái Thời Trang Mùa Xuân Thu,242000,314000,,,https://filebroker-cdn.lazada.vn/kf/S858c953c67e5494193eb71afef08990fd.jpg,GlobalWonderShop,Suits,https://www.lazada.vn/products/pdp-i3258392731.html
Bộ Áo Liền Quần Dài Tay Vừa Vặn Dành Cho Nữ Màu Trơn Thoải Mái Thường Ngày Quần Ba Phần Tư Bằng Vải Polyester Phong Cách Đi Làm,343000,446000,,,https://filebroker-cdn.lazada.vn/kf/S16191fdcd5e64353858d53ae22a1af28n.jpg,GlobalWonderShop,Suits,https://www.lazada.vn/products/pdp-i3272874919.html
Bộ Đồ Hai Mảnh Nữ Tính Thời Trang Mùa Xuân 2025 Áo Khoác Dài Tay Quần Dài Vải Polyester Mới Bộ Đồ Công Sở Biểu Diễn Khiêu Vũ,278000,,,,https://filebroker-cdn.lazada.vn/kf/Sd51e52a276024e899a6f9a2802589f7bc.jpg,TB FASHION STORE,Suits,https://www.lazada.vn/products/pdp-i2999563187.html
"Bộ Đồ Thể Thao Nam Thời Trang, Áo Khoác Cổ Đứng Và Quần, Kiểu Dáng Rộng Rãi, Hai Mảnh, Có Khóa Kéo Ba Thanh, Thích Hợp Cho Mùa Xuân Thu",215200,351000,5.0,1,https://filebroker-cdn.lazada.vn/kf/Sd9a8b2bb9a9e443887acf65c673ab2298.jpg,GlobalWonderShop,Suits,https://www.lazada.vn/products/pdp-i3228823414.html
High-end Women's Professional Suit,609000,1040000,,,https://filebroker-cdn.lazada.vn/kf/S0b5b7c0af90c4e44a7bacbf2b9d9b4ccM.jpg,xinyu clothing,Suits,https://www.lazada.vn/products/pdp-i3220980584.html
INCERUN Two-piece Suits For Men Two-piece Suits Stripe Cropped Long Sleeve Blazer Deconstructed Layered Pants Western Pants #1013,478307,1105914,,,https://sg-test-11.slatic.net/p/37f755404733506d1f9c44047089b196.jpg,INCERUN Official Store,Suits,https://www.lazada.vn/products/pdp-i3216113570.html
Lexiao | Groom Wedding Suit Wool Blend 1 Set,2869000,5256000,4.571428571428571,7,https://filebroker-cdn.lazada.vn/kf/S1d497a6cd33c4cce930846afabe3d86ct.jpg,LX Suiting Co.,Suits,https://www.lazada.vn/products/pdp-i3244010669.html
Business Slim Fit High-end Men's Suit Set,2037000,3860000,,,https://filebroker-cdn.lazada.vn/kf/S3a9ffd8cf3bf4236bd738f6f5b2c0fb4p.jpg,LX Suiting Co.,Suits,https://www.lazada.vn/products/pdp-i3244252481.html
Professional Wear Grey Suit Set,790000,3696000,4.6,10,https://filebroker-cdn.lazada.vn/kf/S83c2230fbe44466399555bbcbe927620F.png,DAGASS,Suits,https://www.lazada.vn/products/pdp-i3203814078.html
"Bộ Đồ Nam Kiểu Tang, Thời Trang Công Sở Giản Dị, Áo Ngắn Tay Mỏng + Quần, Phong Cách Trung Hoa, Trang Phục Truyền Thống, Đồ Tập Thái Cực Quyền, Chất Liệu Polyester",270000,351000,,,https://filebroker-cdn.lazada.vn/kf/S30824485065349ecb5529a7d9d22b074n.jpg,GlobalLifestyle,Suits,https://www.lazada.vn/products/pdp-i3273454963.html
"Bộ Đồ Thể Thao Nam Thường Ngày, Áo Khoác Có Cổ Hai Túi & Quần Ống Thẳng, Trang Phục Hai Mảnh Từ Trung Quốc Đại Lục",449650,694000,,,https://filebroker-cdn.lazada.vn/kf/S5a53714c7e0a4a7eae3d3a6bc426285cP.jpg,GlobalWonderShop,Suits,https://www.lazada.vn/products/pdp-i3201640757.html
ZANZEA Women Elegant Sets Full Sleeve Lightweight Notched Lapel Blazer Wide Leg Long Pants 2pcs Suits Office Plain Sets #0901,401245,802490,,,https://sg-test-11.slatic.net/p/8ed35be114805d54dd1e16db68666c04.jpg,ZANZEA,Suits,https://www.lazada.vn/products/pdp-i3182262545.html
Sexy Micro-Transparent Biker Suit Women's Tight-Fit Zipper High Elasticity Nylon One-Piece Base Layer Pants Smooth Shiny,291000,413000,5.0,7,https://filebroker-cdn.lazada.vn/kf/S82d1c76e9c034608916ec9fdcfbd2ede2.jpg,TB FASHION STORE,Suits,https://www.lazada.vn/products/pdp-i2413881706.html
[ Đồ Định Hình Định ] Body Suit Dáng Nâng Eo Không Đường May Co Giãn Tốt Tôn Dáng 6 Màu Cao Cấp Dáng Đẹp Tự Nhiên,185000,380000,,,https://vn-live-01.slatic.net/p/b3d3575f29a07ad52d76eafef08cbc47.jpg,THY YẾNNN,Suits,https://www.lazada.vn/products/pdp-i3197314791.html
Bear Leader Chinese Style Clothing Sets for Baby Girls Embroidered Pearl Flowers Frog Tops and Mesh Skirt 2 Pieces Suits Kids Toddler Clothes Casual Wear 2-7 Years,202508,561968,4.982456140350878,74,https://sg-test-11.slatic.net/p/e458c43e517ce0ad10522140d95395f1.jpg,Bear Leader,Suits,https://www.lazada.vn/products/pdp-i2622196726.html
Bear Leader Korean Version Clothes Sets for Baby Girls New Summer Brown Sleeveless Fashion Vest Top and Stripes Pants 2Pieces Kids Suits 3 to 7 Years Children's Clothing Casual Outfits,102611,229000,4.902777777777778,104,https://my-live-01.slatic.net/p/8de56ca8f0050427b1d9c43a37e3311a.jpg,Bear Leader,Suits,https://www.lazada.vn/products/pdp-i2946943665.html
"Bộ Đồ Bộ Quần Soóc Đầm Thời Trang Phương Tây Mùa Hè, Quần Đùi Nữ Vải Voan Lưới Màu Đỏ Mỏng, Bộ Đồ Hai Mảnh",176079,246591,4.816326530612245,69,https://my-live-02.slatic.net/p/6af0a3a04d5025db20cc414e54f7546d.jpg,BlueOrange,Suits,https://www.lazada.vn/products/pdp-i1436314760.html
MOVK | Đồ Mặc Phỏng Vấn và Trang Phục Chính Thức cho Phụ Nữ Bé Nhỏ Màu Xám,1137000,4043000,4.879781420765028,183,https://filebroker-cdn.lazada.vn/kf/Sd799bd4596884d70acaec6af494e9d99M.jpg,MOVK women's clothing,Suits,https://www.lazada.vn/products/pdp-i3213477027.html
Bộ Đồ Hai Mảnh Nữ Tính Thanh Lịch Bộ Đồ Công Sở Dài Tay Dài Thường Ngày Bộ Đồ Hai Mảnh Bộ Đồ Công Sở Nữ Bộ Đồ Hai Mảnh,251000,,5.0,1,https://filebroker-cdn.lazada.vn/kf/Sfc89bda090914ca58be265e978a1de70b.jpg,TB FASHION STORE,Suits,https://www.lazada.vn/products/pdp-i2999463564.html
Bear Leader Cotton Kids Clothes Sets Baby Girl Colorful Clothing Suits Fashion Plaid Flower Top and Skirts 2Pcs Sets Outfits 2023 New Costumes for 3-7 Years Child,154600,357458,4.804878048780488,95,https://my-live-01.slatic.net/p/72a7344659f6d3e47bb94dd44f9fec2c.jpg,Bear Leader,Suits,https://www.lazada.vn/products/pdp-i2205589982.html
GESHIFAN | Bộ Áo Suit Zhongshan Nam Trung Niên,1444000,,,,https://filebroker-cdn.lazada.vn/kf/S81ad83741fa24ed392eb3892e7c57084T.jpg,Geshifan,Suits,https://www.lazada.vn/products/pdp-i3219727859.html
Bear Leader 3-7 Years Kids Clothing Outfits Winter Cute Bow Tie Knit Sets Round Neck Long Sleeved Sweater + A-line Skirt Suit Korean 2 Pieces Suits Girls Clothes,252655,616232,5.0,5,https://sg-test-11.slatic.net/p/416bab0b7ac7ab072f80c58d160fe636.jpg,Bear Leader,Suits,https://www.lazada.vn/products/pdp-i2735009062.html
【Must-Have Gadgets】 Cosplay Sailor Lolita suit Outfit Lady temptation costumes Games Women,356278,463840,,,https://ae01.alicdn.com/kf/S3b1e23f141ca48e383ec98b1e6171c039.jpg,Wall Warriors,Suits,https://www.lazada.vn/products/pdp-i3263442764.html
Bộ Đồ Hai Mảnh Vải Lanh Cotton Phong Cách Hàn Quốc Thời Trang Mùa Thu Cỡ Lớn Quần Ống Đứng Giản Dị Thiết Kế Áo Sơ Mi,381600,424000,,,https://filebroker-cdn.lazada.vn/kf/S1753b884b73c425185f39e3923109228F.jpg,TB FASHION STORE,Suits,https://www.lazada.vn/products/pdp-i3149855354.html
Bộ Đồ Hip Hop Disco Carnival Role Play Retro 80s Shell Suit Trang Phục Hóa Trang Cho Tiệc Trang Trí Mặt Nạ,587000,,,,https://filebroker-cdn.lazada.vn/kf/Sbaf89a0d4d2246b29b51d81d698b4fb8k.jpg,Lazada Global,Suits,https://www.lazada.vn/products/pdp-i3244331370.html
2MM Neoprene Wetsuit for women Long Sleeve diving suit pink,760000,999998,,,https://vn-live-01.slatic.net/p/47b0f2bd1838d25d4bb9de52cd3a982a.jpg_webp,QM Outdoor,Suits,https://www.lazada.vn/products/pdp-i3203907789.html
Bộ Đồ Hai Mảnh Ngọt Ngào Cho Học Sinh Trung Học Mùa Thu Đông Phong Cách Ngọt Ngào Áo Len Dài Tay Rộng Rãi Thoải Mái,381000,,,,https://filebroker-cdn.lazada.vn/kf/Sfa46ed58d1a84c888d45cd5880ab1455o.jpg,TB FASHION STORE,Suits,https://www.lazada.vn/products/pdp-i2837846105.html
ZY.HT EraVogue 2 mảnh Set Puff Up Sleeve + Shorts Work Suit Hi-Suit nữ Jumpsuit nữ 80207,1360000,1950270,5.0,2,https://th-live.slatic.net/p/8361202cb858d3e86d378539ab946059.jpg,ZYHT,Suits,https://www.lazada.vn/products/pdp-i2767956569.html
Ielgy đồ ngủ in hình phim hoạt hình mèo con Bộ suit nhà rộng của phụ nữ có thể mặc bên ngoài,326490,480000,,,https://sg-test-11.slatic.net/p/19d76f4cf2f62cccc7719bda1341a644.jpg,IELGY,Suits,https://www.lazada.vn/products/pdp-i3078097557.html
GXG | Bộ Đồ Suit Đơn Giản Màu Xám Đá,7364000,,5.0,1,https://filebroker-cdn.lazada.vn/kf/Sfb56943e77a64c33be6731eb03f95d690.jpg,GXG Specialty Store,Suits,https://www.lazada.vn/products/pdp-i3215179501.html
Bộ Đồ Hai Mảnh Nữ Tính Thời Trang Mùa Xuân 2025 Áo Khoác Dài Tay Quần Dài Vải Polyester Mới Bộ Đồ Công Sở Biểu Diễn Khiêu Vũ,278000,,,,https://filebroker-cdn.lazada.vn/kf/Sd51e52a276024e899a6f9a2802589f7bc.jpg,TB FASHION STORE,Suits,https://www.lazada.vn/products/pdp-i2999563187.html
Trang Phục Chiến Đấu Hoạt Hình Quantum War Suit - Trang Phục Chiến Đấu Của Avengers - Captain America Thor Deadpool Iron Man Black Panther - Trang Phục Nhập Vai Siêu Anh Hùng,290000,377000,,,https://filebroker-cdn.lazada.vn/kf/S25ca9835dbf44c76822e86b4224155a8f.jpg,GlobalWonderShop,Suits,https://www.lazada.vn/products/pdp-i3273172693.html
SHANGSHA | Bộ Suit Mùa Thu/Đông Phong Cách & Chất Lượng Cao,1003000,1431000,4.6,5,https://filebroker-cdn.lazada.vn/kf/S16fdb57e61504efda5c7e982f3f77d4ej.jpg,shangsha women's clothing,Suits,https://www.lazada.vn/products/pdp-i3220564290.html
Set bộ text vàng: Blazer + Quần suông B8282V14 Toson,749000,1486000,,,https://sg-test-11.slatic.net/p/5d3041376952143e116b868672115713.jpg,TOSON STORE,Suits,https://www.lazada.vn/products/pdp-i2914498206.html
Pierre Cardin | Bộ Suit Nam Dành Cho Mùa Xuân Thu Phong Cách Doanh Nhân Kích Cỡ Nhỏ,1395000,1564000,,,https://filebroker-cdn.lazada.vn/kf/Sff6009b2489b48369d8c751f7d5fa1a8P.jpg,Pierre Cardin Global,Suits,https://www.lazada.vn/products/pdp-i3220207637.html
Bộ Đồ Hai Mảnh Thời Trang Cao Cấp Cạp Cao Cho Nữ Xuân 2024 Bộ Đồ Sơ Mi Và Quần Vest Đa Năng Thanh Lịch Cho Thanh Thiếu Niên,492000,1211000,,,https://filebroker-cdn.lazada.vn/kf/S87bf40f81afb47049388d6d317f0330c1.jpg,TB FASHION STORE,Suits,https://www.lazada.vn/products/pdp-i2885737160.html
Bộ Áo Liền Quần Dài Tay Vừa Vặn Dành Cho Nữ Màu Trơn Thoải Mái Thường Ngày Quần Ba Phần Tư Bằng Vải Polyester Phong Cách Đi Làm,343000,446000,,,https://filebroker-cdn.lazada.vn/kf/S16191fdcd5e64353858d53ae22a1af28n.jpg,GlobalWonderShop,Suits,https://www.lazada.vn/products/pdp-i3272874919.html
"Bộ Đồ Tang Suit Lụa Đá Cổ Điển Dành Cho Nam, Tay Ngắn, Kiểu Dáng Thường Ngày, Size Lớn, Mùa Hè, Phong Cách Trung Hoa, Bộ Đồ Cha Con, Áo Khoác Cho Người Trung Niên Và Người Cao Tuổi",202000,262000,,,https://filebroker-cdn.lazada.vn/kf/Sc344c0dea51b43c99688adad5dfb965bL.jpg,GlobalWonderShop,Suits,https://www.lazada.vn/products/pdp-i3284532092.html
"Bộ Quần Áo Nữ HH 2024, Quần Ống Rộng Lưng Cao, Áo Sơ Mi Dáng Rộng, Bộ 2 Món, Trang Phục Công Sở Mùa Hè",301000,559000,,,https://filebroker-cdn.lazada.vn/kf/S210097503a4944f48594339f8ff7e6cfs.jpg,GlobalLifestyle,Suits,https://www.lazada.vn/products/pdp-i3284504328.html
Zuogeeya | Bộ Suit Nam Công Sở Plus Size Form Rộng 3 Mảnh,1925000,3810000,,,https://filebroker-cdn.lazada.vn/kf/S581ae8713bb2438b8990bc5aeb397dfdJ.jpg,zuogeeya,Suits,https://www.lazada.vn/products/pdp-i3220224790.html
"Bộ Đồ Hai Mảnh Thời Trang, Tay Ngắn, Thoải Mái, Chất Liệu Polyester, Thích Hợp Cho Mùa Thu Đông, Kiểu Dáng Áo Sơ Mi Cổ Trụ.",346000,450000,,,https://filebroker-cdn.lazada.vn/kf/Sc0401176da644adf81f6ef63d3fe325c4.jpg,GlobalWonderShop,Suits,https://www.lazada.vn/products/pdp-i3273008948.html
"Bộ Đồng Phục Công Sở Mùa Hè Dành Cho Nữ Cỡ Lớn, Kiểu Dáng Rộng Rãi, Tay Ngắn, Hai Mảnh, Chất Liệu Polyester Pha, Thoải Mái, Chống Tĩnh Điện",475000,618000,,,https://filebroker-cdn.lazada.vn/kf/S847b046f67af440d87eef399a8d2eb4ez.jpg,GlobalWonderShop,Suits,https://www.lazada.vn/products/pdp-i3280249524.html
Bộ Suit Nam Cao Cấp Dáng Slim Fit,2037000,3860000,,,https://filebroker-cdn.lazada.vn/kf/S3a9ffd8cf3bf4236bd738f6f5b2c0fb4p.jpg,LX Suiting Co.,Suits,https://www.lazada.vn/products/pdp-i3244252481.html
"Bộ Đồ Hai Mảnh Gồm Áo Cardigan Len Phối Màu Cổ Trụ Thanh Lịch Và Quần Ống Rộng Lưng Cao, Phong Cách Thời Trang Thường Ngày, Thích Hợp Đi Làm, Chất Liệu Polyester",227000,295000,,,https://filebroker-cdn.lazada.vn/kf/S177e71e6d43a41649d3e5d2258c4d6e3Q.jpg,GlobalWonderShop,Suits,https://www.lazada.vn/products/pdp-i3278596433.html
Bộ Quần Áo Thoáng Mát Thiết Kế Sang Trọng,737000,,,,https://filebroker-cdn.lazada.vn/kf/Sb0a37c13301540afb00371f93b3ffb2eY.jpg,BOGUDU,Suits,https://www.lazada.vn/products/pdp-i3231138077.html
Bộ Đồ Công Sở Màu Hồng Cam Mùa Thu 2025 Bộ Ba Mảnh Áo Sơ Mi Vest Quần Dài Cổ Tròn Cài Nút Thời Trang Nữ,1540000,3060000,,,https://filebroker-cdn.lazada.vn/kf/Sdc5cf3516b7049d4b3e56a5c40cf8906a.jpg,TB FASHION STORE,Suits,https://www.lazada.vn/products/pdp-i2997266662.html
"Bộ Đồ Nam Chất Liệu Nhung Tăm Cổ Điển, Ấm Áp, Kiểu Dáng Thường Ngày, Cài Khuy Đôi, Chất Liệu Polyester Rayon, Vừa Vặn, Thích Hợp Cho Mùa Thu/đông, Phong Cách Tối Giản, Không Thể Thiếu.",503000,654000,,,https://filebroker-cdn.lazada.vn/kf/S58f85745300244248ba6ba13cc856fc7D.jpg,GlobalTechMart,Suits,https://www.lazada.vn/products/pdp-i3275060467.html
"Bộ Đồ Công Sở Cổ Điển Nữ Gồm Quần Ống Đứng Lưng Cao & Áo Khoác Phi Công Có Túi 3D, Chất Liệu Nhung, Xuất Xứ Trung Quốc, Chất Liệu Vải Gân",428000,556000,,,https://filebroker-cdn.lazada.vn/kf/Scb3cf95bfb2748f682e2d64d70e933c69.jpg,GlobalWonderShop,Suits,https://www.lazada.vn/products/pdp-i3273785598.html
Lexiao | Bộ Com Lơ Nam Ôm Body Có Cổ Bẻ,2045000,3876000,,,https://filebroker-cdn.lazada.vn/kf/S34420772b4fd47ed867f58bca771052cO.jpg,LX Suiting Co.,Suits,https://www.lazada.vn/products/pdp-i3244084559.html
"Bộ Trang Phục Nữ Thanh Lịch 2 Món Gồm Quần Dài, Chân Váy Và Áo Vest, Màu Trơn, Chi Tiết Khuy, Thời Trang, Thích Hợp Đi Làm, Mùa Hè, Thường Ngày, Chất Liệu Polyester",550000,715000,,,https://filebroker-cdn.lazada.vn/kf/Sd5934e85c38b47d78019c46d990ebaa06.jpg,GlobalWonderShop,Suits,https://www.lazada.vn/products/pdp-i3278412902.html
"Bộ Đồ Nữ Hai Mảnh Dáng Suông, Chất Liệu Polyester, Kiểu Dáng Thời Trang, Thiết Kế Áo Khoác Có Mũ Và Khóa Kéo, Quần Ống Đứng, Thích Hợp Cho Mùa Xuân Thu.",329000,427000,,,https://filebroker-cdn.lazada.vn/kf/Sb8231e3f8cb7427492166e576b66f160w.jpg,GlobalWonderShop,Suits,https://www.lazada.vn/products/pdp-i3272919889.html
Lexiao | Bộ Com Lông Cừu Pha Ý Dành Cho Nam Cao Cấp,2869000,5256000,4.571428571428571,7,https://filebroker-cdn.lazada.vn/kf/S1d497a6cd33c4cce930846afabe3d86ct.jpg,LX Suiting Co.,Suits,https://www.lazada.vn/products/pdp-i3244010669.html
MAIYING | Bộ Áo Vest Công Sở Nam,418000,,4.5,28,https://filebroker-cdn.lazada.vn/kf/S1dd81a29d5a44a1c825105e9ee4bb8f1T.jpg,Maiying,Suits,https://www.lazada.vn/products/pdp-i3219972509.html
Lieoyuarn | Bộ Đồ Phong Cách Trung Quốc Cổ Điển Thêu Họa Tiết,225000,,4.894736842105263,21,https://filebroker-cdn.lazada.vn/kf/S0a3a4abc7b494e679f69278977186e6eb.jpg,MIAOYUAN Fashion,Suits,https://www.lazada.vn/products/pdp-i3230608058.html
Slim Casual Suit Jackets for Men Classic Outdoor Lightweight Outwear for Casual Wear Business Meeting TF-Ais-VN,138000,276000,5.0,2,https://sg-test-11.slatic.net/p/b5bb59dcdd487b4fbe64a34ef247aef4.jpg,MaisieTF,Suits,https://www.lazada.vn/products/pdp-i3074266496.html
Bộ võng xếp người lớn ống to fi 32 sơn tĩnh điện,299000,350000,4.93993993993994,333,https://filebroker-cdn.lazada.vn/kf/S02421db52b6945efa1a34cbc3536f018H.jpg,NỘI THẤT GIÁ SỈ ISO 2001,Suits,https://www.lazada.vn/products/pdp-i2234596619.html
"Body Thu Đông(Kèm Mũ)Cho Bé Từ 3-11kg💕𝑭𝑹𝑬𝑬𝑺𝑯𝑰𝑷💕 ZUMIKIDS- Hàng Thiết Kế -Body Thôi Nôi, Đầy Tháng Cho Bé Gái",116775,170000,5.0,26,https://vn-live-01.slatic.net/p/9522d8a05dd35e05c971427feed7cbbc.jpg,Zumikids váy thiết kế bé gái ,Suits,https://www.lazada.vn/products/pdp-i2499993410.html
OAK FAMILY | Bộ Đồ Bò Tay Dài Cho Bé,1135000,2259000,4.9375,41,https://filebroker-cdn.lazada.vn/kf/S9d91a3f3d5fc4740a57e34ed84f76b4bd.jpg,Oak Family,Suits,https://www.lazada.vn/products/pdp-i3178118005.html
"Thuyền Hơi Câu Cá, Du Lịch , Xuồng Composite, 3Người, Hàng Đẹp, An Toàn, Giá Tốt",929000,,,,https://sg-test-11.slatic.net/p/ba1842d6cd01adf60de0227737707116.jpg,lenguyenshop1,Suits,https://www.lazada.vn/products/pdp-i3072032153.html
EINGMEDYFRESH | Bodysuit Bông Cho Trẻ sơ sinh 0-3 Tháng,181000,354000,4.833333333333333,7,https://filebroker-cdn.lazada.vn/kf/Sa5bcd8244be04da2af3eee12f24f24aaY.jpg,EINGMEDY,Suits,https://www.lazada.vn/products/pdp-i3246763106.html
【Aura Mall】 80s 90s hippie disco cosplay costume outfits pants sportwear retro hop jumpsuit female Halloween carnival dsguise suit,426987,487150,5.0,1,https://laz-img-sg.alicdn.com/p/8b5c1a4ca155896da2e2875faa437747.jpg,Aura Mall,Suits,https://www.lazada.vn/products/pdp-i3235483731.html
SHENGBA | Bộ Đồ Thể Thao Nam Mùa Thu cho Người Già Phong Cách Dạo Phố,441000,821000,4.942857142857143,80,https://filebroker-cdn.lazada.vn/kf/S197141338a0e4dfd9e0bbc78553048f9P.jpg,SHENGBA men's wear,Suits,https://www.lazada.vn/products/pdp-i3217642696.html
(Trẻ em) Bộ đồ Body Suit hoá trang Người Nhện Spider man dành cho trẻ em cực đẹp mắt,229000,,5.0,2,https://vn-live-01.slatic.net/p/3f98d93e71560f15930722e558917ca9.jpg,ĐK Cosplay Shop,Suits,https://www.lazada.vn/products/pdp-i2368219858.html
