ten_san_pham,gia_sale,gia_goc,rating,so_review,link_anh,shop,category,url_san_pham
"Bộ Đồ Thường Ngày Cỡ Lớn Với Quần Ống Rộng Và Áo Khoác Ngoài Dáng Ôm, Tay Dài, Hai Mảnh Thời Trang Cho Mùa Xuân 2025",357000,464000,,,https://filebroker-cdn.lazada.vn/kf/S0bb3125eb1064a13afabba1f13a1ed41Z.jpg,GlobalWonderShop,Suits,https://www.lazada.vn/products/pdp-i3264715796.html
Bộ Đồ Thể Thao Hai Mảnh Tay Dài Quần Dài Mùa Thu Đông Chất Liệu Polyester Thoải Mái Thời Trang,342000,445000,,,https://filebroker-cdn.lazada.vn/kf/S0da988b59d124ba28f8bde78ff0c2210e.jpg,GlobalWonderShop,Suits,https://www.lazada.vn/products/pdp-i3250390019.html
"Bộ Vest Nam Ôm Dáng, Lịch Sự, Kiểu Tuxedo, Thích Hợp Cho Đám Cưới, Tay Dài, Ve Áo Hình Chữ V, Trang Phục Chú Rể, Chất Liệu Polyester Viscose",785000,1020000,,,https://filebroker-cdn.lazada.vn/kf/S480624552ef648c18fb9f8e90ca3b830U.jpg,GlobalTechMart,Suits,https://www.lazada.vn/products/pdp-i3252157800.html
"Bộ Đồ Hai Mảnh Cỡ Lớn, Quần Ống Rộng, Kiểu Dáng Rộng Rãi, Thời Trang Mùa Xuân, Trang Phục Công Sở Nữ, Áo Khoác Ngoài",343000,446000,,,https://filebroker-cdn.lazada.vn/kf/S70ebbce463e14eb1894aa2373a7a17f1P.jpg,GlobalWonderShop,Suits,https://www.lazada.vn/products/pdp-i3263944153.html
"Bộ Đồ Thể Thao Nam Hai Mảnh, Áo Khoác Ngoài Dài Tay, Phong Cách Giản Dị, Hợp Thời Trang, Nghệ Thuật, Đơn Giản, Chất Liệu Polyester Dành Cho Nam Thanh Niên",561000,729000,,,https://filebroker-cdn.lazada.vn/kf/Sa45418fae04d419aa91942211ce98390R.jpg,GlobalWonderShop,Suits,https://www.lazada.vn/products/pdp-i3264830103.html
"Bộ Đồ Nữ Thời Trang Thường Ngày, Màu Trơn, Quần Ống Rộng Và Áo Vest, Quần Dài Ống Thẳng Có Dây Lưng, Bộ Hai Mảnh",543000,706000,,,https://filebroker-cdn.lazada.vn/kf/Sbe0b4f20d92346bda22d90da0f289ea1p.jpg,GlobalWonderShop,Suits,https://www.lazada.vn/products/pdp-i3257213701.html
"Bộ Đồ Nữ Hai Mảnh Kiểu Áo Khoác, Quần Dài, Thời Trang, Thoải Mái, Hợp Xu Hướng",427000,555000,,,https://filebroker-cdn.lazada.vn/kf/S2a50a6cedc0445f384f035ea677624a7z.jpg,GlobalWonderShop,Suits,https://www.lazada.vn/products/pdp-i3254001374.html
"Bộ Trang Phục Nữ Hàn Quốc Thanh Lịch 2 Mảnh, Mùa Xuân Thu, Kiểu Công Sở, Gồm Áo Khoác Và Quần Ống Rộng, Phong Cách Đi Làm",646000,839000,,,https://filebroker-cdn.lazada.vn/kf/Sce6ca59faf7242c1a0e23461a03cf0916.jpg,GlobalLifestyle,Suits,https://www.lazada.vn/products/pdp-i3227873747.html
"Bộ Đồ Nữ Hai Mảnh Thời Trang Tay Dài, Khóa Kéo, Phối Màu, Kiểu Dáng Thường Ngày, Chất Liệu Polyester, Hợp Xu Hướng, Thích Hợp Đi Làm, Dùng Được Quanh Năm",586000,762000,,,https://filebroker-cdn.lazada.vn/kf/Sdd3be4068a864b389ae77d763be80e7a9.jpg,GlobalWonderShop,Suits,https://www.lazada.vn/products/pdp-i3269276183.html
"Bộ Đồ Nữ Dệt Kim Hai Mảnh Cổ Tròn Tay Dài, Chi Tiết Cúc, Quần Ống Rộng, Thời Trang Thường Ngày Mùa Xuân Thu",665000,865000,,,https://filebroker-cdn.lazada.vn/kf/S2b6b2b5c5ea54311aabe7e0c072bb67bj.jpg,GlobalWonderShop,Suits,https://www.lazada.vn/products/pdp-i3176815711.html
"Bộ Vest Nam Thời Trang Công Sở 2024 Mới, Kiểu Liền Thân Hai Mảnh, Phong Cách Lịch Lãm, Chất Liệu Polyester Cao Cấp, Size M-5XL",1626000,2114000,,,https://filebroker-cdn.lazada.vn/kf/Sda57cccb444c4d0da234e3fa395aa977n.jpg,GlobalLifestyle,Suits,https://www.lazada.vn/products/pdp-i3269024704.html
"Bộ Hai Mảnh Màu Trơn Cổ Cao Thanh Lịch Dành Cho Nữ, Thiết Kế Viền Hoa Mùa Xuân Thu, Quần Ống Rộng, Thời Trang Công Sở",573000,745000,,,https://filebroker-cdn.lazada.vn/kf/S635ef360e9ce4aa3b43a1dac25946544H.jpg,GlobalWonderShop,Suits,https://www.lazada.vn/products/pdp-i3235882127.html
"Bộ Jumpsuit Hai Mảnh Đính Đá Sang Trọng Quyến Rũ Dành Cho Nữ, Chất Lượng Cao Cấp, Kiểu Dáng Độc Đáo, Thích Hợp Cho Mùa Xuân Hè",913000,1187000,,,https://filebroker-cdn.lazada.vn/kf/Sf27d8921408b49bf9d00adcf1f0fdb430.jpg,GlobalWonderShop,Suits,https://www.lazada.vn/products/pdp-i3231708013.html
"Bộ Đồ Hai Mảnh Nữ Kiểu Dáng Rộng Rãi, Tay Dài, In Sọc, Phong Cách Đông Nam Á, Thoải Mái, Quần Ống Thẳng, Thời Trang",451000,587000,,,https://filebroker-cdn.lazada.vn/kf/S07fe366b61f54ace94cd8efb3585daecs.jpg,GlobalWonderShop,Suits,https://www.lazada.vn/products/pdp-i3233735237.html
"Bộ Đồ Nữ Hai Mảnh Màu Trơn, Quần Ống Rộng Chất Liệu Polyester, Thời Trang Xuân Hè, Kiểu Dáng Đơn Giản, Cài Khuy Đơn.",529000,688000,,,https://filebroker-cdn.lazada.vn/kf/Sfea0d101699c4f5282c8a398eb75c6566.jpg,GlobalWonderShop,Suits,https://www.lazada.vn/products/pdp-i3164415134.html
"Bộ Đồ Nữ Hai Mảnh Kiểu Thường Với Áo Vest Cài Khuy Vàng Và Quần Dài, Chất Liệu Polyester Thoải Mái, Thời Trang, Phong Cách Năng Động.",564000,734000,,,https://filebroker-cdn.lazada.vn/kf/S8c64344c7e2d402498dc3b93b150a0d3B.jpg,GlobalWonderShop,Suits,https://www.lazada.vn/products/pdp-i3271949905.html
"Bộ Đồ Nam Hai Mảnh Kiểu Thường Có Cổ Thêu, Tay Dài, Chất Liệu Polyester, Thời Trang Mùa Xuân Thu, Quần Dài Thoải Mái",720000,936000,,,https://filebroker-cdn.lazada.vn/kf/Sf78ffa5f560a4e49b0a9ad64cf342daax.jpg,GlobalWonderShop,Suits,https://www.lazada.vn/products/pdp-i3258383814.html
"Bộ Trang Phục Nữ Màu Trắng 2 Mảnh Gồm Áo Khoác Blazer Cổ Chữ V Sâu Và Quần Ống Rộng Lưng Cao, Phong Cách Thanh Lịch Mùa Xuân, Trang Phục Công Sở, Thời Trang Đường Phố, Chất Liệu Polyester Spandex",827000,1075000,,,https://filebroker-cdn.lazada.vn/kf/S22162d0f44214917969234417db07952f.jpg,GlobalLifestyle,Suits,https://www.lazada.vn/products/pdp-i3270170453.html
"Bộ Đồ Nữ Mùa Hè Hai Mảnh Thời Trang, Áo Kiểu Cổ Yếm Gợi Cảm Với Quần Công Sở Chất Liệu Polyester, Chất Liệu Sợi Polyester Thời Trang, Hàng Có Sẵn.",525000,682000,,,https://filebroker-cdn.lazada.vn/kf/S41142bcf13dd4133b49eac617d1e3ab2V.jpg,GlobalWonderShop,Suits,https://www.lazada.vn/products/pdp-i3232097243.html
"Bộ Trang Phục Nữ Hai Mảnh Tay Chuồn Chuồn, Kiểu Dáng Thanh Lịch, Mặc Đi Dự Tiệc, Thích Hợp Cho Mùa Xuân, Hè, Thu",560000,728000,,,https://filebroker-cdn.lazada.vn/kf/Sd23a9b2dfc1844399a2da81aa373c59cD.jpg,GlobalWonderShop,Suits,https://www.lazada.vn/products/pdp-i3232180068.html
"Bộ Quần Áo Nữ Mùa Hè Chất Liệu Polyester, Kiểu Dáng Thanh Lịch, Màu Trơn, Quần Dài, Thiết Kế Hai Mảnh, Có Phần Vá Vai, Thích Hợp Đi Làm.",569000,739000,,,https://filebroker-cdn.lazada.vn/kf/S3423939a54bc43f8aa5cdffcf68afc850.jpg,GlobalWonderShop,Suits,https://www.lazada.vn/products/pdp-i3261725189.html
Người Đàn Ông Của 3Mm/1.5Mm đồ bơi cao su tổng hợp áo khoác lặn Tay áo dài Lặn Top Lặn Quần áo quần lặn Scuba Surf Freediving Áo Tắm,519719,899616,5.0,26,https://my-live-02.slatic.net/p/343ce7e658be7b411f310cf39a689c3c.jpg,KUASHI,Suits,https://www.lazada.vn/products/pdp-i2301240829.html
Bộ đồ hai mảnh CHANGTONG cổ tròn dệt kim phong cách Pháp thu đông 2025,439000,613000,4.888888888888889,9,https://filebroker-cdn.lazada.vn/kf/S2f36ae1ca8dc4180aea67a76ec253ebfc.jpg,Changtong Fashion,Suits,https://www.lazada.vn/products/pdp-i3181576531.html
LOMOGI Bộ Đồ Dáng Rộng Cỡ Lớn Cho Nữ Bộ Đồ Hai Mảnh Áo Len + Quần Học Sinh Mùa Thu Đông Hàn Quốc,201993,294355,,,https://my-live-02.slatic.net/p/012a96075d98468e11f666edce111fb6.jpg,LOMOGI Official Store,Suits,https://www.lazada.vn/products/pdp-i1544893633.html
"Bộ Đồ Thể Thao Ba Món Phong Cách Hàn Quốc, Kiểu Ngọt Ngào, Đường Phố, Năng Động, Dáng Rộng, Chất Liệu Thoải Mái, Có Khóa Kéo, Thời Trang Mùa Xuân Thu",174000,226000,,,https://filebroker-cdn.lazada.vn/kf/S153c976c3c6249c0afe574c644b531a1K.jpg,GlobalWonderShop,Suits,https://www.lazada.vn/products/pdp-i3208932576.html
"Bộ Thời Trang Linen Cao Cấp, Phong Cách Thường Ngày - Trang Phục Mùa Hè Thanh Lịch Với Áo Sơ Mi Và Quần Short Độc Lập, Thiết Kế Xuyên Biên Giới",526000,684000,,,https://filebroker-cdn.lazada.vn/kf/Sca7d6670ff854f9bb617346d4a2ef0dd5.jpg,GlobalWonderShop,Suits,https://www.lazada.vn/products/pdp-i3240378379.html
"Bộ Vest Công Sở Nữ YR6810, Kiểu Liền Thân, Quần Dài, Thiết Kế Ôm Dáng, Có Túi, Khuy Cài Một Nút.",441000,573000,,,https://filebroker-cdn.lazada.vn/kf/S3e035cbdcf184cc09ef17619645a7379K.jpg,GlobalWonderShop,Suits,https://www.lazada.vn/products/pdp-i3242691417.html
Bộ Đồ Nữ Công Sở Ba Món Dáng Ôm Mùa Hè Thời Trang Màu Trơn Quần Ống Rộng Kiểu Dáng Hiện Đại Thanh Lịch,395000,514000,,,https://filebroker-cdn.lazada.vn/kf/S6696231c0ea0402f865a4b9e3cdc2d49X.jpg,GlobalWonderShop,Suits,https://www.lazada.vn/products/pdp-i3258363964.html
"Bộ Quần Áo Nữ Sang Trọng Không Tay Mùa Thu 2025, Gồm Áo Quây Và Áo Vest Thanh Lịch, Quần Ống Thẳng Chất Liệu Polyester",513000,667000,,,https://filebroker-cdn.lazada.vn/kf/Sa4aa7d21ac79411e8286011ec5740903N.jpg,GlobalWonderShop,Suits,https://www.lazada.vn/products/pdp-i3271734043.html
"Bộ Trang Phục Hai Mảnh Phong Cách Mỹ Giản Dị Dành Cho Nữ, Chất Liệu Polyester, Màu Trơn, Dành Cho Mùa Thu Đông, Thời Trang.",337000,438000,,,https://filebroker-cdn.lazada.vn/kf/Sb1c8f478bfa8467fa07de27f03a67c4aU.jpg,GlobalWonderShop,Suits,https://www.lazada.vn/products/pdp-i3250120070.html
"Bộ Trang Phục Công Sở Nữ Kiểu Tây Sang Trọng Xuân Hè 2024 Cao Cấp, Gồm Quần Và Áo Khoác, Phong Cách Quý Cô Văn Phòng",303000,394000,,,https://filebroker-cdn.lazada.vn/kf/S01c3684fbcc248b1ad8873c010cecf974.jpg,GlobalWonderShop,Suits,https://www.lazada.vn/products/pdp-i3228127157.html
"Bộ Đồ Nam Mùa Hè Thường Ngày 2 Mảnh, Áo Cardigan Ngắn Tay Có Cổ Và Quần Short, Trang Phục Công Sở Đa Năng Cho Mọi Dịp",411000,534000,,,https://filebroker-cdn.lazada.vn/kf/S3c91217c14134461bcb33c111bf367cc8.jpg,GlobalWonderShop,Suits,https://www.lazada.vn/products/pdp-i3262740499.html
"Bộ Quần Áo Công Sở Nam Thường Ngày, Áo Sơ Mi Dài Tay Và Quần, Màu Trơn, Hai Túi, Kiểu Cardigan Mở, Hai Mảnh, Phong Cách Mùa Thu",514000,667000,,,https://filebroker-cdn.lazada.vn/kf/Sf05bc0ca6f9a487a9b0e7dad276a71416.jpg,GlobalWonderShop,Suits,https://www.lazada.vn/products/pdp-i3270043826.html
"Bộ Đồ Thể Thao Nữ Thời Trang, Áo Khoác Cardigan Cổ Đứng, Quần Ống Rộng, Hai Mảnh, Kiểu Dáng Hiện Đại, Tôn Dáng, Thu Đông 2025, Mẫu Mới",328000,426000,,,https://filebroker-cdn.lazada.vn/kf/Sfee36a5bf94f44f69e57c4d012d79cf1i.jpg,GlobalWonderShop,Suits,https://www.lazada.vn/products/pdp-i3262777187.html
Bộ Đồ Nữ Màu Xám Thanh Lịch Áo Khoác Phong Cách Phương Tây Quản Lý Kinh Doanh Quần Áo Bảo Hộ Lao Động Bộ Quần Dài Chuyên Nghiệp,529000,687000,,,https://filebroker-cdn.lazada.vn/kf/S2b520509c33f4a07aeb15ffcc3cfb46da.jpg,GlobalWonderShop,Suits,https://www.lazada.vn/products/pdp-i3239178287.html
Bộ Quần Ống Rộng Lưng Cao Slim Fit Bộ Quần Áo Ba Mảnh Thời Trang Giản Dị Bộ Đồ Thể Thao Nhẹ Cho Mùa Xuân Thu,335000,435000,,,https://filebroker-cdn.lazada.vn/kf/S1854e71cc44840409b81a917dff11f74F.jpg,GlobalWonderShop,Suits,https://www.lazada.vn/products/pdp-i3265666515.html
Bộ Đồ Hai Mảnh Gồm Quần Âu Trơn Và Áo Cardigan Dáng Rộng Tay Dài - Có Hàng Từ Trung Quốc Đại Lục,367000,477000,,,https://filebroker-cdn.lazada.vn/kf/S2c1e94931ecc4ff696507b52a463c43br.jpg,GlobalWonderShop,Suits,https://www.lazada.vn/products/pdp-i3234691741.html
"Bộ Trang Phục Nữ Thời Trang Màu Trơn, Kiểu Dáng Khoét Tim, Gồm Áo Vest Và Quần, Phong Cách Thường Ngày Mùa Xuân Hè, Chất Liệu Sợi Polyester, Bộ Đồ Phối Hợp.",365000,475000,,,https://filebroker-cdn.lazada.vn/kf/S28f53e009d3d4461b02f6a617cca45efk.jpg,GlobalWonderShop,Suits,https://www.lazada.vn/products/pdp-i3250132007.html
Bộ Đồng Phục Học Sinh Mùa Hè Ba Mảnh Màu Xanh Nhạt/xám Bộ Trang Phục Thể Thao Dành Cho Học Sinh Trung Học Bộ Đồ Lớp Học Trung Học Cơ Sở Có Áo Khoác Và Quần Short,355000,462000,,,https://filebroker-cdn.lazada.vn/kf/Sadcef64382c5425783f15f36552d6a55R.jpg,GlobalWonderShop,Suits,https://www.lazada.vn/products/pdp-i3233592514.html
"Bộ Thời Trang Nam Dân Tộc Châu Phi Mới 2025 Phong Cách Thêu Độc Lập, Kiểu Dáng Đô Thị, Bộ Vest Thường Ngày, Bán Chạy Xuyên Biên Giới",681000,886000,,,https://filebroker-cdn.lazada.vn/kf/S7a177e701fdd4573a2d253ed33eb2328y.jpg,GlobalWonderShop,Suits,https://www.lazada.vn/products/pdp-i3264787201.html
"Bộ Quần Áo Hai Mảnh Thời Trang Cao Cấp Mùa Xuân 2025, Kiểu Dáng Thanh Lịch, Chất Liệu Polyester, Thiết Kế Quần Cạp Cao Phối Hạt Ba Màu, Phong Cách Công Sở.",397000,517000,,,https://filebroker-cdn.lazada.vn/kf/Se1daa4cc83b74c2bbea8279cace6fa236.jpg,GlobalWonderShop,Suits,https://www.lazada.vn/products/pdp-i3240440319.html
"Bộ Đồ Nữ Xuân Hè 2024 Phong Cách Hàn Quốc - Set 2 Món Gồm Quần Ống Loe Lưng Cao Mềm Mại & Áo Kiểu Ngọt Ngào Cá Tính, Thích Hợp Cho Trang Phục Thường Ngày",388000,504000,,,https://filebroker-cdn.lazada.vn/kf/S09377a6af69248049b4d2e99b957e92em.jpg,GlobalWonderShop,Suits,https://www.lazada.vn/products/pdp-i3264742602.html
"Bộ Đồ Thu Đông Nữ Dongdaemun Hàn Quốc, Áo Kiểu Viền Kim Loại & Áo Gile Hai Mảnh, Phong Cách Nhỏ Gọn, Áo Len Cổ Tròn",365000,474000,,,https://filebroker-cdn.lazada.vn/kf/S3194cef15d384bcc947324be1ec45ebc1.jpg,GlobalWonderShop,Suits,https://www.lazada.vn/products/pdp-i3264768465.html
"Bộ Thời Trang Đường Phố Nữ Zadata Với Áo Vest Xếp Ly Eo Thon Và Quần Dài, Chất Liệu Polyester, Dành Cho Mùa Hè.",403000,524000,,,https://filebroker-cdn.lazada.vn/kf/S3ff60525274541dc9955543692bec462V.jpg,GlobalWonderShop,Suits,https://www.lazada.vn/products/pdp-i3234947349.html
"Bộ Thời Trang Đường Phố Nữ Zadata, Áo Khoác Và Quần Thêu Rỗng, Chất Liệu Sợi Polyester, Xuất Xứ Trung Quốc",493000,641000,,,https://filebroker-cdn.lazada.vn/kf/S80129a7f85174240b7aba3096257b566y.jpg,GlobalWonderShop,Suits,https://www.lazada.vn/products/pdp-i3270410218.html
"Bộ Trang Phục Thời Trang Thu Sớm Phong Cách Hàn Quốc Dành Cho Nữ, Thiết Kế Sang Trọng, Chất Liệu Polyester Hoàn Toàn, Thích Hợp Cho Mùa Thu/đông",437000,568000,,,https://filebroker-cdn.lazada.vn/kf/S428c65ee7a604707a02a1bc171efb098u.jpg,GlobalWonderShop,Suits,https://www.lazada.vn/products/pdp-i3264807273.html
"Bộ Đồ Thể Thao Nam Ôm Dáng, Chất Liệu Thoáng Khí, Hai Mảnh, Màu Trơn, Thoải Mái, Thích Hợp Mặc Ở Nhà Và Văn Phòng, Quần Thể Thao Đa Năng",712000,925000,,,https://filebroker-cdn.lazada.vn/kf/Sba89907e5ff1422d88b4d34adead0fd7N.jpg,GlobalWonderShop,Suits,https://www.lazada.vn/products/pdp-i3251817467.html
"Bộ Thời Trang Thu Đông Nữ Ba Món Phong Cách Châu Âu, Quần Ống Đứng Và Áo Vest Phối Hợp, Sáng Bóng Và Bắt Mắt",504000,655000,,,https://filebroker-cdn.lazada.vn/kf/Scc65ec8653dd45888b978c88033c87cbF.jpg,GlobalWonderShop,Suits,https://www.lazada.vn/products/pdp-i3259518457.html
"Bộ Đồ Hai Mảnh Phong Cách Hàn Quốc Dành Cho Nữ, Kiểu Dáng Vest Thanh Lịch Và Quần Ống Rộng, Phù Hợp Với Mọi Mùa, Thời Trang Cá Tính.",463000,602000,,,https://filebroker-cdn.lazada.vn/kf/S7edd8513689a412995f2356fde78167bA.jpg,GlobalWonderShop,Suits,https://www.lazada.vn/products/pdp-i3273941536.html
"Bộ Áo Len Cổ Polo Phối Màu Và Quần Ống Rộng Mùa Đông Dày Dặn, Thời Trang, Thiết Kế Hai Mảnh",619000,804000,,,https://filebroker-cdn.lazada.vn/kf/Se7a5f2c89d564ecdb7bab9d631779eefY.jpg,GlobalWonderShop,Suits,https://www.lazada.vn/products/pdp-i3266846534.html
"Bộ Trang Phục Hai Mảnh Kiểu Hàn Quốc Thời Trang Thu Đông, Áo Khoác Dài Tay Thanh Lịch, Chất Liệu Polyester, Dáng Dài.",494000,643000,,,https://filebroker-cdn.lazada.vn/kf/S6567d6dc863f4e88bfef95ce1f2a351eb.jpg,GlobalWonderShop,Suits,https://www.lazada.vn/products/pdp-i3269246206.html
"Bộ Trang Phục Nữ Phong Cách Đường Phố, Màu Trơn, Tay Dài, Quần Dài, Thiết Kế Nút Thắt Thời Trang, Thanh Lịch, Sang Trọng.",510000,663000,,,https://filebroker-cdn.lazada.vn/kf/S9ea01558d12543afb44924d6755718e5a.jpg,GlobalWonderShop,Suits,https://www.lazada.vn/products/pdp-i3266923030.html
"Bộ Đồ Thể Thao Phong Cách Hàn Quốc Chống Lão Hóa, Thiết Kế Áo Khoác Và Quần Ống Rộng, Chất Liệu Thoải Mái, Thời Trang Thu Đông Hai Mảnh.",593000,771000,,,https://filebroker-cdn.lazada.vn/kf/Sffa56165da66421088c4fbb8237faf34u.jpg,GlobalWonderShop,Suits,https://www.lazada.vn/products/pdp-i3274037398.html
"Bộ Thời Trang Nữ Ba Món Phong Cách Thường Ngày, Quần Dài Thoải Mái, Trang Phục Mùa Xuân Thu, Hàng Mới Về",557600,864000,,,https://filebroker-cdn.lazada.vn/kf/Sce4ef25b55424839aba94c29436cf3c1a.jpg,GlobalWonderShop,Suits,https://www.lazada.vn/products/pdp-i3201657220.html
"Bộ Đồ Nữ Thời Trang Hàn Quốc Mùa Xuân Thu, Kiểu Dáng Thoải Mái, Áo Dài Tay Cổ Cao Kèm Thắt Lưng, Quần Cạp Cao.",543000,706000,,,https://filebroker-cdn.lazada.vn/kf/Sa9afd814274c415090c7a21b9d4e12f9A.jpg,GlobalWonderShop,Suits,https://www.lazada.vn/products/pdp-i3252771102.html
Thời Trang Mùa Xuân Bộ Hai Mảnh Cạp Cao Phong Cách Hàn Quốc Dáng Rộng Vừa Vặn Váy Ngắn Và Áo Khoác Bộ Trang Phục Thanh Lịch Sang Trọng,538000,699000,,,https://filebroker-cdn.lazada.vn/kf/S14093acca01749d4b8364a82978958abf.jpg,GlobalWonderShop,Suits,https://www.lazada.vn/products/pdp-i3235723384.html
"Bộ Đồ Nữ Hai Mảnh Thời Trang Thu Đông, Áo Khoác Có Khóa Kéo & Quần Ống Rộng Lưng Cao, Chất Liệu Polyester Pha, Thanh Lịch Và Thoải Mái",549000,714000,,,https://filebroker-cdn.lazada.vn/kf/S9b34f9d4b4be4c30b25e8198e5c3052d9.jpg,GlobalWonderShop,Suits,https://www.lazada.vn/products/pdp-i3269276168.html
"Bộ Đồ Hai Mảnh In Họa Tiết Satin Thời Trang, Chất Liệu Polyester, Tay Dài, Kiểu Dáng Thường, Quần Regular Fit, Khuy Cài Đơn",718000,934000,,,https://filebroker-cdn.lazada.vn/kf/S111cbda2c6cb44bab0ce498fa467c674w.jpg,GlobalWonderShop,Suits,https://www.lazada.vn/products/pdp-i3232918204.html
"Bộ Đồ Thể Thao Cotton Pha Size Lớn Có Mũ, Thiết Kế Hai Mảnh, Kiểu Dáng Suông, Thoải Mái, Thời Trang, Thích Hợp Cho Mùa Thu",606000,787000,,,https://filebroker-cdn.lazada.vn/kf/S5661cd528a4d401fac7dd21b7b8d1b3ar.jpg,GlobalWonderShop,Suits,https://www.lazada.vn/products/pdp-i3240105950.html
"Bộ Đồ Hai Mảnh Giả Kiểu Dáng Thoải Mái, Thời Thượng, Cổ Tròn, Không Tay, Áo Rộng Rãi, Đa Năng, Thời Trang, Chất Liệu Lụa Mềm Mại Như Băng, Thích Hợp Cho Mùa Thu Đông",631000,820000,,,https://filebroker-cdn.lazada.vn/kf/Sd65aa5e1c68f4a9998540aa7864b05835.jpg,GlobalWonderShop,Suits,https://www.lazada.vn/products/pdp-i3277063715.html
"Bộ Đồng Phục Tiếp Viên Hàng Không Dành Cho Nam & Nữ, Trang Phục Chuyên Nghiệp Đường Sắt Tốc Hành, Chất Liệu Sợi Polyester, Kiểu Dáng Công Sở Mùa Đông Dành Cho Nữ",586000,761000,,,https://filebroker-cdn.lazada.vn/kf/S8695a6b660af401bad3443fa481847daX.jpg,GlobalWonderShop,Suits,https://www.lazada.vn/products/pdp-i3263935175.html
"Quần Lót Nữ Lưng Vừa Trơn Mềm Mại Freesize 40–55kg Thoáng Mát Thấm Hút Mồ Hôi, Nhiều Màu",6500,10400,4.956803455723542,463,https://vn-live-01.slatic.net/p/0bac0a83669d5e5ed942e3fe4ef8a1aa.jpg,doAUIT.Selection,Suits,https://www.lazada.vn/products/pdp-i2543188720.html
Swimsuits Bathing Suit for Women Thong Bottoms Bathing Swimsuits Universal for Teens Adults BH-VN,59000,118000,3.0,2,https://sg-test-11.slatic.net/p/b9c6cde60cd35a4f37f8e8f8c581eecc.jpg,bhfgbnm,Suits,https://www.lazada.vn/products/pdp-i3075400502.html
"Áo Bra Dán Nâng Ngực Silicon Cài Trước Hình Bàn Tay – Không Gọng, Gợi Cảm, Nâng Đẩy Tự Nhiên",8000,12000,4.913043478260869,897,https://vn-live-01.slatic.net/p/33a16063041fa15810164ae3758cd8e6.jpg,CZXC78.Selection,Suits,https://www.lazada.vn/products/pdp-i2538346242.html
"Quần Lót Nam 4 Góc Co Giãn Cao – Chất Vải Skin Pro Mềm Mại, Thoáng Khí, Mặc Cả 4 Mùa",9900,14900,4.928853754940712,253,https://vn-live-01.slatic.net/p/6c3ca4aca13223c5636acab79e462710.jpg,COCOEPPS CHOICE.VN,Suits,https://www.lazada.vn/products/pdp-i2521212552.html
Quần âu nam hàn quốc chống nhăn ống suông kiểu quần tây ống xuông cạp chun co giãn công sở ống rộng TF4,122426,230000,4.858669833729216,842,https://vn-live-01.slatic.net/p/b716434ae61d70157830e987c37ccabc.jpg,Thời Trang TF4,Suits,https://www.lazada.vn/products/pdp-i2345079552.html
"Vớ Dày Cho Nữ Mùa Thu Đông – Vớ Cao Qua Đầu Gối, Chống Trượt, Áp Lực Bắp Chân, Giữ Ấm Tối Ưu",7000,11200,4.948749237339841,3278,https://vn-live-01.slatic.net/p/1fb2ac7df83efe26ad52dbc8dde507c5.jpg,d3odSmYq.Selection,Suits,https://www.lazada.vn/products/pdp-i2509544171.html
"STAR FRUIT Tất Cổ Trung Unisex Dành Cho Mùa Xuân, Hè Và Thu - Chống Hôi, Hút Ẩm Và Thở Dễ Dàng",7500,47000,5.0,14,https://sg-test-11.slatic.net/p/aee53629212e65613a2567aa29c1cb1d.png,STAR FRUIT Shopping Mall,Suits,https://www.lazada.vn/products/pdp-i3130197293.html
"COMBO 10 ĐÔI Vớ Tất Cổ Ngắn ZARA Kháng Khuẩn, Khử Mùi Cực Tốt",34202,34900,4.87012987012987,154,https://vn-live-01.slatic.net/p/9da509443a7d52b5108d15a960c2ccfd.jpg,Kho Sỉ 247,Suits,https://www.lazada.vn/products/pdp-i2248547798.html
"Máy Sấy Giày Khử Mùi Shoe Dayer Xoay 360 Độ Làm Khô Giày Khử Mùi Hôi, Diệt Vi Khuẩn Xoay Chiều 360 Độ Khô Siêu Nhanh",128500,294000,4.922155688622754,167,https://vn-test-11.slatic.net/p/4fc23d4101a51b85e9e511ccfe311688.jpg,ALizz_Gia Dụng T2h,Suits,https://www.lazada.vn/products/pdp-i3146489904.html
COMBO 5 QUẦN NGỦ NAM NỮ VAZCO Q27 CHẤT LIỆU THUN COTTON CO GIÃN,139000,225000,4.891651865008881,2815,https://filebroker-cdn.lazada.vn/kf/S28484387483441fcb991b07a15b0e6ab4.jpg,VAZCO SHOP,Suits,https://www.lazada.vn/products/pdp-i2590267794.html
Bodysuit Ren Hở Đũng Sexy Đồ Ngủ Suit Quyến Rũ - B46,96824,175000,4.9,20,https://vn-live-01.slatic.net/p/c30e979f736616faf16696c067c895cf.jpg,HuỳnhFashion6807,Suits,https://www.lazada.vn/products/pdp-i2197465136.html
"Bộ 10 Đôi Tất Vớ Nam Cổ Ngắn, Vớ Nam T&T Trịnh Trung Hàng VNXK Dày Đẹp Kháng Khuẩn, Khử Mùi Hôi Tại LẺ GIÁ SỈ TOÀN QUỐC 789",37440,59000,4.900889453621347,3148,https://vn-live-01.slatic.net/p/0c8485fec6e0add4d56a442a49d3266b.jpg,LẺ GIÁ SỈ TOÀN QUỐC 789,Suits,https://www.lazada.vn/products/pdp-i1254692133.html
【Limited Time Only】 Darling Franxx Asuka 02 Rocket Girl Dakii Ayanami Rei Cosplay Costume Women Halloween Jumpsuits Zentai Suit Bodysuit,488578,660285,5.0,1,https://sg-test-11.slatic.net/p/49125228b41010df56dfbc492410a671.jpg,Jomu,Suits,https://www.lazada.vn/products/pdp-i2572862124.html
"Combo 10 tất nam cổ cao cotton, vớ nam co dãn tốt êm chân, thoáng khí, hút ẩm tốt",62720,107000,4.911877394636015,261,https://vn-live-01.slatic.net/p/47004873fc051b5d54fa9f4d0f5731e3.jpg,Yody Women,Suits,https://www.lazada.vn/products/pdp-i1743246106.html
Quần tất nữ lót lông giữ nhiệt màu da đen dày đẹp mùa đông siêu ấm YUKI STORE 1443,68000,114000,4.963636363636364,330,https://vn-live-01.slatic.net/p/a025fcf8bdb65e8b4fbdf79085279547.jpg,yuki store 1598876181,Suits,https://www.lazada.vn/products/pdp-i2031957785.html
"(Miễn Phí Vận Chuyển Trên 50K)This is a free gift, please do not place a separate order. Thank you.",900,2000,4.62509117432531,1371,https://sg-test-11.slatic.net/p/e2f7f555291e55e7e50e6ce996b942ba.jpg,Lefflow Shopping Mall,Suits,https://www.lazada.vn/products/pdp-i2671606665.html
"CharmStore - Set 4 quần lót đùi chip đùi bé trai 10-40kg (2-12tuổi) cotton cao cấp co dãn thoải mái mềm mịn, nhiều mẫu cực đẹp cho bé",83880,160000,4.993920972644377,328,https://vn-live-01.slatic.net/p/5cd1d74c5a654a3b03de7e8aa6e7a4b4.jpg,CharmStoreByDP,Suits,https://www.lazada.vn/products/pdp-i2531604074.html
[NOUS Premium] Bộ Bodysuit Cho Bé Phong Cách Noel và Năm Mới 2025 Chất Petit Dày Cao Cấp Cho Bé Trai Từ 0-7 tuổi,389000,425000,,,https://vn-live-01.slatic.net/p/770ee70a85826b2ae2491589398850f1.png,Mom & Home - Mẹ Bé HCM,Suits,https://www.lazada.vn/products/pdp-i3255678878.html
"Bộ Body Định Hình Liền Mạch Nâng Mông & Eo – Thon Gọn Tức Thì, Tự Tin Tỏa Sáng",39000,50700,4.953804347826087,368,https://vn-live-01.slatic.net/p/9abce4ebe1e6e0197ab6c2e2c8f4174b.jpg,d3odSmYq.Selection,Suits,https://www.lazada.vn/products/pdp-i2509284946.html
"Váy ngủ nữ sexy kiểu ren đuôi cá 2 dây xuyên thấu kèm quần lót lọt khe siêu gợi cảm, quyến rũ Kb01",39000,,4.85378590078329,383,https://filebroker-cdn.lazada.vn/kf/Sb9eb3cf8f5e443dba96bd4032b18d5adu.jpg,DONNA,Suits,https://www.lazada.vn/products/pdp-i2346752809.html
