ten_san_pham,gia_sale,gia_goc,rating,so_review,link_anh,shop,category,url_san_pham
WOMA Mao phù hợp với nam trung niên và người cao tuổi cha áo khoác thường nhật mỏng nam,110000,220000,,,https://sg-test-11.slatic.net/p/f55aab8ac950a3fbd3ed88287510a612.png,Magic world,Suits,https://www.lazada.vn/products/pdp-i2907571279.html
ZHENGYU | Bộ Đồ Chống Nước cho Người Giao Hàng và Người Đi Xe Đạp Thành Niên,392000,622000,4.869565217391305,35,https://filebroker-cdn.lazada.vn/kf/S78a477f007df441c83f4556edeb8fedag.jpg,KEYRU Specialty Store,Suits,https://www.lazada.vn/products/pdp-i3184177743.html
Áo mưa 1 người lớn Nam Nữ KOJMAC Raincoat Fashion 1m2 & 1m4 ( Bộ đồ măng tô chống thấm nước thời trang cặp đôi .. cbmua ) ChuanMua GDA218,102600,149099,4.688888888888889,45,https://sg-live-01.slatic.net/p/f3657286c01e62f12806c310f2ee9b1a.jpg,CHUẨN MUA - SIÊU KHO PHỤ KIỆN,Suits,https://www.lazada.vn/products/pdp-i1774815774.html
BILLI ZILLY | Dây Nịt Da Thời Trang cho Đầm Áo Khoác Quần Vest Sweaters,122000,252000,4.461538461538462,13,https://filebroker-cdn.lazada.vn/kf/Sd5e150febaf24eeea44c96032c85a057N.jpg,BILLI ZILLY Fashion,Suits,https://www.lazada.vn/products/pdp-i3194566583.html
Áo bóng rổ nam nữ Lakers – Bộ quần áo thi đấu bóng rổ đẹp,154000,258000,5.0,13,https://vn-live-01.slatic.net/p/108b465904ab6a19b7ea07aa865a4e41.jpg,Man_Sport942,Suits,https://www.lazada.vn/products/pdp-i2337261343.html
"Bộ quần áo bò chống cháy, quần áo jean thợ điện, thợ hàn, chống nóng cách nhiệt cách điện quần áo bảo hộ lao động SafeMall - Hàng Chính Hãng SafeMall/Safety Mart Official",330150,632500,4.8108108108108105,37,https://sg-live-01.slatic.net/p/d6a7fa40c7e2d923bc179f1b57a17d5c.png,Siêu Thị SafeMall,Suits,https://www.lazada.vn/products/pdp-i1826825016.html
Bộ Đồ Thể Thao Thường Ngày Mùa Thu Đông Mềm Mại Dành Cho Nữ Bộ Đồ Hai Mảnh Có Mũ Trùm Đầu Bằng Polyester Dài Tay,311000,768000,,,https://filebroker-cdn.lazada.vn/kf/Scd324b90b1874208b0c5b0297a367c87Q.jpg,Lazada Global,Suits,https://www.lazada.vn/products/pdp-i3098748696.html
Zanzea Bộ đồ 2 món cho nữ váy dài xếp li Áo Ba Lỗ Cổ Chữ V không tay thường ngày bộ trang phục thanh Lịch #0805,264520,529040,,7,https://sg-test-11.slatic.net/p/61ce859aa2b70571bddbfd66e2cedb48.jpg,ZANZEA,Suits,https://www.lazada.vn/products/pdp-i2740877851.html
TCU Style BDU Version RG Ranger Green Military Green Training Suit Old School Field Trip Combat Uniform Set Cotton Polyester,645000,,,,https://filebroker-cdn.lazada.vn/kf/Sad49bb4b31c54005a9ea8a7a967d65df2.jpg,Lazada Global,Suits,https://www.lazada.vn/products/pdp-i3206401300.html
【Unbeatable Prices】 Game Undertale Xtale Cross Sans Cosplay Costume Full Set With Collar Halloween Party Outfit White Suit,962011,990000,5.0,0,https://laz-img-sg.alicdn.com/p/aa24ac685391b33f4ced6b04a2dda4a6.jpg,Shop2Home mall,Suits,https://www.lazada.vn/products/pdp-i3149952328.html
Sexy Cosplay Maid Suit Women's Restrained Style Sexy Edge Set Night Color Secret out Uniform 2025 Spring Season Ladies' Delight,244000,,,,https://filebroker-cdn.lazada.vn/kf/Sc17a8e706efb44d5bfc2ca87aa33f3eeh.jpg,TB FASHION STORE,Suits,https://www.lazada.vn/products/pdp-i3001697441.html
Bộ Đồ Hai Mảnh Phong Cách Dân Tộc Mùa Hè Cho Nam Áo Len Cardigan Tay Ngắn Thường Ngày Cổ Tròn Thời Trang Hanfu Tang Phục,397000,655000,,16,https://filebroker-cdn.lazada.vn/kf/S66da2067dc6d47109f5fe35c2266f6fcX.jpg,TB FASHION STORE,Suits,https://www.lazada.vn/products/pdp-i2997310448.html
Áo Khoác Vest Đồng Phục Trường Tư Thục Màu Xám Cho Nữ Mùa Đông Kawasaki Nakano Áo Khoác Ngoài Dài Tay Cổ Vest Polyester,821700,913000,5.0,1,https://filebroker-cdn.lazada.vn/kf/S05d28ecf4afc497b9b98f95dc6330280r.jpg,TAO  Women's Fashion Collections,Suits,https://www.lazada.vn/products/pdp-i3269017406.html
"Bộ vest nam Hàn Quốc 6 cúc, Bộ suit nam cao cấp 6 nút chất vải sịn sò",945000,1300000,5.0,1,https://vn-live-01.slatic.net/p/93775946c3f740893e58e16b25bda32a.jpg,Bộ Vest Nam Cao Cấp,Suits,https://www.lazada.vn/products/pdp-i1693909845.html
Zanzea phong cách Hàn Quốc Phụ nữ hai mảnh trang phục thanh lịch V cổ áo ngắn tay loog váy đồng bằng OL phù hợp với #0915,256000,513358,5.0,1,https://sg-test-11.slatic.net/p/892c1a3d5869bdd52fca973d3293ac0a.jpg,ZANZEA,Suits,https://www.lazada.vn/products/pdp-i3193831406.html
【Sell-Well】 Girls Costume Summer Children Hop Costume Streetwear Set Jazz Performance Costume Girls Fashion Suit,632578,823030,,,https://ae01.alicdn.com/kf/Sfbfe008bf7f54d26bdb425f6230a3686G.jpg,Qilulushop,Suits,https://www.lazada.vn/products/pdp-i3275878976.html
Bộ Áo Blazer khâu màu sắc Dài Tay Ve áo phong cách incerun cho Nam Bộ hai món #0901,544458,1258864,,,https://sg-test-11.slatic.net/p/282de03ebd694b4fa81cf39e0a536bfe.jpg,INCERUN Official Store,Suits,https://www.lazada.vn/products/pdp-i3182981250.html
Bộ Đồ Công Sở Đen Cho Phụ Nữ,834000,5525000,4.824858757062147,184,https://filebroker-cdn.lazada.vn/kf/Sfbe96016f3c241a68f8035f86dc72ed9q.jpg,DAGASS,Suits,https://www.lazada.vn/products/pdp-i3210909112.html
XITAO  Black  Pants Sets Irregular Patchwork V-neck Collar Sleeveless Top Wing Leg Pants Two Pieces Sets Autumn ZZ0063,603895,999990,5.0,8,https://sg-test-11.slatic.net/p/d33bc664034f3aa92b12007ddd7fcf69.jpg,XITAO Store,Suits,https://www.lazada.vn/products/pdp-i2477700216.html
OAK FAMILY | Bộ Đồ Bò Cho Bé Hình Tam Giác Bao Tã Unisex Cotton,569000,1124000,4.87962962962963,124,https://filebroker-cdn.lazada.vn/kf/S875ce24d67184cd48ce13361bb50780f2.jpg,Oak Family,Suits,https://www.lazada.vn/products/pdp-i3186532968.html
Hanlu áo khoach nam áo khoác nam bomber áo khoác gió nam cao cấp Phong cách áo khoác Jacket đẹp trai ve áo áo khoác của nam giới áo khoác lỏng giản dị áo quần áo chạy mô tô áo khoác dù,255000,560000,5.0,253,https://my-live-02.slatic.net/p/7879598c7632d246d067ef930158a46f.jpg,Hanlu Style,Suits,https://www.lazada.vn/products/pdp-i2390992398.html
Bộ quần áo lặn liền thân  Slinx 5mm,1851300,1990000,5.0,2,https://vn-live-01.slatic.net/p/1cb0822740258fbedd510be5a916a2d5.jpg,Bachvietsh,Suits,https://www.lazada.vn/products/pdp-i208094662.html
Mùa thu cho nữ ZANZEA trang phục thanh lịch Tay áo dài ve áo blazer DRESS Áo Vest quần dài văn phòng 2 mảnh Bộ OL Tracksuit #1008,351000,731386,,,https://sg-test-11.slatic.net/p/4487b6f330720d0f21da5358c157ddbf.jpg,ZANZEA,Suits,https://www.lazada.vn/products/pdp-i3211665214.html
STELLA High Quality Black Silk Nun Suit Cosplay Uniform Set Women's One-Piece Underwear Nighttime Sexy Lingerie Cosplay Costume,876000,,,6,https://filebroker-cdn.lazada.vn/kf/Scd3c790d66b64caba59acb55e8fb62ffc.jpg,TB FASHION STORE,Suits,https://www.lazada.vn/products/pdp-i2850050741.html
FULLBELIEF | Bộ Đồ Tập Yoga Leotard Cho Người Lớn Nữ Cao Hông,522000,,4.333333333333333,3,https://filebroker-cdn.lazada.vn/kf/Sb01bb0c663f34943b7458d1895ff3082D.png,FULLBELIEF,Suits,https://www.lazada.vn/products/pdp-i3193656708.html
KMX Camouflage Tactical Outdoor Suit Coverall Long Pants Unisex Polyester Four Seasons Military Style Training Jacket,810000,900000,5.0,1,https://filebroker-cdn.lazada.vn/kf/Sf5ec6c5a2d5b46fd893b0db2de18b8ebI.jpg,Lazada Global,Suits,https://www.lazada.vn/products/pdp-i3224812727.html
2023 New Fashion version ZOOT men's short-sleeved triathlon summer cycling jumpsuit 2023 new mountain bike riding suit,805198,,,,https://vn-live-01.slatic.net/p/5c1b6ade73475676d3847ebbd6c8039e.jpg,xmupq,Suits,https://www.lazada.vn/products/pdp-i2408997708.html
Balabala Bộ đồ một mảnh cho trẻ em áo liền quần mùa thu Áo khoác ngoài mùa đông cho bé San hô lông cừu 2024 mới,724000,930000,,,https://my-live-01.slatic.net/p/a73ea3cd5327a010d2a532ac5eaecea7.jpg,Balabala Official Store,Suits,https://www.lazada.vn/products/pdp-i2827209652.html
Lordwey & Ouzo quần áo đi câu cao su Neoprene 3mm Bộ đồ lặn tự do khô nhanh chống nắng chống nóng chống nắng dày dặn chống nước chia đôi cho nam,2294947,4255237,,,https://sg-test-11.slatic.net/p/5708268924e0be08dca5a9876b5b158d.jpg,LORDWEY Sports,Suits,https://www.lazada.vn/products/pdp-i3216415034.html
Mùa thu cho nữ ZANZEA phù hợp với dài tay kiểu công sở ve áo blazer Quần dài ống đứng sọc OL làm việc Bộ #1103,371000,846072,,,https://sg-test-11.slatic.net/p/a5db4cb4e411684a8de5cda81c0b4e45.jpg,ZANZEA,Suits,https://www.lazada.vn/products/pdp-i3241965046.html
Sexy Maid Suit Cosplay Underwear Set for Women Role-playing Fun Time Sexy Edge Rubbing Outfit Autumn Collection 2024,244000,,,,https://filebroker-cdn.lazada.vn/kf/Sd36722b73bc64be38526ffdd9e160216r.jpg,TB FASHION STORE,Suits,https://www.lazada.vn/products/pdp-i2997576608.html
Bộ Đồ Vest Nữ Dáng Ôm Mùa Hè 2025 Phong Cách Hàn Quốc Thanh Lịch Bộ Đồ Hai Mảnh Thời Trang Công Sở Thường Ngày,552000,,,4,https://filebroker-cdn.lazada.vn/kf/S906554ea47ea439892a0be69429de2e8G.jpg,TB FASHION STORE,Suits,https://www.lazada.vn/products/pdp-i2947504798.html
"Bộ cộc tay cài vai BENTY BT004 in phi hành gia chất vải mềm mịn, đồ bộ cao cấp bé trai bé gái",101370,160000,4.962962962962963,107,https://vn-live-01.slatic.net/p/5e6d8bd4b683fd20f731744fd3bc4cc4.png,BENTY Kids Fashion,Suits,https://www.lazada.vn/products/pdp-i2301670406.html
Cameljeans Bộ đồ thể thao cho nữ mùa thu ôm vừa trang phục thể dục cổ đứng tay áo dài hai mảnh chống gió,845000,1200000,5.0,4,https://my-live-01.slatic.net/p/090ee047924848d25a8eb73e4e9ace8b.jpg,Cameljeans,Suits,https://www.lazada.vn/products/pdp-i2952724937.html
ZHENGYU | Bộ Áo Mưa Thoáng Khí Cho Đạp Xe 1 Bộ,404000,615000,4.866666666666666,15,https://filebroker-cdn.lazada.vn/kf/Sdb503a0e7a784c7fa7b5f62d5db98765d.jpg,KEYRU Specialty Store,Suits,https://www.lazada.vn/products/pdp-i3184150610.html
THÙNG SAU CỠ NHỎ PHÙ HỢP NHIỀU LOẠI XE ĐẶC BIỆT WIN 100CC - CÓ KÈM PAS VÀ ỐC ĐỂ LẮP ĐẶT,482000,505000,4.7,10,https://vn-live-01.slatic.net/p/06e58900f3be64f9e3e374fbcd0fc410.jpg,SUN Shop.,Suits,https://www.lazada.vn/products/pdp-i652170929.html
Balo chống gù Melody Cinnamon Kurumi cho bé gái đi học tiểu học nhiều ngăn họa tiết đáng yêu Xu Xu Kids,266000,532000,4.9,40,https://sg-test-11.slatic.net/p/4d0fe0f460619740de01a3a8fc7674e4.jpg,Great-King,Suits,https://www.lazada.vn/products/pdp-i2792061553.html
Bình ga cắm trại dã ngoại Iwatani 110g,99000,,5.0,1,https://vn-live-01.slatic.net/p/cb2bfc8236f8d71ed73235dd84368d5d.jpg,Shop điện dân dụng 1582008999,Suits,https://www.lazada.vn/products/pdp-i3201251117.html
Hộp Bóng Bàn Song Ngư Double Fish 6 Quả,135000,,4.96,25,https://filebroker-cdn.lazada.sg/kf/Sff96397ddfba4cec9e2dd22f72284249k.png,BÓNG BÀN PLANT VIET,Suits,https://www.lazada.vn/products/pdp-i2595111022.html
Vải Wool Zegna chuyên may Quần Tây - Suit - Vest,275000,,,,https://filebroker-cdn.lazada.vn/kf/S8a5cda627ead4894b50896223e557f23U.jpg,Vải Đẹp Sài Gòn,Suits,https://www.lazada.vn/products/pdp-i3195849024.html
Mắt kính em bé baby trai gái cao cấp đáng yêu chất đẹp TRÒN DẺO TRÒNG TRONG thời trang viền nhựa đủ màu sắc,66640,80000,4.684210526315789,38,https://filebroker-cdn.lazada.vn/kf/S081f81e1968547448dce2561e26ee86fv.jpg,tmskyglasses,Suits,https://www.lazada.vn/products/pdp-i2076273196.html
TOMSHOO LIXADA BUTane GAS LIGHT LIGHT OUTDOOR GAS LIGHT LANTER để cắm trại tự lái xe,303136,499000,,,https://sg-test-11.slatic.net/p/c7e9579d9bc918f858763a4935e72fe7.jpg,TOMSHOO Flagship Store,Suits,https://www.lazada.vn/products/pdp-i3173296246.html
Đồ Chơi Lắc Tay Hình Thú Cưng Đáng Yêu Cho Bé – Chuông Lục Lạc Vải Nhung Mềm Mại Phát Triển Giáo Dục Sớm,8000,12000,4.951871657754011,374,https://vn-live-01.slatic.net/p/343e7a5d868de020a03ff2e50c2dc0ee.jpg,YxVCGO.Selection,Suits,https://www.lazada.vn/products/pdp-i2545172384.html
Giầy thể thao siêu nhân có đèn led cho bé trai GT03,123990,225400,5.0,7,https://vn-live-01.slatic.net/p/1d66ba6646e694482eb31dc9087b8be5.jpg_1500x1500q80.jpg,98 Kids,Suits,https://www.lazada.vn/products/pdp-i2011494416.html
Đèn pin đội đầu XJ518 siêu sáng chất lượng cao chống nước thời gian soi sáng lên tới 120 giờ tối đa cho mỗi lần sạc Sử dụng chân cáp sạc TYPE-C cao cấp tích,280000,560000,4.846153846153846,13,https://vn-live-01.slatic.net/p/e9db1b8e27852d8dd52a802706a9953f.png,MAX STAR 247,Suits,https://www.lazada.vn/products/pdp-i3154356447.html
Đèn led gắn van xe hình trụ (1 bộ 2 cái) 4 màu sắc dễ dàng sử dụng,7500,12000,4.88628411476557,2858,https://filebroker-cdn.lazada.sg/kf/Sa57a593f0f154a528dd2fc18227de839W.jpg,Huayi Sports,Suits,https://www.lazada.vn/products/pdp-i2535215638.html
Bình Nước Thủy Tinh In Chữ Hello Master 480ML có dây xách,7000,11200,4.911122397155917,6205,https://filebroker-cdn.lazada.sg/kf/Sb8ff7b352bfc4c4aa2443d5b29550dd8Z.jpg,d3odSmYq.Selection,Suits,https://www.lazada.vn/products/pdp-i2500736173.html
Đèn Tia Laze 3 Trong 1 - Đèn Pin Mini Chiếu Sáng - Đèn Tia Laser Soi Tiền Giấy Tờ UV Sạc USB,75080,90000,4.836322869955157,446,https://sg-test-11.slatic.net/p/22c0339a8c4a75aee92be81bdacc16f9.jpg,CuuLongstore,Suits,https://www.lazada.vn/products/pdp-i596064674.html
【Local seller fast shipping】Children's shoes for boys and girls breathable mesh children's coconut shoes casual sports shoes,23000,32200,,20,https://vn-live-01.slatic.net/p/3de6c30c8cb2d7078e0bcaceef93d149.jpg,5rsdiD.Selection,Suits,https://www.lazada.vn/products/pdp-i3140917806.html
Nhái hơi câu lure F35 lưỡi titann không rỉ làm từ cao su nhập khẩu thái lan chính hãng 100% - Mồi câu F35,16000,34000,5.0,24,https://vn-live-01.slatic.net/p/9934353e1aa46af54a77034ec79f3b70.png,Nhái Hơi Hà Nội ,Suits,https://www.lazada.vn/products/pdp-i2880932028.html
"LỒNG Ô BÁT QUÁI, LƯỚI LỒNG BÁT QUÁI  BẮT CÁ,TÔM,LƯƠN,TRẠCH.",24860,46000,4.694117647058824,340,https://vn-live-01.slatic.net/p/1373fe13403da58a80e022e0a96fd449.png,ĐỨC PHÁT FISHING,Suits,https://www.lazada.vn/products/pdp-i1373119601.html
Kính Bơi Silicon Mềm Chuyên Nghiệp Mặt Nạ Lặn Chống Tia Cực Tím Cho Nam Và Nữ Kính Bơi Chống Nước,109000,266000,4.972972972972973,147,https://filebroker-cdn.lazada.vn/kf/Sd05ef6bdfc264c64b72d42c1cc3ee2ae4.jpg,Global Merch Park,Suits,https://www.lazada.vn/products/pdp-i2667029888.html
"【Bảo hành trọn đời+TẶNG TÚI ĐỰNG】Đệm Hơi Tự Bơm mount peak,Giường hơi đơn/đôi,Giường bơm hơi,kèm bơm điện Đệm hơi dày",285000,,5.0,18,https://sg-test-11.slatic.net/p/e247908d9d03ed41e9fb64be5963c239.jpg,Landnn,Suits,https://www.lazada.vn/products/pdp-i2948908357.html
The Primitive | Lều Đi Phượt Siêu Nhẹ Chống Nước Hai Lớp,1215000,1649000,4.5,3,https://filebroker-cdn.lazada.vn/kf/Sfb1559a6848a4d6e8a6ae0e2b8d16c50g.jpg,Primitive Camping,Suits,https://www.lazada.vn/products/pdp-i3255808987.html
"FUCO LOAI SẠC Đèn xe đạp siêu sáng có còi sạc usb chống nước 7588,đèn led xe đạp thể thao,T6 loại caocấp",75000,84142,4.779661016949152,118,https://sg-test-11.slatic.net/p/84ce4f251a09a58d0a2b7077e38d2a43.jpg,MotoPlex,Suits,https://www.lazada.vn/products/pdp-i3060446313.html
"1000ML Thể thao Chai nước Uncounter Weng Cup, công suất lớn nhựa chống rơi di động, sinh viên nam và nữ sáng tạo phiên bản Hàn Quốc, nhiệt độ cao kháng Portable Space Cup",22900,32100,4.9688888888888885,3150,https://filebroker-cdn.lazada.sg/kf/Sd9be6f95bfe042b7a9aa15a2b9361ce0p.jpg,FadUOY.Selection,Suits,https://www.lazada.vn/products/pdp-i2529289057.html
"Đèn pin siêu sáng Manta Ray C8.2A LED SFT42R DRIVER BUCK 11A chống nước IP68 pin 21700 cao cấp, Đèn cầm tay siêu sáng , Đèn pin cầm tay siêu sáng, Đèn siêu sáng",790000,1550000,5.0,1,https://sg-test-11.slatic.net/p/6ffe98f60bf466f16077cbf20d90ea2c.jpg,MAX STAR 247,Suits,https://www.lazada.vn/products/pdp-i3274860324.html
"Kính Râm Phân Cực Nam Cổ Điển UV400 – Kính Mát Thể Thao Ngoài Trời, Chống Chói, Bảo Vệ Mắt Khi Lái Xe",25000,35000,4.924564796905223,1034,https://vn-live-01.slatic.net/p/d1247339b76d4aff7ae8082030d70d23.png,ZXxKdL.Selection,Suits,https://www.lazada.vn/products/pdp-i2493404472.html
"Lưới Bát Quái Bắt Cá, Tôm, Lươn, Trạch",18620,29000,4.764577259475218,1372,https://vn-live-01.slatic.net/p/2f4f520eb446e20364ca38a6b9579ec7.jpg,Đồ Câu Đại Tín,Suits,https://www.lazada.vn/products/pdp-i1531360184.html
Mắt Kính Thug Life Kính Minecraft cho Giới Trẻ Xu hường Hot Trend Hiện Nay,18000,,,,https://sg-test-11.slatic.net/p/c94eeb11a4b96dd217f2a23f17738367.jpg,Gumita,Suits,https://www.lazada.vn/products/pdp-i2775516862.html
SET 2 Bẫy Chuột Thông Minh Thế Hệ Mới Có Lò Xo Đàn Hồi Với Độ Nhạy Cao Siêu Tiết Kiệm Dễ Sử Dụng Hiệu Quả Cao - Dụng Cụ Bắt Chuột,25200,35300,4.861788617886178,124,https://vn-live-01.slatic.net/p/8e48dc5b8a8b0f0e7def1118d89ec745.png,BÁN GÌ RẺ THẾ.Selection,Suits,https://www.lazada.vn/products/pdp-i2607044634.html
Mini Laser Infrared Tactical Sight Adjustable Red Dot Electric Hand Base Red Light Glock Under-Hang Laser Accessories,89100,99000,,,https://filebroker-cdn.lazada.vn/kf/S36904a67d65d4c1db3e9779b98c54d87J.png,TB supermarket store,Suits,https://www.lazada.vn/products/pdp-i3267155146.html
Cần Câu Tay Chiến Thần 6H 8H Đối Trọng Săn Hàng - Tặng kèm ngọn phụ BB58,123630,130000,4.7215189873417724,394,https://vn-live-01.slatic.net/p/c7fad32c5315eefe096a2f8024349dbc.jpg,Fishing 4.0,Suits,https://www.lazada.vn/products/pdp-i2612710621.html
"Quần Tất Trẻ Sơ Sinh Cotton Có Thể Mở Khóa Instagram, Tất Một Mảnh Cho Bé Gái, Tất Trẻ Em, Nơ Bướm",23800,35700,4.0,1,https://sg-test-11.slatic.net/p/33e59e433d50dd39ac1dd37c15de1b7b.png,BEST FOR CAR,Suits,https://www.lazada.vn/products/pdp-i3141771437.html
Ngoài Trời Chống Nước Chống Nắng Cung Điện Cổ Đèn Lồng Quảng Cáo Tùy Chỉnh In Hình Phong Cách Trung Hoa Đèn Lồng Cửa Da Cừu,426000,,5.0,2,https://filebroker-cdn.lazada.vn/kf/S8c5af800dc2a4681a55dcaac1be4d5c1F.jpg,Lazada Global,Suits,https://www.lazada.vn/products/pdp-i3026581320.html
CYCPLUS M1 GPS Xe Đạp Máy Tính Không Dây Đồng Hồ Tốc Độ Bluetooth 5.0 ANT + Ciclismo Đồng Hồ Đo Tốc Độ Cho Garmin Zwift Chống Nước IPX6,464000,1009000,4.985294117647059,132,https://filebroker-cdn.lazada.vn/kf/Sf533dbe627844b2995ec2135dae44f6cz.jpg,Global Merch Park,Suits,https://www.lazada.vn/products/pdp-i2747187765.html
"La bàn thân inox lớn 77mm xác định hướng xây dựng, phong thủy",95000,100000,5.0,29,https://vn-live-01.slatic.net/p/ada6521818062d25be8efa59c6ae2a7f.jpg,VAstro,Suits,https://www.lazada.vn/products/pdp-i1879830395.html
0.22L-0.5L Bình nhôm M18 * 1.5 PCP Tank chai 30mpa van paintball PCP Tank xi lanh lặn,356000,535000,4.822222222222222,88,https://my-live-01.slatic.net/p/39f24512c7515b9db7bdc218be412b6e.jpg,bubblebag,Suits,https://www.lazada.vn/products/pdp-i2398908929.html
Đai Treo Xà Đơn Kéo Giãn Cột Sống Chính Hãng Đại Nam Sport (Hàng Loại 1),284000,350000,4.8544303797468356,158,https://sg-live-01.slatic.net/p/b387ab84fc6d71805a462bc3a8528781.jpg,ĐN SPORT,Suits,https://www.lazada.vn/products/pdp-i1840104618.html
10 lờ cá lóc cải tiến vành nhựa(30*52),155000,350000,4.857142857142857,434,https://filebroker-cdn.lazada.vn/kf/S2d8f304dd06c4f2895e8bea451fb54b2e.jpg,xưởng lờ cá giá rẻ ,Suits,https://www.lazada.vn/products/pdp-i2249614021.html
Godox | Godox iT32 Đèn Flash Mini cho Máy Ản và Bộ Kích X5 Nhỏ Gọn Di động,2045000,,4.4,15,https://filebroker-cdn.lazada.vn/kf/S6ee2e09778044d0aa41b723474a11bc6p.jpg,Nanfenghuang specialty store,Suits,https://www.lazada.vn/products/pdp-i3241924240.html
"Mồi câu Kim Long Tổng Hợp 250g câu cá chép, trắm, trôi, rô phi dịch vụ, tự nhiên",18900,25000,4.916666666666667,24,https://sg-test-11.slatic.net/p/06fe73fbda8f02c69e89664fde899f67.jpg,TAOFISHING,Suits,https://www.lazada.vn/products/pdp-i3001216873.html
Yếm Ăn Dặm Cho Bé Xoay 360° – Vải Xô 6 Lớp Cotton Mềm Mại – Kiểu Hoa Cúc Dễ Thương,8000,12000,4.969448990725587,1833,https://filebroker-cdn.lazada.sg/kf/S01216718dc474a72b2c4730e930f7532c.jpg,IQ0yZ9.Selection,Suits,https://www.lazada.vn/products/pdp-i2528718038.html
VIỀN VỢT BÓNG BÀN TACE GOLD VINYLTEC,50000,,5.0,15,https://vn-live-01.slatic.net/p/782fb5d1d1338366d313375096d55a19.jpg,BÓNG BÀN PLANT VIET,Suits,https://www.lazada.vn/products/pdp-i1339824421.html
Hf Sneakers cho trẻ em Nữ Giày 2024 mùa thu xoay kuromi nút Giày thể thao thoáng khí trẻ em mới của giày cho các ông bố cô gái giày,168431,389438,5.0,118,https://sg-test-11.slatic.net/p/aaa38c6ce0af5823e8a7511f0cfc6070.jpg,Honey Fairy,Suits,https://www.lazada.vn/products/pdp-i2898988923.html
"Plush sequin mermaid tail shoulder bag, children's crossbody bag, single crossbody bag, fish tail zero wallet, cartoon zipper",8000,12000,5.0,198,https://vn-live-01.slatic.net/p/7285d9c8f15abe43f533d912ef984bd0.jpg,IQ0yZ9.Selection,Suits,https://www.lazada.vn/products/pdp-i2531841473.html
NatureHike | Ghế Biển Gấp Di Động,1241000,,4.777777777777778,27,https://filebroker-cdn.lazada.vn/kf/S13f39fcb25384537bae12fa0cec7c8bcn.jpg,Naturehike outdoors,Suits,https://www.lazada.vn/products/pdp-i3219555723.html
"Bộ Pijama Dài Tay Bé Trai, Bé Gái 9-45KG, Quần Áo Trẻ Em, Đồ Ngủ Cho Bé/ Đồ Mặc Nhà Cho Bé Chất Liệu Lụa Hàn Thoáng Mát Tenkids",75000,150000,4.963636363636364,55,https://vn-live-01.slatic.net/p/0af31491f18fff066c9708a50a81da5f.png,TEN Kids Store,Suits,https://www.lazada.vn/products/pdp-i2878164071.html
Sét bộ đồ cổ vuông tim quần dài ống ôm vải Aty Hàn mềm mịn,119000,139000,5.0,10,https://filebroker-cdn.lazada.vn/kf/S6a0333a2ea9e486e8c8f91b8c36dfd11j.jpg,Nga Chiến đồ bộ ,Suits,https://www.lazada.vn/products/pdp-i2637406029.html
Quần Áo Bóng Đá - Bộ Đồ Đá Bóng Trẻ Em Đội Tuyển Việt Nam Chất Thun Lạnh In Cao Cấp -In Tên Số Theo Yêu Cầu,45000,,5.0,12,https://vn-live-01.slatic.net/p/b6fda0c28ae5cade2dd9fac5f2122be7.png,Quần Áo Bóng Đá HT Store,Suits,https://www.lazada.vn/products/pdp-i2746488436.html
"Bộ đồ tập luyện SANDA, chiến đấu nhanh khô, đấm bốc, bộ đồ chiến đấu thể dục",229865,362135,4.5,8,https://sg-test-11.slatic.net/p/17b3066fdc00dfc5a3660609903e337c.jpg,NCE Teenager,Suits,https://www.lazada.vn/products/pdp-i3114366169.html
Bộ Đồ Thể Thao Ice Silk Dành Cho Nam Áo Thun Tay Ngắn Nhanh Khô Cho Chạy Bộ Và Bóng Rổ Quần Short Mùa Hè,62100,69000,5.0,2,https://filebroker-cdn.lazada.vn/kf/S66a3d440566547ffa2926395778e5ba5p.jpg,Lazada Global,Suits,https://www.lazada.vn/products/pdp-i3198513465.html
Hanlu áo khoác nam đẹp ngầu boy phố áo khoach nam áo khoác nam bomber Áo khoác đôi Nam Thường Ngày Áo Quần đua rộng phong cách đẹp trai đồng phục bóng chày,209000,460000,4.9847715736040605,208,https://sg-test-11.slatic.net/p/cd6ba641b0ea320d79b35a7540c81e4f.jpg,Hanlu Style,Suits,https://www.lazada.vn/products/pdp-i2400612292.html
"[Ship từ Tp.HCM] Người Đàn Ông Của Mùa Xuân/Mùa Thu Phù Hợp Với Giản Dị, Hoa Thư In Dài Tay Áo Đứng Cổ Áo Áo Khoác Và Đàn Hồi Eo Quần Thể Thao Ngoài Trời Thiết Lập, Polyester Máy Có Thể Giặt Thời trang Cardigan 2 Cái bộ",60759,89999,,,https://vn-live-01.slatic.net/p/89866e7ba5f472f796bdc2c2773d8d0d.jpg,Cửa hàng sách tiếng anh,Suits,https://www.lazada.vn/products/pdp-i3141387004.html
LỀU CẮM TRẠI 2 4 NGƯỜI VỚI KHUNG SIÊU CỨNG CHẮC CHẮN CÙNG 2 CỬA 2 LỚP CHỐNG NẮNG HIỆU QUẢ LOẠI TỰ BUNG 5S CAO CẤP,198000,290000,4.610169491525424,118,https://vn-live-01.slatic.net/p/1e7b53ca1d300181f721f62f6aa49991.jpg,FREEHOUSE SHOP,Suits,https://www.lazada.vn/products/pdp-i696772094.html
Đồ bộ Pijama nam dài tay từ 45 - 75kg,209000,,4.7894736842105265,19,https://filebroker-cdn.lazada.vn/kf/S8d5d30762da04c6392f9e8baecbbe0fex.jpg,Pijama Thúy Hằng,Suits,https://www.lazada.vn/products/pdp-i1695985132.html
Costom Làm Nam Nữ Màu Đen Màu Hồng Vinyl Trắng PVC Cao Su Bộ Đồ Zentai/Catsuit /Bodysuit Đầy Đủ Cơ Thể Zentai Trang Phục Phù Hợp Với,321919,638400,,,https://my-test-11.slatic.net/p/6cdce67ac3fd2b88742b6a0a239e6aa2.jpg,Eewzs51lwui,Suits,https://www.lazada.vn/products/pdp-i2422381007.html
ZANZEA Trang Phục 2 Món Mùa Hè Cho Nữ Áo Viền Bất Đối Xứng Tay Lửng Bộ Đồ Rộng Quần Dài,391979,783958,4.851063829787234,61,https://my-live-02.slatic.net/p/f5ea73ddaf58507e478b62f4843d1b1c.jpg,ZANZEA,Suits,https://www.lazada.vn/products/pdp-i1875811431.html
"Bộ Com Lê Nam MIKEJIE, Bộ Đồ Thể Thao Mới 2021 Áo Khoác Quần Áo Nữ Và Nam Quần Ngắn Tay Ins Mùa Xuân Cho Nam + Quần Dài Bộ Đồ Thường Ngày",174709,363000,5.0,1,https://my-live-02.slatic.net/p/89c5ab79a65fba4ea819f11aca4ecca1.jpg,Naimo Brand Store,Suits,https://www.lazada.vn/products/pdp-i1480025171.html
