ten_san_pham,gia_sale,gia_goc,rating,so_review,link_anh,shop,category,url_san_pham
"Bộ Trang Phục Thời Trang Nữ Cỡ Lớn Mùa Xuân Thu, Thiết Kế Rộng Rãi, Gồm Hai Mảnh Với Quần Ống Rộng Và Áo Khoác Ngoài Tôn Dáng",591000,768000,,,https://filebroker-cdn.lazada.vn/kf/S92cc5ef1bdb24bc2a1f7161e148f0d05q.jpg,GlobalWonderShop,Suits,https://www.lazada.vn/products/pdp-i3251882145.html
"Bộ Thời Trang Ba Món Màu Đen Với Quần Ống Rộng Và Áo Dài Tay, Phong Cách Cao Cấp, Chất Liệu Mùa Thu",1562400,2257000,,,https://filebroker-cdn.lazada.vn/kf/Sc34bd0a0052343bfa3ec54a61e89c36d6.jpg,GlobalWonderShop,Suits,https://www.lazada.vn/products/pdp-i3264725772.html
"Bộ Trang Phục Hai Mảnh Xếp Ly Bất Đối Xứng Thanh Lịch Mùa Thu Đông, Áo Ôm Dáng, Quần Ống Rộng, Chất Liệu Polyester, Kiểu Dáng Thường Ngày",1901700,2767000,,,https://filebroker-cdn.lazada.vn/kf/Sa927e5888b7f44d1a52d67b402747d49l.jpg,GlobalWonderShop,Suits,https://www.lazada.vn/products/pdp-i3232073550.html
"Bộ Đồ Nữ Thời Trang Dáng Nhỏ Năm 2023, Kiểu Dáng Phương Tây, Tay Dài, Mùa Xuân Thu, Phong Cách Giản Dị Thanh Lịch, Gồm Áo Khoác Và Quần.",604000,785000,,,https://filebroker-cdn.lazada.vn/kf/S5649b4cb35e84337811b44fac5be472cq.jpg,GlobalWonderShop,Suits,https://www.lazada.vn/products/pdp-i3250119087.html
"Bộ Trang Phục Hai Mảnh Dáng Ôm Thanh Lịch Thiết Kế Việt Nam, Chân Váy Xếp Ly Ngắn, Áo Dài Tay Cổ Tròn, Kiểu Vest, Dài Trên Gối",2849000,3703000,,,https://filebroker-cdn.lazada.vn/kf/S897d73969ae344838d043f75ec29e173N.jpg,GlobalWonderShop,Suits,https://www.lazada.vn/products/pdp-i3259440904.html
"120cm/47"" Hot Suit Cover Non-woven Garment Storage Bag Clothes Bags Travel Supplies Black Foldable Zipped Dust Cover",155133,200000,5.0,1,https://sg-test-11.slatic.net/p/efb5185a2a482f931c2168c7a2ed74bb.jpg,Thirteen Taibao grocery store,Suits,https://www.lazada.vn/products/pdp-i2877543766.html
Sexy Catwoman Cosplay Suit Tight Leather Jumpsuit Shiny Patent Leather One-Piece Queen Uniform Women's Underwear Home Clothes,583000,,,,https://filebroker-cdn.lazada.vn/kf/S10fbceb149b541e5a6d01f8bc2d72e5bu.jpg,Lazada Global,Suits,https://www.lazada.vn/products/pdp-i3165444090.html
Sexy Luminous Oil Shiny One-Piece round Neck Tight Full Body Long Sleeve Women's Suit Thin Nylon mid Waist Long Pants,245000,298000,,,https://filebroker-cdn.lazada.vn/kf/S2d0f1afd7d774a68a021766205ff593fs.jpg,TB FASHION STORE,Suits,https://www.lazada.vn/products/pdp-i2955809057.html
Veterinarian Ladies Slim Sexy Fashion Medical Uniform nursing Clothing Suit Surgical Gown High-end Pet Care Beautician Scrubs Set,589439,884159,,,https://sg-test-11.slatic.net/p/dcea6faacd184adb0fa788a4288a68f2.jpg,efarlebtio1970,Suits,https://www.lazada.vn/products/pdp-i2513242874.html
Bear Leader Summer Chinese Style Girls Clothing Suit Pink Flower Embroidered Fly Sleeved Top + Shorts Two-piece Set Sweet Tassel Cheongsam Kids Clothes Outfits 2-7 Years,166570,431458,5.0,84,https://sg-test-11.slatic.net/p/799d7f6132d81e47aad0481a230743d1.jpg,Bear Leader,Suits,https://www.lazada.vn/products/pdp-i2670409169.html
Quần Lót Nam Ice Silk Smooth Low Waist T-Back Không Để Lại Dấu Vết Quần Lót Nam Bằng Nylon Mỏng Gợi Cảm Quần Lót Mùa Hè,24700,43000,5.0,0,https://filebroker-cdn.lazada.vn/kf/S29487bdb5bbc44b6872bbc5f23fc2c73O.jpg,Lazada Global,Suits,https://www.lazada.vn/products/pdp-i3253194738.html
ZZOOI VVsportsdesigns 2022 Man Triathlon Skinsuit Cycling Short Sleeve Swimwear Custom Bike Jersey Clothes Jumpsuit Ropa Ciclismo Suit,563000,999999,,,https://sg-test-11.slatic.net/p/79d3f62d6f93cf78e1545cefb3bcb758.jpg,zi6205731,Suits,https://www.lazada.vn/products/pdp-i3175905441.html
Sexy School Uniform Cosplay Set Pure Desire Student Girl JK Sailor Suit Women's Outfit Spring 2024 Plaid Pattern Butterfly Knot,188000,,,,https://filebroker-cdn.lazada.vn/kf/Se45d552f6b4c43d1ad69c16acc9ea578T.jpg,TB FASHION STORE,Suits,https://www.lazada.vn/products/pdp-i3015768457.html
Mùa Đông Trẻ Em Mới Của Xuống Bông Phù Hợp Với Cho bé trai và bé gái phiên bản Hàn Quốc Với Sang Trọng Và Đẹp Trai Phong Cách Nước Ngoài Áo Khoác,246000,300000,5.0,5,https://sg-test-11.slatic.net/p/7e3e99595e4c9931016436a29b77a8b6.jpg,kids cool day,Suits,https://www.lazada.vn/products/pdp-i2414997717.html
WGB Anime Frieren at the Funeral Costume Elf Frieren Dress Cloak Suits Brave Himmel Robe Cloak Top Pants Outfit Halloween Role-Playing Costumes,84878,169756,,,https://my-test-11.slatic.net/p/efe44036145702b6484fce1e09b00736.jpg,Bqufpb46eat,Suits,https://www.lazada.vn/products/pdp-i3182955902.html
Mới 12 cái Black & White kim loại ngọc trai/bướm/Hoa/vàng bạc phù hợp với Cros jibbitz quyến rũ DIY phụ nữ Phụ Kiện Giày,79000,140000,4.894736842105263,119,https://sg-test-11.slatic.net/p/ad48c01c545faae4ddaa3a175a60a457.jpg,sotta.vn,Suits,https://www.lazada.vn/products/pdp-i2474068321.html
"Quần Dài Kaki Dù Đi Học Trẻ Em - M3 Cho Bé Trai Bé Gái Cao Cấp MQ LUXURY, Quần Tây Âu Học Sinh",88110,150000,4.64,50,https://vn-live-01.slatic.net/p/345e4ba3be7815b617ccb1420402cdba.jpg,MQ LUXURY 79,Suits,https://www.lazada.vn/products/pdp-i2794252068.html
NALING | Bộ Quần Áo Thể Thao Thời Trang Giúp Gọn Đỏng,140000,,,,https://filebroker-cdn.lazada.vn/kf/S65717f46d2b64f189210a6b074100226X.jpg,NALING selected,Suits,https://www.lazada.vn/products/pdp-i3231103831.html
Set 10 quần ngắn trắng mỏng cho bé sơ sinh đến 10kg,38000,,4.8961538461538465,260,https://filebroker-cdn.lazada.vn/kf/Sdf9ab16c34074576b274fb1539a74867k.jpg,Sơ sinh Sài Gòn,Suits,https://www.lazada.vn/products/pdp-i1512871662.html
"Bộ Sưu Tập Chảo SUIT LocknLock Chống Dính Màu Mint 22cm, 24cm, 26m CSU1225MIT, CSU1243MIT, CSU1263MIT (hàng chính hãng)",438000,723000,4.6,5,https://vn-live-01.slatic.net/p/e4455b3a9fcdd7c17414b52e43dc156c.jpg,Gia dụng Nhật Quang 123,Suits,https://www.lazada.vn/products/pdp-i2361709848.html
Mùa Thu Mùa Đông Bé Romper Lông Cừu Trùm Đầu Chập Chững Biết Đi Jumpsuit Trẻ Sơ Sinh Quần Áo Trẻ Em Cô Gái Chàng Trai Áo Trẻ Sơ Sinh Ouitfit Bé Quần Áo,169209,296000,4.967592592592593,315,https://my-live-02.slatic.net/p/19ae73c630c52296d0012502b1cdc9a5.jpg,I Love Daddy&Mummy,Suits,https://www.lazada.vn/products/pdp-i2057650107.html
"Set 4 quần lót đùi chip đùi bé trai 7-33kg (2-9tuổi) cotton cao cấp co dãn thoải mái mềm mịn, nhiều hình dễ thương, quần sịp bé trai cao cấp",83880,170000,4.978494623655914,186,https://vn-live-01.slatic.net/p/d3e5ecb73bad6d094348b68295292662.jpg,CharmStoreByDP,Suits,https://www.lazada.vn/products/pdp-i2488720342.html
MQATZ New High Quality Baby Lace Princess Dress For Girl Elegant Birthday Party Trailing christmas Clothes 3-12 Years T5399,74127,103106,4.8431372549019605,255,https://my-live-01.slatic.net/p/2d2c2a9e5cf9739262e74a8aeb04f8b5.jpg,MQATZ Store,Suits,https://www.lazada.vn/products/pdp-i1990637348.html
"DỤNG CỤ TẠO MỒI LỬA CHO BẾP CỒN CẮM TRẠI DÀI 26CM - MỒI NẾN THƠM, MỒI BẾP GAS",22800,32000,4.903225806451613,62,https://vn-live-01.slatic.net/p/5882fea477bbed4e7e6dabda886ebccd.jpg,BEST PHỤ KIỆN TPHCM.Selection,Suits,https://www.lazada.vn/products/pdp-i3021603941.html
Quần Nữ 2 Mảnh Mới Mùa Hè Hai Mảnh Áo Hoa Dáng Rộng Quần Ống Rộng Bộ Đồ Thời Trang Thường Ngày,182409,329000,5.0,13,https://my-live-02.slatic.net/p/86641119850441cbfdf1426d3410640c.jpg,LikeMy,Suits,https://www.lazada.vn/products/pdp-i1781393259.html
"Bộ Áo Và Quần Nữ PB&ZA Chất Liệu Linen Pha, Kiểu Dáng Mùa Hè, Quần Cạp Cao Có Dây Lưng, Thiết Kế Thanh Lịch Phong Cách Châu Âu",406000,527000,,,https://filebroker-cdn.lazada.vn/kf/Sa608a93d378946409ade5e12b17f5fd9Y.jpg,GlobalWonderShop,Suits,https://www.lazada.vn/products/pdp-i3250120048.html
"Bộ Vest Ba Mảnh Ôm Dáng Màu Đen Dành Cho Nam, Size Lớn, Gồm Áo Khoác Blazer, Quần Và Áo Ghi Lê, Thích Hợp Cho Đám Cưới Mùa Thu, Tiệc Tùng, Trang Phục Lịch Sự.",1386000,2027000,,,https://filebroker-cdn.lazada.vn/kf/Sd0680c97cb3e4b88857ba1be54c3ee888.jpg,GlobalTechMart,Suits,https://www.lazada.vn/products/pdp-i3243926609.html
"Bộ Thời Trang Nữ Sinh Viên Phong Cách Thường Ngày Chất Liệu Cotton Poly, Áo Khoác Phối Màu Với Quần Ống Rộng, Đường May Cấu Trúc Ba Chiều",453000,589000,,,https://filebroker-cdn.lazada.vn/kf/Sfe3feb46eaea46c7bcfbeb1d4df65d08o.jpg,GlobalWonderShop,Suits,https://www.lazada.vn/products/pdp-i3258428831.html
"Bộ Trang Phục Thu Nữ Tính, Quần Dài Cạp Cao Hai Khuy, Áo Khoác Ngắn, Phong Cách Thời Trang Thường Ngày",607000,789000,,,https://filebroker-cdn.lazada.vn/kf/S3cf45448234b4de3a06e16ed6bfa9db27.jpg,GlobalWonderShop,Suits,https://www.lazada.vn/products/pdp-i3232985093.html
"Bộ Đồ Nữ Phong Cách Hàn Quốc Gồm Áo Khoác, Áo Gile Và Quần Dài, Chất Liệu Polyester Spandex In Họa Tiết, Thoải Mái.",536000,697000,,,https://filebroker-cdn.lazada.vn/kf/Sd97e864fb58d4ca8a747a5e506caecbbs.jpg,GlobalWonderShop,Suits,https://www.lazada.vn/products/pdp-i3254265807.html
Bộ 2 Món Phong Cách Xã Hội Xã Hội Thiết Kế Mùa Thu Quần Ống Rộng Cạp Cao Và Áo Khoác Ngắn Thời Trang Trung Quốc Nhạy Cảm,549950,848000,,,https://filebroker-cdn.lazada.vn/kf/S87a28c1931034f2ab4f8d30fc8193eb3X.jpg,GlobalWonderShop,Suits,https://www.lazada.vn/products/pdp-i3216035652.html
"Bộ Vest Thanh Lịch Gồm Áo Blazer Và Quần Dành Cho Nữ, Có Đệm Vai, Áo Khoác Ngắn Tay Cài Nút & Quần Ống Rộng, Trang Phục Công Sở Mùa Xuân",784000,1020000,,,https://filebroker-cdn.lazada.vn/kf/S3eb1c82451da4aa19a54c7f45c6c9c4f7.jpg,GlobalLifestyle,Suits,https://www.lazada.vn/products/pdp-i3270093557.html
"Bộ Trang Phục Dạo Phố Thời Trang Mùa Thu 2025 Gồm Áo Khoác Kiểu Kimono Dáng Xuông Có Dây Lưng, Tay Dài, Chất Liệu Polyester, Thoải Mái, Phong Cách Năng Động.",537000,698000,,,https://filebroker-cdn.lazada.vn/kf/Sa737e9a3691e4c3496f788b6450c909cx.jpg,GlobalWonderShop,Suits,https://www.lazada.vn/products/pdp-i3270265330.html
"Bộ Vest Nam Hai Mảnh Kiểu Dáng Thường Ngày, Thời Trang Xuân Thu, Quần Áo Hợp Thời, Thoải Mái, Kiểu Dáng Giả Hai Mảnh Kèm Mũ",925000,1202000,,,https://filebroker-cdn.lazada.vn/kf/S187df36e3d6f4bbf925caed4906d9782y.jpg,GlobalWonderShop,Suits,https://www.lazada.vn/products/pdp-i3264738534.html
"Bộ Quần Áo Nữ Màu Trơn Thanh Lịch, Dáng Rộng, Phong Cách Mùa Xuân Hè, Thời Trang Thường Ngày, Kiểu Dáng Đơn Giản, Phong Cách Âu Mỹ",627000,815000,,,https://filebroker-cdn.lazada.vn/kf/S22b926ce13104fe48373a59a9f5071f2U.jpg,GlobalWonderShop,Suits,https://www.lazada.vn/products/pdp-i3200912656.html
"Bộ Trang Phục Thời Trang Cao Cấp Thu Sớm Dành Cho Nữ Dáng Nhỏ Nhắn, Gồm 2 Món: Quần Dệt Kim Thanh Lịch Và Áo Khoác Phối Hợp, Dành Cho Năm 2024",673000,875000,,,https://filebroker-cdn.lazada.vn/kf/S2f951ea2869e4641a6f8b0d9460645bbR.jpg,GlobalWonderShop,Suits,https://www.lazada.vn/products/pdp-i3239068551.html
"Bộ Trang Phục Nữ Tidalyf Gồm Áo Ngắn Tay Dài Cổ Trụ, Kiểu Dáng Thanh Lịch, Phối Dây Lưng, Thích Hợp Mặc Mùa Thu, Phong Cách Công Sở.",725000,942000,,,https://filebroker-cdn.lazada.vn/kf/S2a6e3af434434502a0d1af17dae1bd51q.jpg,GlobalTechMart,Suits,https://www.lazada.vn/products/pdp-i3257554858.html
"Bộ Đồ Thu Đông Thời Trang Thường Ngày Kiểu Âu Mỹ, Áo Khoác Cardigan Len Có Mũ Và Quần, Bộ 2 Món Dành Cho Nữ",853000,1109000,,,https://filebroker-cdn.lazada.vn/kf/Sefd8af4fee6145b7be082cc6edb90301v.jpg,GlobalWonderShop,Suits,https://www.lazada.vn/products/pdp-i3257202662.html
"Bộ Vest Công Sở Màu Hồng Thanh Lịch Hai Mảnh, Kiểu Dáng Ôm Sát, Cổ Tròn, Áo Khoác Và Chân Váy May Đo, Thích Hợp Cho Mùa Thu Đông, Phong Cách Nữ Công Sở.",1330000,1729000,,,https://filebroker-cdn.lazada.vn/kf/S3649febb87fb4c78a543970e84b2d9fdm.jpg,GlobalWonderShop,Suits,https://www.lazada.vn/products/pdp-i3266948003.html
"Bộ Vest Hai Mảnh Green Peak Lapel Dành Cho Bé Trai, Gồm Áo Khoác Blazer Và Quần, Dành Cho Trẻ Từ 2-18 Tuổi, Thích Hợp Cho Đám Cưới, Dạ Hội, Trang Phục Lịch Sự, Sang Trọng.",2353000,3059000,,,https://filebroker-cdn.lazada.vn/kf/Sd130946e33954574835782e5a6cb30900.jpg,GlobalTechMart,Suits,https://www.lazada.vn/products/pdp-i3267764867.html
"Bộ Vest Tuxedo Ôm Dáng Cho Bé Trai 4 Món Gồm Áo Khoác Vest, Quần, Cà Vạt Nơ, Thích Hợp Cho Đám Cưới, Lễ Tốt Nghiệp, Biểu Diễn Đàn Piano, Trang Phục Dạ Hội.",1386000,1802000,,,https://filebroker-cdn.lazada.vn/kf/S574846b319b14d799a2f4b874df7e5e3i.jpg,GlobalTechMart,Suits,https://www.lazada.vn/products/pdp-i3269200447.html
"Bộ Vest Nam Đơn Hàng Nút, Dáng Ôm, Kiểu Tuxedo, Lịch Sự, Phối Quần - Thương Hiệu 2025, Trang Phục Công Sở Nam",2405000,3127000,,,https://filebroker-cdn.lazada.vn/kf/Sda2a321077184fc39cd17815a5895f91G.jpg,GlobalTechMart,Suits,https://www.lazada.vn/products/pdp-i3268107026.html
Bộ Đồ Ba Mảnh Thanh Lịch Dành Cho Nam Giới Thời Trang Tiệc Bóng Thường Ngày Cotton Polyester Len Pha Trộn Top Vest Quần Bộ Đôi Ngực,2702000,3512000,,,https://filebroker-cdn.lazada.vn/kf/Sc19ad95e4bfc429ca39fbba8a7e6091cX.jpg,GlobalTechMart,Suits,https://www.lazada.vn/products/pdp-i3269126799.html
"Bộ Vest Nam 3 Mảnh Ôm Dáng Màu Hồng/xanh, Kiểu Tuxedo, Dành Cho Phù Rể, Công Sở, Dạ Hội, Gồm Áo Khoác, Áo Ghi Lê Và Quần",2626000,3414000,,,https://filebroker-cdn.lazada.vn/kf/S2043740436ef4db5ab93c387169afa36N.png,GlobalTechMart,Suits,https://www.lazada.vn/products/pdp-i3269173479.html
"Bộ Vest Nam Ôm Dáng 2 Mảnh, Một Cúc, Ve Nhọn, Kiểu Tuxedo Thường Ngày, Có Khóa Kéo, Thích Hợp Cho Tiệc Tối",2361000,3069000,,,https://filebroker-cdn.lazada.vn/kf/S395f5a7fed68415da347a7cd488bcdd9H.jpg,GlobalTechMart,Suits,https://www.lazada.vn/products/pdp-i3268292012.html
[HCM]Băng Bảo Vệ Đầu Gối Dán Gối Aolikes A-7618 (Kèm Lò Xo),105000,150000,4.926984126984127,630,https://sg-live-01.slatic.net/p/46bfee94989732bfaf4a43e3204095c8.jpg,gymisport,Suits,https://www.lazada.vn/products/pdp-i637500481.html
"FASTIGAR Bao vợt pickleball – Nhẹ, bền, bảo vệ tiện lợi",41000,80000,4.985074626865671,67,https://vn-live-01.slatic.net/p/3e5d6e8b35e52c1e772487f8a596a9cc.jpg,FASTIGAR PICKLEBALL,Suits,https://www.lazada.vn/products/pdp-i3175231505.html
Combo 2 túi Nước giặt OMO Matic  túi 3.6/3.9/4.1kg (bao bì tùy lô nhập hàng),401000,425000,,,https://vn-test-11.slatic.net/p/29dc492ed412e77825f0e9b5a7870b14.png,Giatot363,Suits,https://www.lazada.vn/products/pdp-i2829936598.html
"Xuồng Bơm Hơi, Thuyền Hơi 4 Người, Xuồng Câu Cá Composite, Hàng Nhập Khẩu Nguyên Chiếc, Hàng Đẹp, An Toàn, Giá Tốt",1550000,,,,https://vn-live-01.slatic.net/p/7fc99db33837b569c00045c219bd547e.jpg,FASHION SHOW,Suits,https://www.lazada.vn/products/pdp-i1129864496.html
"Quần Giữ Nhiệt Nam, Quần Combat Pro Cao Cấp TOPBODY",57000,299000,4.95702479338843,605,https://vn-live-01.slatic.net/p/d2f4c82a20ec32cd5f0b45813a156163.jpg,Topbody Sport,Suits,https://www.lazada.vn/products/pdp-i1539028651.html
"Dây nhảy thể lực đàn hồi 2.9m TopBody , săn chắc cơ thể, cân bằng vóc dáng - DNHAY01 - T3",65000,102000,4.870535714285714,896,https://vn-live-01.slatic.net/p/4faa194d12d3ac7482e871ea57abae01.jpg,Topbody Sport,Suits,https://www.lazada.vn/products/pdp-i1366678842.html
Dây Kháng Lực Tập Gym Powerband Tập Toàn Thân Đa Năng Chính Hãng Đại Nam Sport (Hàng Xịn),56000,120000,4.949656750572083,874,https://vn-live-01.slatic.net/p/d8980fe917e83ba6c3e35edb4c0a008a.jpg,ĐN SPORT,Suits,https://www.lazada.vn/products/pdp-i2205533183.html
"Bộ quần áo mặc nhà có sẵn đệm ngực cho nữ, vải mềm mại thoáng khí RaNa",259000,,,,https://sg-test-11.slatic.net/p/08c0a316c37f872e97ac172456ccbce7.jpg,RaNafashion,Suits,https://www.lazada.vn/products/pdp-i2890482317.html
Bộ Đồ Trung Niên thu Đông chất Nỉ da cá,122500,200000,4.666666666666667,11,https://vn-live-01.slatic.net/p/02cb37ea02a3a6dc5991b4eb17daa1cf.jpg,YOYOSHOP25,Suits,https://www.lazada.vn/products/pdp-i2051567055.html
ĐỒ BỘ THUN NỮ MẶC NHÀ,115000,,5.0,2,https://filebroker-cdn.lazada.vn/kf/Sb4353b1672794623bea925d9ad747126l.jpg,Shop ĐỒ BỘ Ngân Nguyễn0333338151,Suits,https://www.lazada.vn/products/pdp-i3260128068.html
"Trang Phục Thời Đường, Bộ Đồ Nam Chất Đũi Cho Bố Thêu Rồng Rộng Rãi. ( mã B2)",219000,329000,4.666666666666667,33,https://vn-live-01.slatic.net/p/3e61fc8281a3eb88c9fdb7650cc077be.jpg,Kem Thời Trang,Suits,https://www.lazada.vn/products/pdp-i2174527712.html
"Bộ nỉ bông bé gái. Bộ thu đông bé gái. Bộ quần áo trẻ em dài tay thu đông. Cotton nỉ da cá giữ ấm nhẹ ban đêm, điều hoà, thời tiết mùa thu - hình thỏ dễ thương - XG062",67651,119000,4.621276595744681,235,https://vn-live-01.slatic.net/p/182eaa7c33eb041d09475bf3f0bbf7d6.jpg_1500x1500q80.jpg,Dino Fashion,Suits,https://www.lazada.vn/products/pdp-i2239294885.html
"Bộ Cần Câu Máy Đứng Shimano Giá Rẻ - Cần Câu Cá Rút Gọn Đủ Size 1M8/2M1/2M4/2M7/3M Phù Hợp Câu Sông, Câu Ngâm Câu Lance - SHIWA",65000,68000,4.894366197183099,284,https://vn-live-01.slatic.net/p/1057e9af30a303be8b120bd6edf9a59c.png,SHIWA SHOP,Suits,https://www.lazada.vn/products/pdp-i2569064471.html
Mùa Hè Màu Xanh quân đội cổ áo sơ mi nam vải lanh và cotton Phong cách Trung Quốc Mới Hanfu Bộ đồ kiểu Xường Xám Trung Sơn Áo Sơ Mi Áo Vét với bảy hoặc tám tay áo,200242,336775,,,https://sg-test-11.slatic.net/p/aad6366cad30bed08bfc571500d5dec5.jpg,NCE Hommes ,Suits,https://www.lazada.vn/products/pdp-i3187569383.html
"✅[12-30kg] Bộ Quần Áo Bộ Đội Cho Bé Trai, Bé Gái. Sét Đồ Hóa Trang Hướng Nghiệp Chiến Sĩ Bộ Đội Cụ Hồ Vải Cotton Mỏng, Mát",130000,150000,5.0,2,https://vn-live-01.slatic.net/p/cb962afaa267fa7710af81df1f153b96.jpg,The Gioi Rubik Cube,Suits,https://www.lazada.vn/products/pdp-i2109874088.html
ĐỒ BỘ THUN NỮ MẶC NHÀ,99000,159000,,,https://filebroker-cdn.lazada.vn/kf/S284e916dcaff4a9ab91baf0be995718e1.jpg,Shop ĐỒ BỘ Ngân Nguyễn0333338151,Suits,https://www.lazada.vn/products/pdp-i3273923489.html
Áo Sơ Mi Vải Lanh Và Cotton Phong Cách Dân Tộc Áo Có Cúc Cổ Đứng Mới Cho Nữ Bộ Đồ Trà Thêu Ve Áo Xéo,124748,189786,4.717948717948718,72,https://my-live-02.slatic.net/p/a69f886745b24dab3b5f5dfee0aa55fc.jpg,LikeMy,Suits,https://www.lazada.vn/products/pdp-i1899478577.html
"Set đồ bé trai, bộ Quần áo hè bé trai mẫu polo Ura vải thun cotton size 18-50kg. Đồ bộ bé trai, bộ đồ cộc tay bé trai",97000,194000,5.0,1,https://vn-live-01.slatic.net/p/07af15c96cb7e0fb290a95aab41a26df.jpg,Gia Dụng Đồ Chơi Smartkid,Suits,https://www.lazada.vn/products/pdp-i3003947463.html
"Bộ Đồ Thể Thao Hai Mảnh SONIX Cho Nam, Bộ Đồ Mùa Hè Năm Điểm, Quần Lụa Lạnh Tay Ngắn, Mỏng, Nhanh Khô, Phong Cách Thường Ngày 2020",48424,108000,,,https://my-live-02.slatic.net/p/63655561369949960cc97701e6efdb12.jpg,SONIX Brand Store,Suits,https://www.lazada.vn/products/pdp-i554806747.html
"Đồ Bộ Trung Niên EH – Chất Lụa Hàn Cao Cấp, Thiết Kế Sang Trọng Kết Hợp Quần Mango",197010,300000,5.0,1,https://vn-live-01.slatic.net/p/d431d74b5b1b18f559601a32267abc69.jpg,MIDI SHOP- ĐỒ BỘ TRUNG NIÊN,Suits,https://www.lazada.vn/products/pdp-i3171377070.html
Bộ Váy Len Hai Mảnh Thiết Kế Cao Cấp Thời Trang Thu Đông 2025 Bộ Váy Ngắn Cổ Tròn Dài Tay Áo Sơ Mi Cổ Tròn,491000,964000,,,https://filebroker-cdn.lazada.vn/kf/Sddd7df7181bd42b49255bbc77e267618m.jpg,TB FASHION STORE,Suits,https://www.lazada.vn/products/pdp-i2791492060.html
Áo Thun Tay Ngắn Ice Silk Nhanh Khô Cho Nam Quần Short Chạy Bộ Buổi Sáng Bộ Đồ Thể Thao Mùa Hè Áo Thun Bóng Rổ Bộ Đồ Hai Mảnh,42000,1135000,,0,https://filebroker-cdn.lazada.vn/kf/Sadba197245f34ec6ab9a512edd786f030.jpg,Lazada Global,Suits,https://www.lazada.vn/products/pdp-i3203017757.html
EBKZ | Bộ Đồ Luyện Thái Cực Quyền Biểu Diễn Võ Thuật ,835000,,,,https://filebroker-cdn.lazada.vn/kf/Sa5b77f23b26443e5aad1b1848ad37793n.jpg,ebkz,Suits,https://www.lazada.vn/products/pdp-i3197697335.html
WEICHENGNEI | Bộ Đồ Mưa Có Quần Tách Riêng – Tiện Lợi Khi Đi Xe Máy Cho Nam Nữ,319000,876000,4.887445887445887,741,https://filebroker-cdn.lazada.vn/kf/Sba40e2d009084761bb4c0491595e747bO.jpg,Weichengnei Outdoor Fashion,Suits,https://www.lazada.vn/products/pdp-i3197895810.html
Lontakids 2-14 năm trẻ em 3PCs/5pcs bé trai ôm vừa dresswear tiệc cưới Bộ đồ quý ông sinh nhật màu đen trắng trang phục trang trọng TUXEDO Bộ quần áo,290000,446000,,4,https://sg-test-11.slatic.net/p/96df83ee59bde668ca93eaab77b2d3c6.png,YiQI Kids Formal Wear,Suits,https://www.lazada.vn/products/pdp-i2421329326.html
"ĐỒ BỘ NỮ, SÉT BỘ TOLE DÁNG BABYDALL TAY DÀI QUẦN DÀI MẶC NHÀ MÁT MẺ BIGSIZE 45-85KG",169000,259000,,,https://vn-live-01.slatic.net/p/69b588a87c73346bb31216778684a860.jpg,Lynh Clothing Store ,Suits,https://www.lazada.vn/products/pdp-i3262183385.html
"Bộ Quần Áo Đi Mưa Trong Suốt, Chất Liệu Nilong",24000,,,,https://filebroker-cdn.lazada.vn/kf/S6cd4aa7250834e028980c82c19506d80H.jpg,Kim Khí Hải Dương,Suits,https://www.lazada.vn/products/pdp-i2819581747.html
"ĐỒ BỘ NỮ, SÉT BỘ BA MÓN THUN LẠNH DẺO ÁO HAI DÂY PHỐI QUẦN SUÔNG KÈM ÁO KHOÁC TÔN DÁNG 3 MÀU BIGSIZE 45-85KG",219000,299000,,,https://vn-live-01.slatic.net/p/4c9eea2b72a4b5db17c5c3940e3910a8.jpg,LINH STORE ĐỒ BỘ VÀ MỸ PHẨM,Suits,https://www.lazada.vn/products/pdp-i2835942408.html
Mới xếp li của phụ nữ Cotton Linen Áo khoác mặc Suit nhỏ lỏng thường dài tay áo vest áo khoác Jacket Trọng lượng nhẹ,182125,280278,5.0,16,https://sg-test-11.slatic.net/p/78d803698a4cf0f6c1a75d762329ea40.png,LikeMy,Suits,https://www.lazada.vn/products/pdp-i2617912661.html
Bộ Đồ Thể Thao Nam Thường Ngày Cổ Tròn Tay Dài Dày Dặn Ấm Áp Thời Trang Quần Dài Hai Mảnh Mùa Thu Đông Cotton,218000,,,,https://filebroker-cdn.lazada.vn/kf/S744a03a82d6d4068ae34c1e05a8de755z.jpg,TB FASHION STORE,Suits,https://www.lazada.vn/products/pdp-i2958167755.html
ĐỒ BỘ THUN NỮ MẶC NHÀ,115000,159000,,,https://filebroker-cdn.lazada.vn/kf/Sfac71ff45e564b73bd64d213920763c1n.jpg,Shop ĐỒ BỘ Ngân Nguyễn0333338151,Suits,https://www.lazada.vn/products/pdp-i3239357373.html
Bộ Quần Áo Mưa 3 Lớp Khóa,320000,350000,4.827586206896552,58,https://vn-live-01.slatic.net/p/4e1da4091a068fa4d17f0e6d0645b83a.jpg,GIAYSYQUAN.COM,Suits,https://www.lazada.vn/products/pdp-i2669002265.html
[40-100kg] Đồ ngủ mùa thu và mùa đông nam vải cotton cỡ lỡn Nam Bộ suit nhà rộng,331816,430235,5.0,1,https://sg-test-11.slatic.net/p/5c27fdded945b077bb2cbd7971b90c47.jpg,NCE Teenager,Suits,https://www.lazada.vn/products/pdp-i3200181541.html
TCU Style BDU Version RG Ranger Green Military Green Training Suit Battle Uniform Set Old School Field Trip Camouflage Clothes,684000,,,,https://filebroker-cdn.lazada.vn/kf/S1766b6e9a94544b5b5f5f7f5c2387bbbs.jpg,Lazada Global,Suits,https://www.lazada.vn/products/pdp-i3203550116.html
Bộ Đồ Judo Tiêu Chuẩn Dành Cho Nam Và Nữ Bộ Đồ Tập Luyện Dày Màu Trắng Xanh Dành Cho Trẻ Em Bộ Đồ Judo Dành Cho Nam Và Nữ,747000,862000,,,https://filebroker-cdn.lazada.vn/kf/S70ce533c9041479cba4c078dc6b86e38V.jpg,TAO Home Décor,Suits,https://www.lazada.vn/products/pdp-i3241484485.html
"ĐỒ BỘ NỮ, SÉT BỘ ÁO XÒE BÈO PHỐI QUẦN SUÔNG CARO XINH XẮN 3 MÀU BIGSIZE 45-85KG",169000,249000,,,https://vn-live-01.slatic.net/p/dfda36f5dc269cd21cb4ede9cc39418d.jpg,Lynh Clothing Store ,Suits,https://www.lazada.vn/products/pdp-i2920636178.html
"Set thiết kế, bộ đồ công sở nữ  áo gile Mango Quảng Châu đính nút bọc có lót trong kèm quần suông dài xếp ly phong cách Hàn Quốc",199000,289000,,,https://vn-live-01.slatic.net/p/21f29052b638fde50e3abdc7055a4dac.jpg,Shop Đông Nghi,Suits,https://www.lazada.vn/products/pdp-i3129537720.html
Billabong Outdoor Diving Suit Quick Dry Long Sleeve Surfing Suit Sunscreen Professional Swimming Free Diving Surfing Suit,380480,464000,5.0,1,https://filebroker-cdn.lazada.vn/kf/S371dc5237b694306a50341d7b56ca25b7.jpg,TB supermarket store,Suits,https://www.lazada.vn/products/pdp-i3255653446.html
LOMOGI Thời Trang Phù Hợp Với Voan Áo Sơ Mi Nữ Hai Mảnh Mùa Hè Hàn Quốc + Quần Đùi Ống Rộng,278434,420000,4.723076923076923,134,https://my-live-02.slatic.net/p/840126768756ffbf3abea4ededea6b55.jpg,LOMOGI Official Store,Suits,https://www.lazada.vn/products/pdp-i1081784684.html
KeyRu | Bộ Đồ Mô Tô Chống Nước Cho Người Giao Hàng Toàn Thân,882000,1667000,4.7272727272727275,14,https://filebroker-cdn.lazada.vn/kf/S3978cca9508745ba82c609ef22c3bde9p.jpg,KEYRU Specialty Store,Suits,https://www.lazada.vn/products/pdp-i3220633234.html
