ten_san_pham,gia_sale,gia_goc,rating,so_review,link_anh,shop,category,url_san_pham
"Quần Jogger Túi Hộp Cho Bé Trai Bé Gái, Nam Nữ Thời Trang trẻ em Moonbe Quần Gió Túi Hộp",126650,149000,,,https://sg-test-11.slatic.net/p/2ecda500daa75ae5b830ca04dd0e2e87.jpg,Hkids - Quần áo trẻ em xuất khẩu,pants,https://www.lazada.vn/products/pdp-i3189867615.html
Quần ống loe thun poli q6,53100,69100,4.926470588235294,132,https://filebroker-cdn.lazada.vn/kf/S96a9ffa4d9b94eed834b2a0c02e4cefbb.jpg,ULZZANG STORE HCM.Selection,pants,https://www.lazada.vn/products/pdp-i2653561737.html
"Quần thun tăm , quần ống rộng thun tăm xuất hàn BIGSIZE (40-80KG) phong cách hàn quốc [cam kết ảnh tự chụp 100%]",92150,160000,4.862745098039215,51,https://vn-live-01.slatic.net/p/218f4a300356aeb497a31b53bc85e47d.jpg,Xưởng May Tiến Khang,pants,https://www.lazada.vn/products/pdp-i2021525591.html
Quần ống rộng chất tổ ong - Quần jogger thể thao unisex dày dặn phong cách Ulzzang,75611,162000,4.949367088607595,1264,https://vn-live-01.slatic.net/p/90074fe184abb4f221b0cae5f30029b1.jpg,Thời Trang Eliva,pants,https://www.lazada.vn/products/pdp-i1999146240.html
Man Multi-Pockets Cargo Pants Breathable Flap Pocket Casual Pants for Hiking Camping Four Seasons DTJT-VN,238000,476000,4.6,5,https://sg-test-11.slatic.net/p/baa9a27dfddd86d4eedbc0d207a3ed71.jpg,dtujwtjt,pants,https://www.lazada.vn/products/pdp-i2953650260.html
"Wide-Leg Pants That Look Like a Pleated Skirt, 95cm Long, Hacked into a Youthful, Dynamic Ruby Wave Shape Td832",112000,182000,5.0,18,https://vn-live-01.slatic.net/p/2ac450ea941672e7211e7162ec71cd66.jpg,Xưởng May Vũ Thuỷ,pants,https://www.lazada.vn/products/pdp-i2819199986.html
"Quần giữ nhiệt Nữ Chulio, quần legging lót lông dầy dặn, co dãn 4 chiều form đẹp- BL23W03",49000,,4.413043478260869,46,https://sg-test-11.slatic.net/p/7be647cd43560d037ba22ffa2d72e285.jpg,CHULIO,pants,https://www.lazada.vn/products/pdp-i2413401619.html
"Men's and Women's Casual Pants with a Straight Form and Half Elastic Waistband, Sun, Comfortable to Wear, Easy to Coordinate with Korean Style Outfits.",88110,180600,5.0,21,https://vn-live-01.slatic.net/p/1e72d61716a473430849cc1762719c1e.png,SUN FASHIONNN,pants,https://www.lazada.vn/products/pdp-i3083122799.html
LIVE GREAT Light breathable ice silk pants for work-men's loose trousers-casual pants,96000,200000,4.907608695652174,368,https://sg-test-11.slatic.net/p/4d952281c081b136ea0f67f0206da2d1.jpg,LIVE GREAT,pants,https://www.lazada.vn/products/pdp-i2396967936.html
Asrv Men's Casual Pants Easy-To-Match Fashionable Straight-Leg Trousers with Pockets,54000,114000,,0,https://sg-test-11.slatic.net/p/098421bd49ed2b33c7a177889da07d35.png,ASRV,pants,https://www.lazada.vn/products/pdp-i3238117525.html
MOLAN Men's Thin Drapey Wide Leg Straight Sports Pants Solid color simple casual trousers,97000,207000,4.912621359223301,103,https://sg-test-11.slatic.net/p/aeecb77fd56439218cce5cdf8f3ae16d.jpg,MOLAN Shopping Mall,pants,https://www.lazada.vn/products/pdp-i2492254853.html
Quần Vải Nhung Kẻ Dày Lót Lông Cừu Rộng Rãi Cho Mẹ Mùa Đông Quần Dài Nữ Trung Niên Và Cao Tuổi Phong Cách Harajuku Đa Năng,84240,102000,4.6923076923076925,13,https://filebroker-cdn.lazada.vn/kf/S06625111a2f142568323df32a827ea1fR.jpg,TB FASHION STORE,pants,https://www.lazada.vn/products/pdp-i2911487200.html
Quần Dài Thun Thể Thao Ống Suông (không bo ống) Nam Nữ có BIGSIZE từ 50kg đến 150kg,150000,,4.928571428571429,14,https://filebroker-cdn.lazada.vn/kf/S492e1f65e5f2419c8fabb33a0be060a4P.jpg,Bun - Thời Trang Nam Bigsize,pants,https://www.lazada.vn/products/pdp-i2667048977.html
40-105kg Men's and Women's Wide-Leg Elastic Pants Big Size 2 Stripes Straight Elastic Leather Pants in Many Colors Fashion Wolf Unisex,78280,140000,4.833333333333333,71,https://vn-live-01.slatic.net/p/c32dc8dc13cb8a115df386b4bd1b39bb.png,Soi_Store Bigsize Clothing,pants,https://www.lazada.vn/products/pdp-i2428202850.html
"Quần DÀI ống rộng đai thun, cột dây, chất BO GÂN, Đủ Màu, mềm, mịn, mát, thời trang",38900,74000,5.0,1,https://vn-live-01.slatic.net/p/e8170385804be6045306f87dcb4860bb.jpg,YES FASHION,pants,https://www.lazada.vn/products/pdp-i2288760423.html
"(18-52kg) Quần túi hộp thời trang cho bé trai từ 5-16 tuổi, quần dài mùa hè, mùa thu đông trẻ em nam mẫu BP chất nỉ, kaki",75050,158000,4.886956521739131,230,https://vn-live-01.slatic.net/p/ac135e6e3b6dc45d05934b252eb3c875.jpg,Xưởng May Chi Chi 1,pants,https://www.lazada.vn/products/pdp-i2827399681.html
New Style Women's Office Trousers Made of High Quality Materials in Many Colors,81000,132000,4.859773828756058,3095,https://sg-live-01.slatic.net/p/34d6b4b936d43b9d2835ec48200f8025.jpg,Tuấn Hưng Style,pants,https://www.lazada.vn/products/pdp-i1229456525.html
"[Combo of 2 Pants] Wide-Leg Pants Made of High-Waisted Elastic Waistband, 96-104cm Long, Japanese Style, Super Pretty Figure",57000,258000,4.859649122807017,171,https://sg-test-11.slatic.net/p/9eb1448af4e5c57ec4167821d8513760.jpg,Xưởng May Song Anh,pants,https://www.lazada.vn/products/pdp-i2896344598.html
Wide-Lettered Pants,79000,89000,4.899736147757256,379,https://filebroker-cdn.lazada.vn/kf/S338ba61c5a374a8483b3831f37974e1bD.jpg,bbtimes tho cam,pants,https://www.lazada.vn/products/pdp-i1227247735.html
"Quần tây ống rộng nữ lưng cao, ống rộng dáng suông cạp cao khóa sườn dáng dài 92cm tôn dáng chất vải không nhăn xù",69000,138000,4.8125,128,https://sg-test-11.slatic.net/p/56f2cec6e13f9a2737d7713fb62666d5.jpg,Xưởng May Song Anh,pants,https://www.lazada.vn/products/pdp-i2641052509.html
"Mexican Men's Long Jeans, Straight Leg, Non-Stretch Material, Available in Big Sizes",303800,400000,4.902912621359223,103,https://filebroker-cdn.lazada.vn/kf/S62c03286cf974edea5e788f4258b65e3R.jpg,LHL SHOP,pants,https://www.lazada.vn/products/pdp-i2451052159.html
"Quần ống rộng dáng suông , Quần đũi suông chun sau bigsize đến 83kg",96030,130000,4.822784810126582,79,https://vn-live-01.slatic.net/p/d23e36932f8b2a529d0774a9dac05414.jpg,Xưởng May Tiến Khang,pants,https://www.lazada.vn/products/pdp-i2405360281.html
Quần Tây Nam Trung Niên BSAMIO Phong Cách Công Sở Ống Suông Vải Mềm Có Size Đại Từ 28 Đến 38,107910,137000,4.994708994708994,190,https://vn-live-01.slatic.net/p/bfc94b7cc1e05fb9559515ee25172d0f.png,Thời Trang Trung Niên BSAMIO,pants,https://www.lazada.vn/products/pdp-i3012909062.html
[Hoàn tiền 6%] Quần jeans ống xuông nhiều mẫu hình ngôi sao bé nào cũng thích lật lai sành điệu cá tính 20-55kg,85635,190000,4.833333333333333,54,https://vn-live-01.slatic.net/p/69d426753b78a465bfd602567fbef313.jpg,Shop Kids Babyy,pants,https://www.lazada.vn/products/pdp-i1649206391.html
Quần Tây Nam Body NAKIMEX Dáng Ôm Lịch Lãm Chất Vải Cao Cấp Co Giãn Công Sở 4 Màu Size Từ 28 Đến 37,127710,219000,4.938461538461539,65,https://vn-live-01.slatic.net/p/b489201b15d66c0087de02ed6c066326.jpg,Thời Trang Trung Niên BSAMIO,pants,https://www.lazada.vn/products/pdp-i3068924636.html
Quần nữ kẻ sọc caro ống xuông mềm mát trẻ trung_New,48510,80000,5.0,1,https://sg-test-11.slatic.net/p/6b7e804ed4332572ba9664cfe9692241.jpg,yqvX1Tyy,pants,https://www.lazada.vn/products/pdp-i3150034846.html
JIFANPAUL | Spring & Autumn New Style Boys' Loose Straight Jeans,181000,224000,4.714285714285714,7,https://filebroker-cdn.lazada.vn/kf/S3b66fff661b14636bfed3471a855c462V.jpg,JIFANPAUL Global,pants,https://www.lazada.vn/products/pdp-i3197806739.html
"Quần ống loe nữ , quần ống bas cạp cao có túi chất cotton co giản 4 chiều  quần legging ống loe nữ lưng cao cạp thun tôn dáng Adam_fashion",47200,118000,4.684057971014493,689,https://vn-live-01.slatic.net/p/2af7d85520e293dc62eccb1432812afb.jpg,Adam1995,pants,https://www.lazada.vn/products/pdp-i2043215401.html
Quần Gió Lụa Hàn ống xoè rộng tôn chân thoải mái cạp Lưng Chun mã 225,98010,198000,4.666666666666667,18,https://sg-test-11.slatic.net/p/d43d3c97c0bf4dbfa453c6afc98bc1e0.jpg,Xưởng May Song Anh,pants,https://www.lazada.vn/products/pdp-i3134833933.html
Women's Jeans Women's Wide Leg High Waist Jeans 100% Cotton 4-Way Stretch Super Beautiful Style,194040,360000,4.758620689655173,29,https://vn-live-01.slatic.net/p/8dae9df8941e95b4f663a751496bac76.jpg,TOMOFASHION,pants,https://www.lazada.vn/products/pdp-i2339974597.html
Quần Thun Gân Cao Cấp Ống Suông Siêu Hack Dáng Cực Hot Mềm Siêu Co Giãn Freesize 45-65Kg,63500,138000,5.0,26,https://vn-live-01.slatic.net/p/1d41978776c81de484c8cb7cacce15be.jpg,MINH THU SHOPPING,pants,https://www.lazada.vn/products/pdp-i2348059878.html
Quần baggy chất kaki 2 da bigsize Nam Nữ từ 40kg - 75kg  thêu logo sang trọng phong cách hàn quốc thời trang kenchi,78764,147000,4.935064935064935,231,https://vn-live-01.slatic.net/p/743a0f0b657e393d8da894b29810419c.png,Thời trang kenchi,pants,https://www.lazada.vn/products/pdp-i2614350135.html
"Quần ống  suông NỮ chất Đũi Nhật cao cấp , Quần đũi suông chun sau bigsize đến 78kg XƯỞNG MAY TIẾN KHANG",84150,140000,5.0,84,https://sg-test-11.slatic.net/p/f77910224a35190bb8b5b5c687716bdf.jpg,Xưởng May Tiến Khang,pants,https://www.lazada.vn/products/pdp-i2577752220.html
"Quần tây nữ ống Suông , quần tây công sở cao cấp, quần tây lưng cao, quần bigsize, quần tây công sở, quần hãng sale",107776,199000,4.953125,127,https://vn-live-01.slatic.net/p/a6787e75fd6e7bb887f4f6b0420e5212.jpg,Anfashion 0835236688,pants,https://www.lazada.vn/products/pdp-i2246550288.html
(15-45kg) Quần kaki túi hộp hot trend phong cách chất chơi cho bé trai/gái,65960,137000,4.896551724137931,58,https://vn-live-01.slatic.net/p/d9386afd63eace8949ca9972f7eafa2c.jpg,Shop Kids Babyy,pants,https://www.lazada.vn/products/pdp-i1595714282.html
QUẦN THUN DÀI CHO BÉ DC CAO CẤP ( CÓ SIZE ĐẠI 20-50KG),74700,140000,4.7759699624530665,799,https://vn-live-01.slatic.net/p/788e28e9b5695ca87663718ccd8015f7.jpg,SHOP KEM 1585795790,pants,https://www.lazada.vn/products/pdp-i1666930917.html
Quần bầu legging ( Dài - Cạp Chéo ) chất cotton co giãn 4 chiều cho mẹ bầu,64220,119000,4.830150753768844,995,https://sg-live-01.slatic.net/p/dcc170bbb2778488e97e14679c6575ac.jpg,Xưởng Bầu Minh Thư,pants,https://www.lazada.vn/products/pdp-i1895147807.html
Quần Kaki Nam Trung Niên Ống Suông Vải Dày Dặn Mềm Không Nhăn Form Chuẩn Có Nhiều Màu Mặc Đi Làm,119000,149000,4.943870014771049,677,https://vn-live-01.slatic.net/p/bc0b57d5e623da17f787ed2293d675ac.jpg,Thời Trang NAKIMEX,pants,https://www.lazada.vn/products/pdp-i2643837375.html
"Quần Dài Ông Suông, Đai Thun, Cột Dây, Chất GÂN THÁI, Đường May Đẹp, THiết Kế Thời TRang, Phối Mãu Siêu Xinh ( ĐỦ SIZE )",39900,100000,5.0,1,https://vn-live-01.slatic.net/p/3812d68c6b62067a7535090d1f77222c.jpg,Mạnh Khôi Men's Fashion,pants,https://www.lazada.vn/products/pdp-i2341048437.html
Quần ống suông quần ống rộng chất liệu thô mềm mịn thoải mái hoạ tiết kẻ hot trend xinh xắn nhiều màu xinh ( ảnh thật),89000,100000,4.578947368421052,19,https://sg-test-11.slatic.net/p/b9da93d89eb0002348eebc9257636ec3.jpg,Anmoon.store,pants,https://www.lazada.vn/products/pdp-i2515661508.html
Women's clothing long dress American silk sewing wide leg loose elastic waist long zipper elastic band soft dear,95000,150000,4.864864864864865,37,https://vn-live-01.slatic.net/p/d1befbb497f99e5f6b71ace4c3edfa9f.jpg,Thế Giới Áo Dài,pants,https://www.lazada.vn/products/pdp-i2996684173.html
"(18-52kg) Quần dài, short kaki trẻ em nam, quần vải kaki túi hộp thời trang cho bé trai mẫu DY size 18-52kg, quần bé trai đi học",73000,146000,4.75,16,https://vn-live-01.slatic.net/p/1b80f95ce04b46139c3a878400b12c59.jpg,Xưởng May Chi Chi 1,pants,https://www.lazada.vn/products/pdp-i3159336112.html
"Quần Dài Thổ Cẩm Voi Thái Lanh – Chất Liệu Mát Lạnh, Phong Cách Dân Tộc",68000,100000,5.0,11,https://vn-live-01.slatic.net/p/c6796c0cf59d95f977d8c50a16cdbea8.jpg,Đồng Phục Phương Hiếu,pants,https://www.lazada.vn/products/pdp-i2873657495.html
NALING | Retro Loose Straight Leg Jeans for Plus Size Women,138000,,1.5,2,https://filebroker-cdn.lazada.vn/kf/S89179bccf6b34f76aba91db6373f018ec.jpg,NALING selected,pants,https://www.lazada.vn/products/pdp-i3219653997.html
"Quần jogger nữ Ulzzang Len Tăm , Quần thể thao unisex bigsize chất liệu dày dặn cam kết không bai xù THỜI TRANG KENCHI",86330,120000,4.904471544715447,492,https://vn-live-01.slatic.net/p/c8c98d8dd3840af4894a7cb7fbe926dc.jpg,Thời trang kenchi,pants,https://www.lazada.vn/products/pdp-i2426089648.html
ASRV Men's Ice Silk Pants High Stretch Thin Casual Quick Dry Men's Sports Cropped Pants,70000,140000,4.676470588235294,141,https://sg-test-11.slatic.net/p/1586260be9a11d2e80472243f1526dd3.jpg,ASRV,pants,https://www.lazada.vn/products/pdp-i2596026272.html
Quần ống rộng suông khóa sườn,98000,180000,4.836798336798337,962,https://vn-live-01.slatic.net/p/b30813d74ce245c90630b586f74e7456.jpg,xưởng may ngọc bảo,pants,https://www.lazada.vn/products/pdp-i454720790.html
QUẦN JEANS NAM NỮ ỐNG LOE RỘNG THẲNG VIỀN SỌC BÊN NHẸ NHÀNG KIỂU RETRO MỸ PHONG CÁCH HÀN QUỐC SÀNH ĐIỆU - DUBAI FASHION,132000,220000,3.4,5,https://vn-live-01.slatic.net/p/77cb08306fbb378caa01f7185c2e83f4.jpg,Dubaishop,pants,https://www.lazada.vn/products/pdp-i2772656512.html
"2-Stripes Ribbed Wide Leg Fleece Pants, Long, Loose Form, Thick Fishskin Elastic Fabric for Men and Women, Easy to Match",145040,300000,5.0,10,https://vn-live-01.slatic.net/p/5e53623f9898677e3ce5f0c983a8482a.jpg,MAYLAN STORE 02,pants,https://www.lazada.vn/products/pdp-i2805556231.html
Bonnie Cathy Quần Đi Làm Rằn Ri Mẫu Mỏng Quần Chín Tấc Thể Thao Nhanh Khô Thường Ngày Bo Gấu Rộng Rãi Cho Nam Thời Trang,86400,178000,,0,https://sg-test-11.slatic.net/p/7f5e9cfdeaf2bb37c50012ded5bf2c8d.png,Bonnie Cathy Mall,pants,https://www.lazada.vn/products/pdp-i3165737233.html
"IEF Gray floral wide leg pants for women, high waist summer sweatpants for women, loose fit sweatpants for women, big size women's wide leg pants",94000,186000,4.885714285714286,36,https://vn-live-01.slatic.net/p/c3f9eba8df5c87c9d185b8bce2ea967f.jpg,IEF Shopping Mall,pants,https://www.lazada.vn/products/pdp-i2871640675.html
Quần Dài Nam Mùa Thu Đông Dày Dặn Lót Lông Cừu Đen Rộng Rãi Cỡ Lớn Co Giãn Đa Năng Quần Dài Thường Ngày Thời Trang,56000,148000,4.592592592592593,324,https://filebroker-cdn.lazada.vn/kf/S8744029b263a49ee81cd18a8158e9da53.jpg,TBC New Store 687,pants,https://www.lazada.vn/products/pdp-i2406485009.html
Lansboter Men's solid color leggings loose wide leg trousers Thin breathable casual pants,76000,164000,4.8517520215633425,381,https://sg-test-11.slatic.net/p/28ca59581de4dd4b9495229b7b4ec163.png,Lansboter,pants,https://www.lazada.vn/products/pdp-i2444135604.html
AMILA Middle school and university children's summer thin Pants Boys' 11 year old outdoor sports pants casual sports mosquito proof pants,75000,156000,5.0,120,https://my-live-02.slatic.net/p/f09b4a9228d0cb4e6b84fe394b1ce62c.jpg,AMILA Shopping mall,pants,https://www.lazada.vn/products/pdp-i1989969556.html
Thickened Fleece Lined Casual Work Jeans Men's Loose Straight Leg High Waist Winter Fashion Urban Style Wear Resistant Dirt Proof,71000,127000,4.785714285714286,50,https://filebroker-cdn.lazada.vn/kf/Sf114b94e3cac4b1e86300c5162b29009z.jpg,Lazada Global,pants,https://www.lazada.vn/products/pdp-i3132547511.html
Retro American High Street Loose Wide Leg Jeans Women's High Waist Slimming Straight Leg Trousers Fashionable Casual Pants,74000,,5.0,1,https://filebroker-cdn.lazada.sg/kf/S3d5ef223a8db4afcaa32f3f4e6a5139dJ.jpg,TB FASHION STORE,pants,https://www.lazada.vn/products/pdp-i3237447461.html
[HCM]quần dài chất thun lạnh  bo gấu bé trai bé gái siêu mịn mát-co giãn-quần chống muỗi cho bé(size 7-35kg)  ảnh thật,25839,58000,4.859649122807017,114,https://vn-live-01.slatic.net/p/c0666f58d68dcf9bd5890fa2eb055f98.jpg,Thời Trang BULL KID,pants,https://www.lazada.vn/products/pdp-i1079974200.html
Soft Stretchy Slimming Jeans Women's High Waist Straight Leg Cotton Denim Spring Fashion plus Size Nine-Piece Pants,86000,,,,https://filebroker-cdn.lazada.vn/kf/S81aee89f408e47beadf0e5a187f619d5h.jpg,Lazada Global,pants,https://www.lazada.vn/products/pdp-i3253013842.html
Slimming High Waist Wide Leg Straight Cut Jeans for Women in Black Grey Workwear Style Hip Hop Street Dance Trousers Pear Shape Body,74000,,,,https://filebroker-cdn.lazada.vn/kf/S7db63903b8764655b1371e36d48c3d46w.jpg,Lazada Global,pants,https://www.lazada.vn/products/pdp-i3253169067.html
"Bán Buôn Quần Trẻ Em 2021 Mùa Thu Kiểu Mới, Trẻ Sơ Sinh Và Trẻ Sơ Sinh Mặc Bên Ngoài Quần Áo Trẻ Em Gái Đáy Chín Điểm",17500,22750,,,https://sg-test-11.slatic.net/p/eaffd1a0c2afeb08ff8dcbe6defb7f29.png,goya68,pants,https://www.lazada.vn/products/pdp-i3116895984.html
"[in Stock] Women's Wide Leg Pants with High Waist, Hack Style, Beautiful Quality",58098,167000,4.877862595419847,131,https://vn-live-01.slatic.net/p/767e3c22119341d8e344249aa64872fd.jpg,Thời Trang Eliva,pants,https://www.lazada.vn/products/pdp-i2008824187.html
"Quần Jean Nữ COCOEPPS Ống Rộng Eo Cao – Phong Cách Thời Trang Thả Lỏng, Vải Mềm Mặc Cực Êm",89000,115700,4.875776397515528,161,https://filebroker-cdn.lazada.sg/kf/S26ac3b1a87fc4f0592a69961162aefb79.jpg,COCOEPPS CHOICE.VN,pants,https://www.lazada.vn/products/pdp-i2521171482.html
Quần ống rộng chất đũi dáng sớ váy phối cúc chất liệu đũi tơ siêu nhẹ mát phong cách vitage có hai túi hai bên mã T_819,72082,138000,4.827488151658768,1055,https://vn-live-01.slatic.net/p/6e37c05d3145793fbd4a062fd8c798f5.jpg,Xưởng May Song Anh,pants,https://www.lazada.vn/products/pdp-i2315358936.html
Retro American Washed Heavy Stitching Jeans Women Loose Slim Straight Leg Wide Pants Floor-Length Pants Casual Blue Denim,56000,80000,,,https://filebroker-cdn.lazada.vn/kf/Sb9535731f6174254a4d0255b9fb86d1dE.jpg,TB FASHION STORE,pants,https://www.lazada.vn/products/pdp-i3238715020.html
JIFANPAUL | Spring & Autumn Corduroy Casual Pants for Girls with Elasticity and Straight Leg,135000,178000,4.875,8,https://filebroker-cdn.lazada.vn/kf/S76e6d4947a56482d83b05e714b044747K.jpg,JIFANPAUL Global,pants,https://www.lazada.vn/products/pdp-i3197834378.html
Quần Ống Rộng Cạp Chun Lưng Cao Chất Đũi Tơ Xuông phong cách nhật bản Lên Dáng Siêu Xinh,48510,119000,4.855670103092783,1649,https://sg-test-11.slatic.net/p/6743bed298c2957a86e7a205891ff4f4.jpg,Xưởng May Song Anh,pants,https://www.lazada.vn/products/pdp-i2488608615.html
Women's Flared Jeans Women's High-Waisted Bass Jeans 100% Cotton 4-Way Stretch High-Quality Export Company Products,179000,360000,4.904761904761905,63,https://vn-live-01.slatic.net/p/62c763a0db61d2616f10279be696d5c6.jpg,hunglongfashion,pants,https://www.lazada.vn/products/pdp-i2361564791.html
"Quần jean dáng dài cho bé trai 1-7 tuổi size 11-27kg chất Jean mềm mại, ấm áp thiết kế mới 2025 | ĐỨC TRÍ KIDS",78210,134000,4.86,49,https://sg-test-11.slatic.net/p/d1c0eb072b95b5cd5a6933dc41d303f2.jpg,D&T Kisd Thời trang cho bé,pants,https://www.lazada.vn/products/pdp-i2918857289.html
Quần Thể Thao Joger Quần Dài nam nữ QUẦN TRƠN,75000,99000,4.738525730180807,719,https://vn-live-01.slatic.net/p/efe9b9ad57a893f37fadc8db4686e525.jpg,DuyenShop247,pants,https://www.lazada.vn/products/pdp-i1457183603.html
JIFANPAUL | Spring-Autumn Boys' Jeans Fashionable Korean Style,140000,161000,,,https://filebroker-cdn.lazada.vn/kf/S3f89b4f08c944b398f543e7443034c33A.jpg,JIFANPAUL Global,pants,https://www.lazada.vn/products/pdp-i3197247388.html
High Waist Wide Leg Jeans Women's Summer Thin Loose plus Size Pear Shape Straight Cut Pants Elastic Waist Slim Fit Denim Jeans,67000,,1.0,1,https://filebroker-cdn.lazada.vn/kf/Sbb14b72772c0484083f26af4d8ff505aX.jpg,Lazada Global,pants,https://www.lazada.vn/products/pdp-i3253109195.html
Quần SUÔNG TỔ ONG THÊU CHỮ C có dây rút thật điều chỉnh siêu hot trend freesize 45-60kg,63500,139000,4.859375,576,https://vn-live-01.slatic.net/p/68e9fc5ee3158b9a3bd6c8c65bdedf2e.jpg,MINH THU SHOPPING,pants,https://www.lazada.vn/products/pdp-i246180565.html
Quần lanh dài thổ cẩm bo gấu( Size 40-60kg),69000,,5.0,9,https://vn-live-01.slatic.net/p/a8e13b746099a05ed8e259b6da84e887.jpg,Hiền Vy,pants,https://www.lazada.vn/products/pdp-i2709195710.html
Low Waist Flared Wide Leg Jeans Women's Summer Thin Loose Straight Floor-Length Pants Slimming White Casual Trousers,74000,,,,https://filebroker-cdn.lazada.vn/kf/S350fbd9ba3114fe09fb7a77021bd495aR.jpg,TB FASHION STORE,pants,https://www.lazada.vn/products/pdp-i3239716218.html
3 SIZE 45-60KG TÙY CHIỀU CAO] QUẦN DÀI CARO LƯNG PHỐI TRẮNG CHẤT LỤA DÀI 98CM ỐNG RỘNG 28CM SIÊU HOT,56000,118000,4.952941176470588,85,https://vn-live-01.slatic.net/p/6a9ce7a3cda75a922f6ec70c1bac7e83.jpg,WINNY SHOP 1605685735,pants,https://www.lazada.vn/products/pdp-i2748514057.html
[Hàng cao cấp] Quần đũi dài Cao Cấp cạp thun Hot Trend 039,98010,143000,4.8,10,https://vn-live-01.slatic.net/p/11001fe5e0ea9819c5806ef09ecfd3c0.jpg,Linh Chi Store 88,pants,https://www.lazada.vn/products/pdp-i1645644299.html
Quần legging dài trơn cho bé gái cotton xuất dư từ 10~40kg,54870,59000,4.970731707317073,205,https://filebroker-cdn.lazada.vn/kf/S27efcf4c3be14e6a9a5ff42969352078q.jpg,Ananykids ,pants,https://www.lazada.vn/products/pdp-i2615712342.html
"Quần Ống Rộng Suông, Lưng Cao, Khóa Trước Dáng Dài Thiết Kế Thời Trang, Dễ Phối Đồ ( đủ màu, đủ size )",66600,120000,5.0,1,https://vn-live-01.slatic.net/p/90438bc92d2e705754faf0e1b93316ef.jpg,Mạnh Khôi Fashion,pants,https://www.lazada.vn/products/pdp-i2314010366.html
plus Size Korean Style Lace Trimmed Wide Leg Pants Women Casual Loose Straight Jeans Blue Cotton Fabric All Seasons,67900,81000,,,https://filebroker-cdn.lazada.vn/kf/S346f12b57f4848f1bda71debfd1fdcf9p.jpg,TB FASHION STORE,pants,https://www.lazada.vn/products/pdp-i3237410425.html
Quần mặc cùng áo dài (bán lẻ - LỤA MỸ cao cấp) - (nhiều màu),80000,,5.0,4,https://vn-live-01.slatic.net/p/930b7995b25bd860b54209c885f82d06.jpg,Áo Dài Minh Minh,pants,https://www.lazada.vn/products/pdp-i3055061403.html
"Long Pants for Boys, Fashionable Cargo Pants for Boys Size 18-52kg, Autumn and Winter Long Pants for Boys Model Bp, Thick Felt Material",68310,138000,5.0,9,https://vn-live-01.slatic.net/p/000fd08c76b0664d45b2fa5b309ef3e1.jpg,Gia Dụng Đồ Chơi Smartkid,pants,https://www.lazada.vn/products/pdp-i3009939381.html
Quần mặc cùng áo dài (bán lẻ - LỤA TẰM Ý cao cấp) - (nhiều màu),70000,75000,5.0,5,https://vn-live-01.slatic.net/p/2a6636dc2f5676f6821e7cc5be483b24.jpg,Áo Dài Minh Minh,pants,https://www.lazada.vn/products/pdp-i3055182058.html
MÃ 6666 Quần tuyết mưa ống rộng cạp cao gen bụng khóa trước mẫu mới tinh siêu hot,84000,199000,4.809160305343512,131,https://vn-live-01.slatic.net/p/ecd40182f4b7e57c69e06d4692968a1a.jpg,WINNY SHOP 1605685735,pants,https://www.lazada.vn/products/pdp-i2180817042.html
Quần Kaki Túi Hộp Retro chất liệu kaki bền bỉ mềm mịn,289000,370000,4.935714285714286,140,https://vn-live-01.slatic.net/p/1ba0d922bac73a80db2e3766490f18cb.jpg,Kevin Man,pants,https://www.lazada.vn/products/pdp-i2796542353.html
"Quần thể thao Nam/Nữ ống xuông chất liệu thun poly & da cá ,năng động cá tính phù hợp cho tập luyện thể thao giã ngoại….",87219,150000,5.0,7,https://sg-test-11.slatic.net/p/08a8be2eaea997bd461dc10c40745a6f.jpg,CHUYÊN SỈ GIÁ RẺ-HCM,pants,https://www.lazada.vn/products/pdp-i3132546030.html
Quần 3 sọc thể thao nữ chất liệu thun cotton,41000,53300,5.0,37,https://filebroker-cdn.lazada.vn/kf/S269b3f5755a44696b4f6640241ebfd33g.jpg,VAZCO SHOP.Selection,pants,https://www.lazada.vn/products/pdp-i2827036590.html
Quần suông tăm có dây rút thật điều chỉnh siêu hot freesize 45-65kg SIÊU HACK DÁNG,45100,65000,4.775914634146342,656,https://vn-live-01.slatic.net/p/57dc18c4e59d9893559884095b80faa2.jpg,MINH THU SHOPPING,pants,https://www.lazada.vn/products/pdp-i308692261.html
