ten_san_pham,gia_sale,gia_goc,rating,so_review,link_anh,shop,category,url_san_pham
Quần Jeans Suông Rách 2 Bên  Cạp Cao Lên Dáng Siêu Xinh Trẻ Trung Năng Động Chất Vải Mềm Mại Không Co Giãn,50000,100000,4.416666666666667,12,https://vn-live-01.slatic.net/p/f1cc1ded07e7947eae280cf8de1a3a85.jpg, Jeans Nữ Store,pants,https://www.lazada.vn/products/pdp-i2384262401.html
Quần Jean Nam Ống Suông Quần Bò Denim Ống Đứng Vải Không Giãn Dày Dặn Mềm Mịn Form Chuẩn Không Phai Màu,107692,218000,4.807780320366133,874,https://vn-live-01.slatic.net/p/febccff9ffdaeb083e2d9eccf2f08211.jpg,xuongjeandatthanh,pants,https://www.lazada.vn/products/pdp-i2403373830.html
Wide-Leg Brocade Pants (under 70kg) Have Deep Pockets and Are Sewn Symmetrically.,79101,85000,5.0,7,https://filebroker-cdn.lazada.vn/kf/S1d7d499355bf4ecc930a9b3f0c47fd4b3.jpg,Hawaii Shop SG,pants,https://www.lazada.vn/products/pdp-i2667417307.html
Quần Kaki Túi Hộp - JG4 Quần Kaki Túi Hộp Cao Cấp Ống Xuông MQ LUXURY 79.,119999,300000,4.905027932960894,178,https://vn-live-01.slatic.net/p/57dc63406817f8d9c87ff36f1e236596.jpg,MQ LUXURY 79,pants,https://www.lazada.vn/products/pdp-i2522898983.html
"Quần nỉ ống rộng hách dáng Local Brand Menstore, Bản chun to, chất nỉ tăm cao cấp dày dặn đứng form",125000,200000,4.9375,80,https://vn-live-01.slatic.net/p/7a65ccb2abf59aefb1813ffddbcfbaa6.jpg,3A Menstore,pants,https://www.lazada.vn/products/pdp-i2139906304.html
Quần  Nữ Ngẫu Nhiên Giá Rẻ,7578,70000,4.5504587155963305,109,https://vn-live-01.slatic.net/p/e2f73f67a3a13d87ba65c821b840abbd.jpg,Alomuare,pants,https://www.lazada.vn/products/pdp-i2090617781.html
QIAOXIZI | High Waist Thick Warm Wool Fleece Pants,156000,740000,4.75,12,https://filebroker-cdn.lazada.vn/kf/Sd736ca1e37944d0485890fdc83335d51i.jpg,QXZ FASHION,pants,https://www.lazada.vn/products/pdp-i3196536005.html
"Quần jean ống suông, ống rộng, quần form suông ống đứng, thời trang unisex cá tính Hàn Quốc.",169000,250000,5.0,2,https://filebroker-cdn.lazada.vn/kf/Sf04b60846e024174acac614142edeb0dR.jpg,AT Fashion Store,pants,https://www.lazada.vn/products/pdp-i3007675301.html
"Quần Gen Bụng Nữ Sau Sinh Nâng Mông, Thon Gọn Eo – Co Giãn, Thoáng Khí, Giá Rẻ, Hợp Với Mùa Hè 2 Màu Chọn Lựa",22300,31500,4.936070381231672,1704,https://vn-live-01.slatic.net/p/dbc8e24c8adc35295351f5f4965b5fc2.jpg,d3odSmYq.Selection,pants,https://www.lazada.vn/products/pdp-i2509442641.html
"High-Quality Men's Trousers for Young Men, Beautiful Wrinkle-Free Fabric, Wide-Leg Straight-Leg Form, Big-Size Trousers, Akira Exported Trousers",89816,199000,4.855297157622739,387,https://vn-live-01.slatic.net/p/98f51aa958c4df4ee0c4fdf6bfc5341a.jpg,HOÀNG GIA MENWEAR,pants,https://www.lazada.vn/products/pdp-i2236316428.html
Boy's cotton powerful personality khaki pants,85000,,4.82258064516129,62,https://vn-live-01.slatic.net/p/3976ef860ab059019475bd153cb28863.jpg,Nhộng Xốp Kids,pants,https://www.lazada.vn/products/pdp-i2706362585.html
[HCM]Quần jogger nam 2 túi kéo khoá vải da cá hàng cực đẹp,69000,79000,4.815680880330124,727,https://vn-live-01.slatic.net/p/be1d357d49cd6fa5b74984261227bb0d.jpg,GinoShop 99,pants,https://www.lazada.vn/products/pdp-i836888214.html
"8-40kg Quần Legging Dài Bé Gái Cực Thoải Mái Và Sang Chảnh,Quần Thun Ôm Dài Bé Gái",23750,25000,4.951076320939334,510,https://vn-live-01.slatic.net/p/96c9bcb467f34d91bc6eb35c55d10973.jpg,Samkids store,pants,https://www.lazada.vn/products/pdp-i2747265500.html
"Casual Pants, High Quality Men's Pants, Gray Men's Casual Pants, Pierre Cardin Pants 2025 New Model",259000,699000,4.902489626556017,1446,https://vn-live-01.slatic.net/p/f554c96b810f08e5d657d44af3005d61.jpg,Tổng Kho Hàng Xuất Dư,pants,https://www.lazada.vn/products/pdp-i2479221028.html
"Quần Dài Nữ Woman Basic Ống Rộng Cạp Chun Phối Khuy Lưng Cao Chất Lụa Băng, Quần Dài Nữ Nhiều Màu Xếp Ly Bigsize Trẻ Trung Năng Động Phù Hợp Đi Làm Đi Chơi QD24",131000,200000,4.923076923076923,13,https://vn-live-01.slatic.net/p/fc1f4090d1bec0b2ec95d5a1a27f82d7.jpg,WOMAN BASIC STORE,pants,https://www.lazada.vn/products/pdp-i3121092726.html
Quần dài thể thao nam in logo NY 2 túi kéo khoá hàng đẹp,74000,119000,4.821608040201005,796,https://vn-live-01.slatic.net/p/40331bc8f1846fbbc15441648bd8b6b1.jpg,Diorgino,pants,https://www.lazada.vn/products/pdp-i2037995010.html
(2 SIZE 40-68KG) Quần Baggy Đũi Xước Mát Mịn Hàn Quốc Lưng Thun tùy chiều cao,65000,129000,4.751173708920188,426,https://vn-live-01.slatic.net/p/5d3c7ca29503e44ed786bcc8f3d6b979.jpg,BETTY SHOP 1602225260,pants,https://www.lazada.vn/products/pdp-i896732510.html
Quần baggy Kaki dài ống rộng túi hộp ống quần có dây rút form ống rộng  + tặng kèm móc khóa,99000,120000,4.788135593220339,118,https://vn-live-01.slatic.net/p/dedf5cc33c4e5522541e26db1c0be157.jpg,Kaybaii Shop,pants,https://www.lazada.vn/products/pdp-i2500011916.html
"Quần jean ống rộng nam nữ unisex SUN T9 màu sắc đa dạng, cạp thường hách dáng phong cách hàn quốc",139000,250000,5.0,1,https://vn-live-01.slatic.net/p/38315e3105ee923fcd60ef3c5b22b79a.png,SUN FASHIONNN,pants,https://www.lazada.vn/products/pdp-i3083034912.html
QUẦN JEANS NAM NỮ CHẤT BÒ UNISEX ỐNG SUÔNG RỘNG ĐEN CHỈ NỔI  - DUBAI FASHION,103000,200000,4.2,5,https://vn-live-01.slatic.net/p/b0289545f184a1d23c92bba95843bf6c.jpg,Dubaishop,pants,https://www.lazada.vn/products/pdp-i3036591101.html
Quần jean nam đen thiết kế rách gối chất jean cotton co giãn tốt bền màu form dáng skinny mẫu mới cao cấp giá rẻ chuẩn shop,79000,229000,4.363636363636363,22,https://vn-live-01.slatic.net/p/e96557478a7a35e2cb278e6da88a4aa2.jpg,TANBEO-SHOP,pants,https://www.lazada.vn/products/pdp-i2212264158.html
"Quần dài kaki Nam Zaara cao cấp ống suông chất dày co giãn full team mạc, quần kaki nam cao cấp GEN911",142600,359000,4.911094224924012,1316,https://vn-live-01.slatic.net/p/8bc715094f271d9a8cc5a938c9ba961c.jpg,Gen Alpha,pants,https://www.lazada.vn/products/pdp-i2409003784.html
"SIZE( 40- 65KG) Quần lanh ống suôn họa tiết hoa văn, mềm mịn mát mẻ",69000,,4.785714285714286,28,https://vn-live-01.slatic.net/p/13fcf223b64c56210d915965f283e147.jpg,Hiền Vy,pants,https://www.lazada.vn/products/pdp-i2764871562.html
"Quần Jean Nam Quần Bò Nam Cotton Ống Suông Không Co Giãn Form Chuẩn Dày Dặn,Mềm Mịn.",109000,218000,4.80046674445741,857,https://vn-live-01.slatic.net/p/70ee770a0b143c5142d37c8c08a8cd6c.jpg,TOMOFASHION,pants,https://www.lazada.vn/products/pdp-i2340083163.html
"JG2 _ Quần Kaki Túi Hộp Ống Xuông, Túi Hộp 3 túi Siêu Cool Ngàu",108500,200000,4.7375,80,https://vn-live-01.slatic.net/p/fec37b256cb8d121db6ddd07d570de5b.jpg,Midori Store - Đẳng Cấp Thời Trang,pants,https://www.lazada.vn/products/pdp-i2668126367.html
Quần Dài Thun Ôm Co Giãn Chất Thun Co Giãn 4 Chiều Size 40-70kg,50000,80000,4.648148148148148,54,https://vn-live-01.slatic.net/p/93dd09718e4c79e74dde711125092ba1.jpg,Bảo Ngọc Shop 040120,pants,https://www.lazada.vn/products/pdp-i1607247639.html
LIVE GREAT Men's Thin Drapey Wide Leg Straight Sports Pants Solid color simple casual trousers,95000,198000,4.991525423728813,118,https://sg-test-11.slatic.net/p/72495145c4ee26f0fed208b428e9c5b8.jpg,LIVE GREAT,pants,https://www.lazada.vn/products/pdp-i2459600403.html
Hanlu Men's casual straight pants Suit pants middle-aged business pants dad pants large size,153000,328000,4.745283018867925,524,https://my-live-01.slatic.net/p/3bc7fd6ac56258b335c5e77411ab83b7.png,Hanlu Style,pants,https://www.lazada.vn/products/pdp-i2534066278.html
Hanlu Men's casual pants fashion trousers slim straight business pants,207000,448000,4.9743589743589745,174,https://sg-test-11.slatic.net/p/244593b24405ddac54800e41044fcea0.jpg,Hanlu Style,pants,https://www.lazada.vn/products/pdp-i2533005646.html
MOLAN Light breathable ice silk pants for work-men's loose trousers-casual pants,96000,209000,4.921658986175115,879,https://sg-test-11.slatic.net/p/220e95d7747db69cbcfbb0abb2998759.jpg,MOLAN Shopping Mall,pants,https://www.lazada.vn/products/pdp-i2399794515.html
"LIVE GREAT New men's trousers, fashion casual pants, summer trendy everyday harlan pants, youth popular loose type",69000,125000,4.951797385620915,1224,https://my-live-02.slatic.net/p/f72898340d96cb47c4eb12a4efb5f8f5.jpg,LIVE GREAT,pants,https://www.lazada.vn/products/pdp-i2268318011.html
"Quần Jogger Nam kaki Túi Hộp GENALPHA, Quần Dài Kaki Jogger Túi Hộp Nam GEN5346",150972,399000,4.91399416909621,686,https://vn-live-01.slatic.net/p/9c0c5772b01074436901c3fcf4b9d581.png,Gen Alpha,pants,https://www.lazada.vn/products/pdp-i2668081409.html
QUẦN JEAN NỮ CHẤT BÒ XANH BẠC ỐNG LOE DÁNG DÀI LƯNG CAO NÂNG MÔNG DÁNG CAO NGỌC NGÀ PHONG CÁCH HOT TREND - DUBAI FASHION,109000,180000,4.756487025948104,501,https://vn-live-01.slatic.net/p/4b761517b8935fbb90b1ee209fe53f27.jpg,Dubaishop,pants,https://www.lazada.vn/products/pdp-i2414128510.html
Quần Kaki Nam Cao Cấp Cạp Chun Ống Suông Thoải Mái. Quần Dài Kaki Baggy Nam Dáng Đứng Ống Rộng - QKK18,180000,300000,4.923664122137405,131,https://vn-live-01.slatic.net/p/eeed32d6ff8831d85a45ee120e5620bc.jpg,Lee FALLE Việt Nam,pants,https://www.lazada.vn/products/pdp-i2608105248.html
"Men's Casual Trousers, Super Stretchy Pants, Regular Fit, Comfortable for Youthful Office Movement",141000,318000,4.78030303030303,132,https://vn-live-01.slatic.net/p/9224a89672bc594898a891043c545f21.jpg,hunglongfashion,pants,https://www.lazada.vn/products/pdp-i2482713890.html
Quần Jean Nam Ống Suông Chất Bò Quần Jean Nam Dài Cotton 3 màu Chuẩn Form Ống Suông,107910,198000,4.911290322580645,496,https://vn-live-01.slatic.net/p/8b01daef40af20259c85a12e1049327a.jpg,Ooki_fashion,pants,https://www.lazada.vn/products/pdp-i2426955253.html
"Custom silk trousers women clothes custom made white, black, red, bright yellow, apricot yellow, hue, navy blue, mint green, rose pink, strawberry pink, elastic rubber tight anti stretch fabric orange premium section for weight 40kg-70kg",91000,135000,4.980306345733042,457,https://vn-live-01.slatic.net/p/a83d48059a229528527cbef15de2c0c7.jpg,Thế Giới Áo Dài,pants,https://www.lazada.vn/products/pdp-i1979769853.html
"Boys' Pants, Fashionable Khaki Pants with Box Pockets for Boys, Small and Large Sizes 18-52kg, Khaki School Pants for Boys, Model Fs",63000,126000,5.0,15,https://vn-live-01.slatic.net/p/b62147ad2ff29405128999d15ead5a3c.jpg,Gia Dụng Đồ Chơi Smartkid,pants,https://www.lazada.vn/products/pdp-i3005142479.html
(Buy 2 get 1 lip balm) legging trousers female leggings high buckle abdomen shaping body pants butt lifting tightening waist create curves at comfortable breathable,75700,115000,4.668027210884354,734,https://vn-live-01.slatic.net/p/fb5ac130519e6ed49ba229922b816547.jpg,GaoShop1991,pants,https://www.lazada.vn/products/pdp-i2023801946.html
Quần Bò Nữ Quần Jeans Nữ Trơn Cotton 100% Co Giãn 4 Chiều Dáng Skinny  Lưng Cao Thời Trang Thiết Kế,122000,360000,4.843843843843844,333,https://vn-live-01.slatic.net/p/126cca770905a26340d8c9f8b447b603.jpg,hunglongfashion,pants,https://www.lazada.vn/products/pdp-i2416376988.html
High Waist Straight Leg Jeans Women's plus Size Butterfly Splicing Design Summer Casual Slimming Floor-Length Trousers,90000,,2.0,4,https://filebroker-cdn.lazada.vn/kf/S033bc5da908c4f6999bdb3decc839debs.jpg,TB FASHION STORE,pants,https://www.lazada.vn/products/pdp-i3239265976.html
"[JIFANPAUL | Durable Work & Casual Men's Straight Leg Jeans,JIFANPAUL | Durable Work & Casual Men's Straight Leg Jeans,]",68000,111000,4.822916666666667,97,https://filebroker-cdn.lazada.vn/kf/S82a298b34e774af28b0ea980c6da12ccE.jpg,JIFANPAUL Global,pants,https://www.lazada.vn/products/pdp-i3196131431.html
Bonnie Cathy Quần Dài Thường Ngày Phong Cách Thể Thao Rộng Rãi Mùa Hè Quần Harem Dễ Phối Tôn Dáng Gầy Thời Trang Nam,79800,164000,4.8,10,https://sg-test-11.slatic.net/p/befdb384cc67f032e6cf6d686c182e7f.png,Bonnie Cathy Mall,pants,https://www.lazada.vn/products/pdp-i3152311234.html
Eaglade 1699 cotton 100% straight leg 6 pocket men's fashion casual pants size 28 -40,331000,661000,4.666666666666667,61,https://my-live-01.slatic.net/p/b25f496b887e0e09b934d3db33b755b5.jpg,LZ Sports Store,pants,https://www.lazada.vn/products/pdp-i1451379279.html
"[HUAXUNRAN | Thick Woolen Pants for Women Autumn Winter High Waist Loose Fit,HUAXUNRAN | Thick Woolen Pants for Women Autumn Winter High Waist Loose Fit,]",172000,566000,4.85,20,https://filebroker-cdn.lazada.vn/kf/S99fec11a92f94441a1e9615a09bc1d4cl.jpg,HUAXUNRAN,pants,https://www.lazada.vn/products/pdp-i3216239469.html
"Men's Elastic Tapered Pants, High Quality Black Men's Trousers Genuine Pierre Cardin 2024",259000,799000,4.8745247148288975,263,https://vn-live-01.slatic.net/p/8dafce061a5b30e75d83cf9d2ecd8124.jpg,Tổng Kho Hàng Xuất Dư,pants,https://www.lazada.vn/products/pdp-i2458710624.html
"Quần legging dài lót nỉ trong, chất vải dày dặn co giãn 4 chiều mặc thỏa mái, quần thu đông nữ",37830,69000,4.7687074829931975,294,https://filebroker-cdn.lazada.vn/kf/S613d2effc01645899d91a6935959501bm.jpg,Zeny_Fashion,pants,https://www.lazada.vn/products/pdp-i1986294140.html
"Quần jean  ống suông rộng  cạp cao lưng chun, quần bò nữ ống rộng LƯNG CAO trơn hót trend",128000,233000,4.728155339805825,206,https://sg-test-11.slatic.net/p/99133f503b84ade5894d3fb2f11e27de.jpg,SHOP KEM 1585795790,pants,https://www.lazada.vn/products/pdp-i2664918106.html
"JG2 _ Quần Kaki Túi Hộp Ống Xuông, Túi Hộp Siêu Cool Ngàu.",108500,200000,4.7555555555555555,44,https://vn-live-01.slatic.net/p/31c3fa0a54333c7285bce797fb372409.jpg,TitiShop68,pants,https://www.lazada.vn/products/pdp-i2668044655.html
"Quần ống suông,quần kẻ caro ống đứng năng động cá tính",41580,70000,,,https://sg-test-11.slatic.net/p/db863a950a6d87eed1e25b270c22b600.jpg,yqvX1Tyy,pants,https://www.lazada.vn/products/pdp-i3150022944.html
"[JIFANPAUL | Warm Fleece Lined Men's Jogger Pants,JIFANPAUL | Warm Fleece Lined Men's Jogger Pants,]",123000,167000,4.8,133,https://filebroker-cdn.lazada.vn/kf/S8e16d237f4524591bd437f201a08d73bS.jpg,JIFANPAUL Global,pants,https://www.lazada.vn/products/pdp-i3198442440.html
Bonnie Cathy Ice silk pants men's summer Korean version of trendy tooling tied feet casual trousers trendy brand loose thin youth elastic pants,48400,116683,,,https://my-live-01.slatic.net/p/58a9cc85911d76dc1e4175d0141c6340.png,Bonnie Cathy Mall,pants,https://www.lazada.vn/products/pdp-i2676534940.html
QUẦN JEAN NỮ BAGGY ỐNG SUÔNG RỘNG RÁCH TẢ TƠI XƠ MƯỚP LƯNG CAO NÂNG MÔNG PHONG CÁCH SANG CHẢNH -DB 5619- DUBAI FASHION,94000,170000,4.808510638297872,188,https://vn-live-01.slatic.net/p/a1dd1567c2ebcb89ff2cff9b5e99bb9f.jpg,Dubaishop,pants,https://www.lazada.vn/products/pdp-i2653405480.html
Quần Baggy Bigsize Nữ Vải Đũi Linen Cao Cấp Phong Cách Thời Trang Hàn Quốc Phù Hợp Mọi Lứa Tuổi,67415,126000,4.863945578231292,587,https://vn-live-01.slatic.net/p/124654df19e96d8d15aa32df1ed7a64f.jpg,Thời trang kenchi,pants,https://www.lazada.vn/products/pdp-i2616256884.html
Quần KAKI túi hộp chéo in chữ cá tính cho bé trai 8-30kg,85000,,4.970588235294118,34,https://vn-live-01.slatic.net/p/ad867d3690824dbae1e8795be0dc700c.jpg,Nhộng Xốp Kids,pants,https://www.lazada.vn/products/pdp-i2708441611.html
MOLAN Men's sweatpants Men's summer ice silk pants casual loose and versatile thin sports quick-drying pants,81000,177000,4.859223300970874,216,https://sg-test-11.slatic.net/p/bb2fb6fa20703b7832e84f9bb34387f0.jpg,MOLAN Shopping Mall,pants,https://www.lazada.vn/products/pdp-i2621341833.html
HUAXUNRAN | Winter New Wool Fleece Casual Pants for Women,141000,565000,4.444444444444445,18,https://filebroker-cdn.lazada.vn/kf/S2ab13d7e6bae43f7afc23bfad539143fI.jpg,HUAXUNRAN,pants,https://www.lazada.vn/products/pdp-i3196886314.html
"Quần Jean dài bé trai, chất Jean bụi bặm cá tính cho bé đi chơi, đi tiệc chất vải dày dặn | Đức Trí Kids",76230,109000,4.916666666666667,24,https://sg-test-11.slatic.net/p/722737224eac2efb6c6eb75933ae0882.jpg,D&T Kisd Thời trang cho bé,pants,https://www.lazada.vn/products/pdp-i2918874298.html
Quần baggy nam nữ Unisex ống rộng trơn - Kiểu quần Kaki Nam Nữ Ống Suông Basic Unisex Phong cách hot nhất 2023- Dubai Fashion,70000,120000,4.3875,240,https://vn-live-01.slatic.net/p/a08950f59b96cdc815028c99b91de93c.jpg,Dubaishop,pants,https://www.lazada.vn/products/pdp-i1932583531.html
"Quần dài chống muỗi , chống nắng , giữ ấm cho bé trai , bé gái thun cotton dày mịn",12888,50000,4.651612903225806,155,https://filebroker-cdn.lazada.vn/kf/Sc3b1bfa868b640b9b32b502fd4cbcd56x.jpg,Xưởng chuyên sỉ đồ thun giá rẻ,pants,https://www.lazada.vn/products/pdp-i2369657600.html
Long Denim Jeans for Boys 17-50kg - Many Models Without Belt Straps,105348,190000,4.843648208469055,307,https://vn-live-01.slatic.net/p/4e0907a1a568278c0c94f3acff24f843.jpg,BaBy Smart Kids,pants,https://www.lazada.vn/products/pdp-i1068168544.html
Quần Jean Nữ Suông Trơn Dài Ống Rộng Lưng Cao Tôn Dáng,127710,258000,4.9245283018867925,53,https://vn-live-01.slatic.net/p/4cbbbef1c3fe6bdd6ad4fdbcf09b4dac.jpg,Em Xinh Boutique,pants,https://www.lazada.vn/products/pdp-i3093747214.html
"Quần ống rộng, quần suông sớ lưng siêu cao chất liệu đũi tơ loại 1 mềm mát có túi 2 bên có dây thắt nơ cách điệu",89000,150000,4.764705882352941,17,https://filebroker-cdn.lazada.vn/kf/S79c815baaead4354891889e3a9a61e5ao.jpg,Anmoon.store,pants,https://www.lazada.vn/products/pdp-i2352757312.html
"Quần ống rộng nhung tăm dây rút Bản to , Quần nhung ống suông tôn dáng siêu xinh mã 909",86330,120000,4.823529411764706,17,https://vn-live-01.slatic.net/p/2535c04c5e90214fcb1933ff16e3d45c.jpg,Thời trang kenchi,pants,https://www.lazada.vn/products/pdp-i1945534418.html
Quần jean nam nữ baggy CẠP CHUN BẢN TO ống rộng N1LUXUR CẠP CAO phom Suông Chỉnh Eo Chất Bò cao cấp,121000,240000,5.0,8,https://sg-test-11.slatic.net/p/09a4256f3ff7fe1bb7bb10267ac52ed3.jpg,SHOP KEM 1585795790,pants,https://www.lazada.vn/products/pdp-i2664809622.html
Quần mặc cùng áo dài (bán lẻ - LỤA HÀN cao cấp) - (nhiều màu),60000,70000,4.968085106382978,94,https://vn-live-01.slatic.net/p/d0536dcad2a988498af3e23cd7f31f10.jpg,Áo Dài Minh Minh,pants,https://www.lazada.vn/products/pdp-i3055066434.html
JIFANPAUL | Warm Loose Fit Winter Pants with Fleece Lining and Cuffed Bottom,140000,183000,4.25,12,https://filebroker-cdn.lazada.vn/kf/S3ff9dfb944da4e5bb2ab233bfcc0b2bby.jpg,JIFANPAUL Global,pants,https://www.lazada.vn/products/pdp-i3206548541.html
Khaki Jogger Pants - Jg5 Men's Khaki Jogger Pants High Quality Boxed Standard Export Product Mq Luxury 79,69299,300000,5.0,30,https://vn-live-01.slatic.net/p/e080b8e25d4cffc831a7bc2a1bf74445.jpg,MQ LUXURY 79,pants,https://www.lazada.vn/products/pdp-i2522895891.html
Men's Sports Pants Fashion Brand Casual Pants Men's Loose Waist Drawstring Design Embroidery Details,55000,88000,4.515151515151516,63,https://sg-test-11.slatic.net/p/1b15405105600d32c21e319bf1b5dbf9.png,STAR FRUIT MALL,pants,https://www.lazada.vn/products/pdp-i3157726638.html
[ LƯU Ý  Quần dáng Ôm body ống Nhỏ không phù hợp với trung niên ]Thanh lý Quần tây xuất dư dáng ôm body ống côn fom nhỏ ôm dáng y hình  màu rêu lợt co giãn 4 chiều vải đẹp mềm mượt dài màu rê,124000,210000,4.792759051186017,1602,https://vn-live-01.slatic.net/p/3723fe626b8053932e1f33f1f9d16581.jpg,Win 69,pants,https://www.lazada.vn/products/pdp-i1974122949.html
[HCM]CÓ SIZE ĐẠI BIG SIZE QUẦN JEAN NAM ĐEN TRƠN - ĐƠN GIÃN MẠNH MẼ QUẦN JEAN NAM ỐNG CÔN DÁNG ÔM BODY VẢI CO GIÃN TOP BÁN CHẠY NHẤT,149000,230000,4.857449856733524,4188,https://vn-live-01.slatic.net/p/0f7f8263cc81e2eea525a76bdd2c169f.jpg,Win 69,pants,https://www.lazada.vn/products/pdp-i262330570.html
QUẦN JEAN ỐNG RỘNG NAM NỮ UNIEX WASH 3 MÀU HÀNG CAO CẤP NHẬT BẢN PHONG CÁCH SÀNH ĐIỆU - DUBAI FASHION,122000,220000,4.670422535211268,355,https://vn-live-01.slatic.net/p/28f537846aca7a4b1d03f48f2b0de228.jpg,Dubaishop,pants,https://www.lazada.vn/products/pdp-i2309926911.html
QUẦN JEAN ỐNG RỘNG NAM NỮ UNIEX BỤI BẶM ĐƯỜNG PHỐ PHONG CÁCH NHẬT BẢN ĐẲNG CẤP MỚI - TOKYO FASHION,122000,220000,4.76,25,https://vn-live-01.slatic.net/p/0d64494f74d3fc1452ff11613ba3cca0.jpg,tokyo.shop,pants,https://www.lazada.vn/products/pdp-i2396922330.html
FathSunny Men's Sports Pants Trendy High Street Men's Casual Trousers,57000,114000,,,https://sg-test-11.slatic.net/p/f9e6202b1a7834aaa3ad3f48993bcb0b.png,Laz Nigori MALL,pants,https://www.lazada.vn/products/pdp-i3168964377.html
"Quần đũi DÀI ống rộng đai thun, cột dâu nơ, chất đũi, mềm, mịn, mát, thời trang",10000,,3.831168831168831,77,https://vn-live-01.slatic.net/p/4a47c5201d334e7e5cc2da29f7cb5d8c.jpg,Sài Gòn Fashion,pants,https://www.lazada.vn/products/pdp-i2234853127.html
"MOLAN New men's trousers, fashion casual pants, summer trendy everyday harlan pants, youth popular loose type",81000,177000,4.890179514255544,1894,https://vn-live-01.slatic.net/p/9218b9ebf6e56612a444a55e5afb2cd7.jpg,MOLAN Shopping Mall,pants,https://www.lazada.vn/products/pdp-i2265037236.html
40-105kg Unisex Big Size Khaki Baggy Pants for Men and Women,73780,220000,4.812749003984064,251,https://vn-live-01.slatic.net/p/525accaa900814525d098b46792146a9.png,Soi_Store Bigsize Clothing,pants,https://www.lazada.vn/products/pdp-i1084814627.html
QUẦN BAGGY JEANS ỐNG RỘNG LOA THẮT LƯNG FORM TO UNISEX NAM NỮ PHONG CÁCH HÀN QUỐC SANG CHẢNH - DUBAI FASHION,122000,220000,5.0,6,https://vn-live-01.slatic.net/p/5de551a85916d32df4f1e3a9fb5f3048.jpg,Dubaishop,pants,https://www.lazada.vn/products/pdp-i2676434332.html
"Wide-Let Striped Pants with Lace, Long Style, Summer Women's Fashion - Tp65",35919,79000,4.68,25,https://vn-live-01.slatic.net/p/a26248b18dd99c04f05f0efc6e3cd94e.jpg,LINH NGA _ STORE,pants,https://www.lazada.vn/products/pdp-i3145897368.html
Loose Straight Leg High Waist Denim Jeans Women's Sexy Wide Leg Pants Vintage American Style Casual Slimming Effect,80000,,,,https://filebroker-cdn.lazada.vn/kf/Sae5c14dff32f4f9ab38d0b1272674f42D.jpg,TB FASHION STORE,pants,https://www.lazada.vn/products/pdp-i3243519903.html
"Quần mặc Áo dài 2hand, size S",39000,,,,https://filebroker-cdn.lazada.vn/kf/S7c25a9a229004b63a5dfd1bb35aa605fN.jpg,Lethu2hand,pants,https://www.lazada.vn/products/pdp-i3149385427.html
44-58KG Quần KẺ SỌC ĐŨI CAO CẤP HACK DÁNG ỐNG SUÔNG cực hot mềm,71000,150000,4.8882882882882885,555,https://vn-live-01.slatic.net/p/8091da1d259ca61d3437f64c632509e8.jpg,WINNY SHOP 1605685735,pants,https://www.lazada.vn/products/pdp-i2261419893.html
Men's solid color leggings loose wide leg trousers Thin breathable casual pants,59000,95000,,,https://sg-test-11.slatic.net/p/4f4b0ee90626010fa268434b34adbd27.png,STAR FRUIT MALL,pants,https://www.lazada.vn/products/pdp-i3169137080.html
Lansboter men's casual trousers thin business casual trousers drape fashion straight ice silk trousers Breathable and comfortable,77000,166000,4.57919621749409,464,https://my-live-01.slatic.net/p/e646663d48e2d44e4a1b3eb6a8a6662d.jpg,Lansboter,pants,https://www.lazada.vn/products/pdp-i2428375374.html
Hot sale fom men's four way elastic casual pants slim fit casual pants TD5 size 27-42,130680,350000,4.75,20,https://vn-live-01.slatic.net/p/60649f451292c507af37dfe1227745c3.jpg,xưởng sỉ hàng thời trang nam,pants,https://www.lazada.vn/products/pdp-i224890101.html
Quần Jeans Suông Khói  Cạp Cao Lên Dáng Siêu Xinh Trẻ Trung Năng Động Chất Vải Mềm Mại Không Co Giãn,60000,210000,5.0,13,https://vn-live-01.slatic.net/p/c1d84b1acd3567ee57db05dc9893f4a0.png, Jeans Nữ Store,pants,https://www.lazada.vn/products/pdp-i2384221405.html
Quần Óng Rộng Nữ Vải Nỉ Ép Mịn 2 Da Hàng lᴏại 1 Cao Cấp Dày Dặn Mặc Ấm Mẫu Mới 2024 Trẻ Trυng Năng Động,68310,69000,5.0,4,https://sg-test-11.slatic.net/p/021a170fab210cb3c3304ea5fcb11079.jpg,Linh Chi Store 88,pants,https://www.lazada.vn/products/pdp-i2924366059.html
Laz Johnn Men's Loose Straight Multi-Pocket Cargo Pants Fashion Casual Trousers,71000,142000,5.0,2,https://sg-test-11.slatic.net/p/1695e7690fdbbfd62c398692b5e864e3.png,Laz Nigori MALL,pants,https://www.lazada.vn/products/pdp-i3168574204.html
Hanlu Men's solid color leggings loose wide leg trousers thin breathable casual pants,75000,156000,4.934426229508197,75,https://sg-test-11.slatic.net/p/ab99175b88e744cec622a1a461832a6e.png,Hanlu Style,pants,https://www.lazada.vn/products/pdp-i2525474741.html
"Quần Jeans Nữ Ống Thẳng Cạp Cao – Phong Cách Mới Nhất Thu Đông, Tôn Dáng Sành Điệu",67500,104000,4.970961887477314,551,https://vn-live-01.slatic.net/p/8249b2240f6fb5f3c9f05f47e55069ea.jpg,d3odSmYq.Selection,pants,https://www.lazada.vn/products/pdp-i2523311758.html
Chinese Style Elastic Waistband Buckle Wide Leg Pants Summer New Style Solid Color Simple Casual Slimming Cropped Pants,165633,310000,4.647058823529412,17,https://sg-test-11.slatic.net/p/76ebff4ff5b871b34e721b9aa87c9492.jpg,BlueOrange,pants,https://www.lazada.vn/products/pdp-i2766906139.html
