ten_san_pham,gia_sale,gia_goc,rating,so_review,link_anh,shop,category,url_san_pham
Áo sơ mi nữ oversize chất đũi xốp dày đẹp_Thêu gấu,55440,100000,5.0,1,https://sg-test-11.slatic.net/p/fbd0a3a4f2f6c4487c05a0e4cc32aff8.jpg,yqvX1Tyy,shirts,https://www.lazada.vn/products/pdp-i3150180079.html
"Áo sơ mi, áo sơ mi nam dài tay thiết kế sang trọng đẳng cấp cho phái mạnh- T41",217800,295000,5.0,1,https://vn-live-01.slatic.net/p/928d9892d07347caacbb13db853debef.jpg,Thời trang nam Jerry Cherry,shirts,https://www.lazada.vn/products/pdp-i3188136206.html
Áo sơ mi croptop tay dài 1 túi,55000,,4.5,4,https://filebroker-cdn.lazada.vn/kf/S809f7d1b3a9346a995989c4be27fbda6M.jpg,KHO CHUYÊN SỈ GÒ VẤP,shirts,https://www.lazada.vn/products/pdp-i2185180666.html
ÁO KIỂU SƠ MI TAY DÀI NHÚNG 1 BÊN VAI  NÚT CÁCH ĐIỆU,102000,184000,4.857142857142857,21,https://vn-live-01.slatic.net/p/470ead60bee494fc3bb181d202814e7b.jpg,TI-EL SHOP 93,shirts,https://www.lazada.vn/products/pdp-i1979778282.html
Áo Sơ Mi sọc nhí cổ phối trắng cách điệu - Chất sọc kate Cổ cách điệu Tay ngắn Thời Trang,99800,180000,4.777777777777778,18,https://vn-live-01.slatic.net/p/0be39bd123a5cad46099841d3ed8da24.jpg,TI-EL SHOP 93,shirts,https://www.lazada.vn/products/pdp-i1567104553.html
"Áo sơ mi nữ trơn ngắn tay , chất vải mềm mịn cổ phối trắng cực xinh AM90",84280,189999,4.705882352941177,17,https://vn-live-01.slatic.net/p/acf8d661042c06c8c6ee2ab5baabe2af.jpg,KiRas,shirts,https://www.lazada.vn/products/pdp-i2741601317.html
Áo Sơ Mi Oxford Cotton Nguyên Chất Tay Dài Màu Hồng Size Lớn,228000,440000,5.0,1,https://filebroker-cdn.lazada.vn/kf/S8a13912877b346c69b3286ed2b289ebe5.jpg,BOMAN clothing,shirts,https://www.lazada.vn/products/pdp-i3230536846.html
BOMAN | Áo Sơ Mi Nam Chống Nhăn Không Cần Ủi,180000,483000,4.857142857142857,7,https://filebroker-cdn.lazada.vn/kf/S2d62e74ab6b549428a0fc1d0d94948b7C.jpg,BOMAN clothing,shirts,https://www.lazada.vn/products/pdp-i3230982733.html
Áo kiểu công sở thiết kế cao cấp,187110,399000,4.7,10,https://filebroker-cdn.lazada.vn/kf/S1f2ac3c468024affaad4bdce16789dddG.jpg,THẾ GIỚI ÁO DÀI VÀ CÔNG SỞ,shirts,https://www.lazada.vn/products/pdp-i3141915056.html
【Oufisun】vitage Áo Sơ Mi Nam Áo sơ mi dân tộc Áo ngắn tay quá khổ quần áo bohemian,177729,280000,4.661538461538462,91,https://my-live-01.slatic.net/p/cdb1f847c6f0cb6c66a471ab5f04dee9.jpg,Oufisun Fashion Clothing,shirts,https://www.lazada.vn/products/pdp-i2881507844.html
Tucano | Áo Sơ Mi Dài Tay Cotton Sọc Oxford Nam Mùa Thu,659000,1305000,5.0,1,https://filebroker-cdn.lazada.vn/kf/Sf1a3b808b4a8481a9ba4365afaedaed0j.jpg,TUCANO Men's Clothing,shirts,https://www.lazada.vn/products/pdp-i3196481287.html
Áo sơ mi nam 3 sọc chất lụa kate hàn quốc tay dài trắng đen phối viền túi thấm hút mồ hôi co dãn tốt,129000,219000,,,https://sg-test-11.slatic.net/p/f05ab8d76577a7937683fe845004eb69.jpg,Gumita,shirts,https://www.lazada.vn/products/pdp-i2775719241.html
Áo sơ mi dài tay Owen form Classic(rộng) còn size 38(65kg) - 42(75-80kg) (AC20175D),199000,386000,5.0,17,https://filebroker-cdn.lazada.vn/kf/S215d0beef6f24c68ac7a211b230cea84o.jpg,Thời trang công sở nam_Vĩnh Long,shirts,https://www.lazada.vn/products/pdp-i2677070206.html
"áo sơ mi nữ Thái Hòa mã 640 sọc thẳng màu xanh, tím, hồng",175000,,4.9787234042553195,47,https://filebroker-cdn.lazada.vn/kf/S89153a62d8b04b46bce42f1e8ca7cbf06.jpg,Công Sở Thái Hoà,shirts,https://www.lazada.vn/products/pdp-i1247008197.html
Áo sơ mi sọc nữ bigsize form rộng dài tay – kiểu dáng trẻ trung che khuyết điểm 50-95kg A328,91778,150000,5.0,2,https://vn-live-01.slatic.net/p/f718df2a4e3fcdcb1ec3a44265239bb8.jpg,Cô Nhỏ Bigsize,shirts,https://www.lazada.vn/products/pdp-i3240565123.html
Áo Khoác Sơ Mi kẻ Caro Nam Nữ Có nón Trùm Đầu,99000,189000,5.0,5,https://vn-live-01.slatic.net/p/c5493a8cb840be9402e1f67ac002b4f7.png,MAI NGUYỄN FASHION,shirts,https://www.lazada.vn/products/pdp-i3015966028.html
Áo Sơ Mi Vải Lanh Và Cotton Phong Cách Dân Tộc Áo Có Cúc Cổ Đứng Mới Cho Nữ Bộ Đồ Trà Thêu Ve Áo Xéo,124748,189786,4.717948717948718,72,https://my-live-02.slatic.net/p/a69f886745b24dab3b5f5dfee0aa55fc.jpg,LikeMy,shirts,https://www.lazada.vn/products/pdp-i1899478577.html
Luxqlo áo vàng Phụ nữ dài tay áo sơ mi văn phòng thời trang phong cách Hàn Quốc áo rộng OL,180324,264000,,,https://sg-test-11.slatic.net/p/97bc8ab23221e22c4abc7936eb799499.jpg,Luxqlo Store,shirts,https://www.lazada.vn/products/pdp-i3057614671.html
QIAOXIZI | Áo Sơ Mi Dễ Thương Tay Ngắn Cotton Voan Thời Trang Nữ,152000,566000,4.714285714285714,7,https://filebroker-cdn.lazada.vn/kf/S099655a0ddf3410799269b5b75584bb5X.jpg,QXZ FASHION,shirts,https://www.lazada.vn/products/pdp-i3193659115.html
Áo Sơ Mi Nữ Phong Cách Hàn Quốc Cổ Polo Tay Ngắn Màu Trơn Mỏng Mùa Hè Hở Lưng Mỏng Áo Sơ Mi Polyester Thường Ngày,77700,269000,5.0,1,https://filebroker-cdn.lazada.vn/kf/S7fb635f3bb9f474bb7f7c115db013f09f.jpg,Lazada Global,shirts,https://www.lazada.vn/products/pdp-i3253063367.html
Áo sơ mi trắng nữ công sở kiểu tay dài nút ẩn cao cấp chất vải lụa đẹp Gloria Shop- A552,109000,139000,4.842105263157895,19,https://vn-live-01.slatic.net/p/f38b2948b284fd246fdd263902ededdd.jpg,Gloria Shop_ThờiTrang Công Sở,shirts,https://www.lazada.vn/products/pdp-i2042895684.html
Hanlu Áo Sơ Mi Dài Tay Áo Sơ Mi Nam Áo Sơ Mi Công Sở Kẻ Sọc Nhẹ Thường Ngày Áo Sơ Mi Xu Hướng Hàn Quốc Mới Cho Nam,108000,230000,4.905579399141631,333,https://my-live-02.slatic.net/p/b24cd7d464932e7bb6fe365336b6af35.jpg,Hanlu Style,shirts,https://www.lazada.vn/products/pdp-i1913928128.html
Áo sơ mi nam dài tay phối sọc trắng GT788 Thời trang EMEY LUXURY Thiết kế trẻ trung nam tính Kiểu Hàn Quốc,108900,210000,4.882352941176471,17,https://vn-live-01.slatic.net/p/8561d2dbbad51c4a011c7325a571903f.jpg,EMEY LUXURY,shirts,https://www.lazada.vn/products/pdp-i1219713046.html
Áo sơ mi nam cao cấp ngắn tay Thái Khang 100% cotton sơ mi kẻ caro form classic thoải mái ít nhăn mặc nhẹ ATK50,157410,318000,5.0,1,https://vn-live-01.slatic.net/p/b5608107b46bb4a573062eae1e16c6e1.jpg,THAIKHANG.CO,shirts,https://www.lazada.vn/products/pdp-i3206761857.html
Áo Sơ Mi Nam Dài Tay Kẻ Sọc Thời Trang Hàn Quốc Cao Cấp SMT01 PONIVALAZA  Chất Vải Mềm Mịn Thoáng Mát,103950,200000,4.769230769230769,26,https://vn-live-01.slatic.net/p/0b05d75ac1ff2d8cbaa2faf9475d6f8c.png,PONIVALAZA,shirts,https://www.lazada.vn/products/pdp-i1216862320.html
"ChArmkpR Store INCERUN Áo Sơ Mi Thông Minh Trang Trọng Thường Ngày Ngắn Tay Cho Nam, Áo Phông Chui Đầu Cài Khuy Công Sở Tiệc Tùng",175353,315000,4.751724137931035,147,https://my-live-02.slatic.net/p/237812e43fe949c0869220e3892e6dc4.jpg,ChArmkpR Store,shirts,https://www.lazada.vn/products/pdp-i1189648293.html
Áo Sơ Mi Nam giáng sinh Áo sơ mi ông già Noel áo có tay ngắn sành điệu,156170,322000,5.0,3,https://sg-test-11.slatic.net/p/de703bace63ffe1fcf5ef2025cc8b11f.png,SEA YADOU ,shirts,https://www.lazada.vn/products/pdp-i3169109482.html
Áo Sơ Mi Trẻ Trung Thiết Kế Màu Trơn Áo Phối Giả Cho Nữ Ngắn Tay Dáng Rộng Mùa Hè Phong Cách Hàn Quốc Mới,141059,207885,4.586206896551724,29,https://my-live-02.slatic.net/p/e3b0dbe81466b9029e27078d333530e1.jpg,BlueOrange,shirts,https://www.lazada.vn/products/pdp-i2222318513.html
"Áo sơ mi, áo sơ mi nam dài tay thiết kế sang trọng đẳng cấp cho phái mạnh - N99",220000,299000,5.0,0,https://vn-live-01.slatic.net/p/b673fc8da5040a28b2c1b44e0bc00def.jpg,Thời trang nam Jerry Cherry,shirts,https://www.lazada.vn/products/pdp-i3206962234.html
Hanlu Người đàn ông của áo sơ mi giản dị Retro dài áo có tay thời trang áo sơ mi,134000,286000,,1,https://sg-test-11.slatic.net/p/a8b33beb7cc49e6e71d0c45cc1289555.jpg,Hanlu Style,shirts,https://www.lazada.vn/products/pdp-i2815163167.html
Cozy Up Áo Sơ Mi Dài Tay Cho Nam Có Ve Áo Thoải Mái Vải Batik Polyester Kẻ Sọc áo sơ mi nam tay dài áo sơ mi nam trung niên,193000,304000,4.8,186,https://my-live-02.slatic.net/p/4d356e8d4d809e6402a6df6980c50345.jpg,Cozy Up,shirts,https://www.lazada.vn/products/pdp-i1987313002.html
(Sale rẽ) Áo sơ mi tay dài công sở cơ bản /Bluesky fashion,65000,130000,,,https://filebroker-cdn.lazada.vn/kf/Sf842071a61234145b340b9d414652007p.jpg,Bluesky fashion store ,shirts,https://www.lazada.vn/products/pdp-i2064713936.html
JIFANPAUL | Áo Sơ Mi Ngắn Tay Mỏng Phong Cách Hàn Quốc cho Bé Trai,91000,113000,4.75,12,https://filebroker-cdn.lazada.vn/kf/S78ce924c152e4118907c96339eee38b3d.jpg,JIFANPAUL Global,shirts,https://www.lazada.vn/products/pdp-i3197648568.html
"Laz Nigori  Áo Dài Vải Lanh Cotton Cho Nữ, Áo Sơ Mi Dài Tay Có Cúc",181000,412000,3.6666666666666665,64,https://my-live-02.slatic.net/p/7f92f2847c4b360b10a87cd245f85a2c.jpg,Laz Nigori,shirts,https://www.lazada.vn/products/pdp-i1228002958.html
Áo sơ mi nữ Bigsize Cô Nhỏ một túi vải kate lụa mềm mịn ít nhăn basic màu pastel 60-100kg SM1T,98000,164000,4.976744186046512,129,https://vn-live-01.slatic.net/p/05462af307c467366c0e631d2bdc0ccf.jpg,Thời Trang Bigsize Cô Nhỏ,shirts,https://www.lazada.vn/products/pdp-i2366968053.html
Áo sơ mi nam Polo công sở thường ngày mới Nam Dài Tay mùa xuân và mùa thu cộng với cổ áo,118000,180000,5.0,6,https://sg-test-11.slatic.net/p/628e2bb402ac989ff244b02de2d3019b.jpg,MEIZIZI,shirts,https://www.lazada.vn/products/pdp-i2828622356.html
Áo Sơ Mi Sọc Cổ Tròn Hợp Thời Trang Phong Cách Hàn Quốc Áo Kiểu Dáng Rộng Tay Lỡ Thường Ngày Cho Nữ,75318,132000,3.5,33,https://my-live-01.slatic.net/p/3edb0667e80347af0e33be19bfb3ec5c.jpg,XiaoTing CloThing,shirts,https://www.lazada.vn/products/pdp-i2161738243.html
[HCM]Áo sơ mi sọc Hana,109000,182000,4.96,25,https://vn-test-11.slatic.net/original/1474d885307906e5079595d3dbf9e3e2.jpg,FASHION NANA,shirts,https://www.lazada.vn/products/pdp-i1941353311.html
Áo sơ mi nam boy phố vải đũi mềm thoáng mát phối loang màu trẻ trung mẫu-MILIN SHOP,109000,189000,4.0,2,https://vn-live-01.slatic.net/p/3e12778383b147ff88440ed36b920e53.jpg,MY LINH CLOTHING,shirts,https://www.lazada.vn/products/pdp-i2414373130.html
"(New Arrival) Áo sơmi nam Silas Sọc OTIS BUTTON Down cotton chéo , thêu tay Sl giấu cúc",236610,320000,5.0,2,https://sg-test-11.slatic.net/p/8efd5971ff19148ba9a067060316333f.jpg,SILAS STUDIO,shirts,https://www.lazada.vn/products/pdp-i3202867360.html
Fathsunny màu trơn Áo sơ mi nam mùa hè cao cấp màu trắng thường ngày ngắn áo có tay Nhật Bản,87000,145000,,0,https://sg-test-11.slatic.net/p/f8a6adb9c26728fb8fc59167f4405f6b.png,Laz Nigori MALL,shirts,https://www.lazada.vn/products/pdp-i3170240428.html
Của Phụ Nữ Chải Ca Rô Dài Tay Áo Sơ Mi 2023 New Hoàng Gia Em Gái Phong Cách Đơn Giản Áo Sơ Mi Kẻ Sọc Dáng Rộng,104144,220000,4.103448275862069,28,https://my-live-02.slatic.net/p/ffdf9467d7de51b80ce63c0a0936e1bc.jpg,Chiffon MALL,shirts,https://www.lazada.vn/products/pdp-i2249873034.html
SHZTGM  Áo sơ mi mỏng tay dài màu trơn bất thường thời trang dáng rộng cho nữ,80718,145292,3.6666666666666665,3,https://sg-test-11.slatic.net/p/c8349d8af386000b2e456bb1fafd8e90.jpg,SHZTGM  VN,shirts,https://www.lazada.vn/products/pdp-i2747360493.html
(17-70kg) Áo sơ mi trắng học sinh tay ngắn cộc tay viền chân cổ xanh đồng phục học sinh bé trai bé gái tiểu học,57000,,4.954407294832826,329,https://vn-live-01.slatic.net/p/606c9caa7e951a6494061c13d259f28b.jpg,An Phu Fashion,shirts,https://www.lazada.vn/products/pdp-i2369011424.html
QIAOXIZI | Áo Sơ Mi Mùa Hè Cotton Tay Ngắn Size Lớn Form Rộng,140000,566000,4.666666666666667,3,https://filebroker-cdn.lazada.vn/kf/Sac90163d3f8c4078aebba02b35674488X.png,QXZ FASHION,shirts,https://www.lazada.vn/products/pdp-i3193579666.html
Áo sơ mi nữ công sở kiểu cổ nút ngọc dễ thương,127710,199000,4.851955307262569,358,https://vn-live-01.slatic.net/p/fe781c46953c427505d3d74baf6fd549.jpg,Bán Lẻ Giá Sỉ_Áo Sơ Mi Nữ Kiểu Công Sở,shirts,https://www.lazada.vn/products/pdp-i360530971.html
Áo Sơ Mi Tay Dài Chất Liệu Lụa Mỏng Có túi Cho Nam Trung Niên,268000,442000,4.5,3,https://filebroker-cdn.lazada.vn/kf/Sd1fdacc2f112435c801e97f83ec52fdcp.jpg,MEN'STIAKON men's clothing,shirts,https://www.lazada.vn/products/pdp-i3219312743.html
Áo Sơ Mi Ngắn Tay Phong Cách Công Sở,163000,870000,4.9,10,https://filebroker-cdn.lazada.vn/kf/Sfef1c0481713418bb228807f80229b8e5.jpg,BOMAN clothing,shirts,https://www.lazada.vn/products/pdp-i3234472604.html
Bonnie Cathy Áo Sơ Mi Nam Ngắn Tay Áo Sơ Mi Hawaii Cặp Đôi Áo Khoác Đi Biển Áo Sơ Mi Ngắn Tay In Hoa Nhiệt Đới  áo sơ mi ngắn tay áo sơ mi nam tay ngắn áo sơ mi nam  áo nam  áo sơ mi  áo khoan nam  áo boy phố  ao nam dep mau moi,73000,150000,,,https://sg-test-11.slatic.net/p/69d0108a9a1e49c8797e22a0623ece66.png,Bonnie Cathy Mall,shirts,https://www.lazada.vn/products/pdp-i3076154150.html
"[Beut0302] Áo đoàn, áo đoàn thanh niên Nam Nữ - Logo thêu - Vải Kate, may đẹp",114000,199000,4.978835978835979,189,https://vn-live-01.slatic.net/p/bd725fbc2a6aadecc3d4e82424178acc.jpg,Áo Đoàn Bé Út,shirts,https://www.lazada.vn/products/pdp-i2318821153.html
"ÁO SƠ MI ĐEN NỮ BIG SIZE 45-90kg, kate lụa mềm mịn mát không nhăn, công sở sang trọng thanh lịch",179000,220000,5.0,8,https://filebroker-cdn.lazada.vn/kf/S01c147342b5c4feeac58412fee872330a.jpg,K - Fashion - Quần Áo Nữ,shirts,https://www.lazada.vn/products/pdp-i2673829355.html
"Áo kẻ caro nam với tay áo dài, thêu cổ áo, áo sơ mi giản dị đẹp trai, thời trang và đa năng",169474,300000,3.3333333333333335,6,https://sg-test-11.slatic.net/p/73b57a7481ed0ca62cca0b3071365392.jpg,HANCNY,shirts,https://www.lazada.vn/products/pdp-i2880329841.html
Áo Sơ Mi Tay Ngắn (Tay Lỡ) Unisex Nam Nữ Phong Cách Ulazzang FreeSize 70kg đỗ lại,59631,69000,,,https://filebroker-cdn.lazada.vn/kf/S0b5436b1ea334541b541b9afae281914z.jpg,Racingboystore,shirts,https://www.lazada.vn/products/pdp-i2270941434.html
Mens barong polo Áo sơ mi cho nam giới quần áo phong cách dân tộc cổ điển polo Áo sơ mi Asean quần áo Tops dân tộc polo Áo sơ mi quá khổ họa tiết cổ điển ngoài trời trang phục đường phố 08A,109133,203000,,0,https://sg-test-11.slatic.net/p/f1bb8520dcd054293d5ddfd35294abfe.jpg,gongnie_1,shirts,https://www.lazada.vn/products/pdp-i3230354567.html
áo sơ mi nữ Thái Hòa màu xanh dương mã vải kate,175000,,4.980769230769231,52,https://filebroker-cdn.lazada.vn/kf/Sa008edad82dc437d94f2ee03d9f8158aS.jpg,Công Sở Thái Hoà,shirts,https://www.lazada.vn/products/pdp-i1244135657.html
"Áo Sơ Mi Nữ Công Sở NK FASHION NKSM2012010 Họa Tiết Caro Công Sở Ngắn Tay, Vải Hàn Cao Cấp, Không Nhăn, Nhàu",157500,260000,4.963636363636364,55,https://vn-live-01.slatic.net/p/87c953ac93f7f960df98e388503689b1.png,NK Fashion Store,shirts,https://www.lazada.vn/products/pdp-i2534154237.html
Áo Sơ Mi Nam Tay Ngắn Oxford Cotton Nguyên Chất Mùa Hè Mỏng Màu Sọc Cổ Vuông Thời Trang Công Sở Thường Ngày Thường Ngày,127980,1107000,5.0,29,https://filebroker-cdn.lazada.vn/kf/Sda582cccf39b4445bb3c6a2f754cd84dV.jpg,Lazada Global,shirts,https://www.lazada.vn/products/pdp-i2830783317.html
JIFANPAUL | Áo sơ mi bé trai đa năng mùa xuân thu 2025,126000,148000,4.933333333333334,15,https://filebroker-cdn.lazada.vn/kf/S8a1682427152459287b2b445953ed2bfq.jpg,JIFANPAUL Global,shirts,https://www.lazada.vn/products/pdp-i3197915865.html
Áo Sơ Mi Cho Phụ Nữ Mùa Thu Màu trơn mới cỡ lỡn Áo cánh nữ 2024 Bow đơn giản cho văn phòng dài tay áo cho nữ,185880,280774,4.336448598130841,115,https://sg-test-11.slatic.net/p/945be805cd1e9b5a4bbcb61749981439.jpg,GEGSUIh,shirts,https://www.lazada.vn/products/pdp-i2792609956.html
Áo sơ mi nam tay dài sang chảnh lịch lãm  cho phái mạnh -  T41,217800,300000,5.0,5,https://vn-live-01.slatic.net/p/bc38e469d20c370c21abfd5aacc7aa4a.jpg,THỜI TRANG NAM UMI SHOP,shirts,https://www.lazada.vn/products/pdp-i3187993988.html
Áo sơ mi đũi nam tay ngắn trung niên THÁI KHANG siêu mát form rộng cho người lớn tuổi caro ATK12,149000,199000,4.909090909090909,11,https://vn-live-01.slatic.net/p/1491f4611e1c68154dcccfe8b336bcfb.jpg,THAIKHANG.CO,shirts,https://www.lazada.vn/products/pdp-i2308045180.html
Áo croptop sơ mi kẻ sọc cột nơ sau,62000,,,,https://filebroker-cdn.lazada.vn/kf/Sc187ae57adcc4e82a87f496c8a09153f8.jpg,Khochuyensi_kynam,shirts,https://www.lazada.vn/products/pdp-i2278982863.html
Áo Sơ Mi Nam Kẻ Sọc Chất Mát Có Nhiều Màu Kiểu Dáng Hàn Quốc Thiết Kế Trẻ Trung,450000,,4.409090909090909,22,https://vn-live-01.slatic.net/p/ce95e9a9d0d78a58f66c3efb7e1de165.jpg,Xưởng sỉ Việt Nam,shirts,https://www.lazada.vn/products/pdp-i1562535479.html
HUAXUNRAN | Áo Sơ Mi Ngắn Tay Giúp Gầy Dành Cho Phụ Nữ Trung Niên Mới Thời Trang,146000,559000,4.666666666666667,3,https://filebroker-cdn.lazada.vn/kf/S625bee91925045f5b9f83c6a321e4472f.jpg,HUAXUNRAN,shirts,https://www.lazada.vn/products/pdp-i3193714806.html
Cotton Áo Sơ Mi Dài Quần Áo Chống Nắng Nữ Mùa Hè Áo Sơ Mi Kẻ Sọc Dáng Rộng,156383,259452,4.211428571428572,191,https://my-live-02.slatic.net/p/22bd0935cce18f43760939189a7efdf9.jpg,LikeMy,shirts,https://www.lazada.vn/products/pdp-i523464569.html
Hanlu Áo sơ mi trai thành thị Nhật Bản nam màu trơn Áo Sơ Mi Ngắn Tay Áo sơ mi Preppy trẻ trung sành điệu và đẹp trai áo sơ mi tay ngắn nam (có cà vạt),155000,322000,4.945945945945946,98,https://sg-test-11.slatic.net/p/2da0c8eda263297969968b380f58f373.jpg,Hanlu Style,shirts,https://www.lazada.vn/products/pdp-i2565165739.html
"Fathsunny Áo Sơ Mi Nam Ngắn Tay Kẻ Sọc mùa hè, thời trang công sở thường ngày, ôm vừa, thiết kế hợp thời trang",96000,192000,5.0,1,https://sg-test-11.slatic.net/p/9a36f19eb53059114af6174fc7a963d0.png,Laz Nigori MALL,shirts,https://www.lazada.vn/products/pdp-i3168879642.html
"Áo sơ mi nữ công sở dài tay phối họa tiết sọc kẻ  siêu xinh thời trang PONIVALAZA sang trọng Chất liệu cao cấp, không nhăn, không xù, không phai màu",103950,200000,4.523809523809524,21,https://vn-live-01.slatic.net/p/2b46b6e773b806040ba3eccbb2fbf7d7.jpg,PONIVALAZA,shirts,https://www.lazada.vn/products/pdp-i858608424.html
"Mùa Hè Da Thân Thiện Lụa băng thoáng khí tay ngắn Áo Sơ Mi Cho Nam Giới Của xu hướng thời trang, Đơn Giản Và Sạch Sẽ Màu Sắc, Mát Mẻ Và Giản Dị Giữa Tay Áo Sơ Mi Cho Nam Giới",194917,332864,5.0,10,https://sg-test-11.slatic.net/p/8d8b80b77e26483720f311e4a7801e3a.jpg,NCE Teenager,shirts,https://www.lazada.vn/products/pdp-i3114659772.html
"Áo sơ mi, áo sơ mi nam tay cộc thiết kế sang trọng đẳng cấp - N88",202950,245000,5.0,1,https://vn-live-01.slatic.net/p/e17558514aee4bd7b4b6511654cb3f89.jpg,Thời trang nam Jerry Cherry,shirts,https://www.lazada.vn/products/pdp-i3135089617.html
Hanlu Áo sơ mi nam doanh nhân đơn giản áo sọc Lụa băng dài áo có tay cao cấp cao Áo sơ mi chất lượng,235000,492000,,12,https://sg-test-11.slatic.net/p/a1bb13588cc8ec5914382532c8218a77.png,Hanlu Style,shirts,https://www.lazada.vn/products/pdp-i2840058081.html
Luxqlo mùa hè kẻ sọc ngắn tay sơ mi cho phụ nữ phong cách Hàn Quốc thời trang mới cổ tròn giản dị áo nữ lỏng,132046,207235,5.0,3,https://my-live-02.slatic.net/p/45803e4a192040017a83b265338c51a3.jpg,Luxqlo Store,shirts,https://www.lazada.vn/products/pdp-i2367055959.html
Áo Sơ Mi NEWSEVEN Wave Zip Shirt SM.342,99000,190000,,,https://sg-test-11.slatic.net/p/34d30fc0de3ccec739c5355bb3fae086.jpg,newseven,shirts,https://www.lazada.vn/products/pdp-i3113000686.html
Áo Sơ Mi Mát & Không Nhăn Cho Nam Mùa Hè,183000,348000,4.894736842105263,19,https://filebroker-cdn.lazada.vn/kf/S053e939927994110ade4ed6a57396e8a8.jpg,Kawadu,shirts,https://www.lazada.vn/products/pdp-i3197530389.html
SƠ MI ĐEN KIỂU NỮ CÔNG SỞ CAO CẤP THANH LÝ HẠ SÀO,99000,179000,,,https://vn-live-01.slatic.net/p/f08c5006c28e3a966e867c92b4098956.jpg,THANH T STORE,shirts,https://www.lazada.vn/products/pdp-i2478293267.html
HUAXUNRAN | Áo Sơ Mi Tay Ngắn Thời Trang cho Phụ Nữ,173000,562000,4.666666666666667,3,https://filebroker-cdn.lazada.vn/kf/Sa1563e841a4c47cc82c10895938d06d3D.jpg,HUAXUNRAN,shirts,https://www.lazada.vn/products/pdp-i3193720555.html
"Áo sơ mi, áo sơ mi nam dài tay in họa tiết sang trọng - H116",216810,245000,5.0,2,https://vn-live-01.slatic.net/p/af9e9ae14966e9fedcdbfc9888e9fb57.jpg,Thời trang nam Jerry Cherry,shirts,https://www.lazada.vn/products/pdp-i3074414266.html
Áo sơ mi tay dài nhiều kiểu,33000,,4.8,5,https://filebroker-cdn.lazada.vn/kf/S5469cb29e65a432097df1bd487ad8d78O.jpg,Little Tim,shirts,https://www.lazada.vn/products/pdp-i2523854669.html
M-4XL Cỡ Lỡn Phong Cách Hàn Quốc Áo Cánh Nữ Giản Dị Tay Áo Dài Sọc Áo Sơ Mi Tops,97983,164000,4.285714285714286,107,https://my-live-02.slatic.net/p/16abfb66bfa36d6dc09608a604fff7ac.jpg,cooperma,shirts,https://www.lazada.vn/products/pdp-i761058675.html
Áo Sơ Mi Dài Tay Nam Phong Các Hàn Quốc Thời Trang 24h Dáng Ôm Nhẹ,105000,209000,5.0,5,https://vn-live-01.slatic.net/p/714c9b6d18de9546b46f210c388d4a8e.jpg,Andromeda,shirts,https://www.lazada.vn/products/pdp-i2352691988.html
Áo Sơ Mi Nam Dài Tay Chống Mài Mòn Mùa Xuân Thu Camouflage Làm Việc Thường Ngày Chất Liệu Vải Sọc Nút Cổ Đứng,105000,167000,,,https://filebroker-cdn.lazada.vn/kf/S146207f1a0994eb4bf0ebb46ea3483419.jpg,Lazada Global,shirts,https://www.lazada.vn/products/pdp-i3185905494.html
Áo sơ mi nam dài tay phối sọc thêu chữ XR1266 Thời trang EMEY LUXURY Cao Cấp Kiểu Dáng Hàn Quốc 2023 Chất vải lụa Thái,111644,245000,4.551724137931035,87,https://sg-live-01.slatic.net/p/65d941a48930bc91ab297726afec73ad.jpg,EMEY LUXURY,shirts,https://www.lazada.vn/products/pdp-i949462414.html
Hanlu Áo Sơ Mi Đen Mới Áo Sơ Mi Nam Sinh Áo Khoác Đồng Phục Đẹp Trai Thời Thượng Phiên Bản Hàn Quốc Dài Tay Áo Sơ Mi Trắng Nam Thường Ngày,144000,298000,5.0,109,https://my-live-02.slatic.net/p/a81829fced9215c779f8e6906da2346c.jpg,Hanlu Style,shirts,https://www.lazada.vn/products/pdp-i1964239685.html
YIPINYOUYOU丨Người đàn ông của polo Áo sơ mi-Ánh sáng mùa hè giản dị TRUNG NIÊN ngắn tay Polo Áo sơ mi trơn mới màu sắc phù hợp với mỏng ve áo T-shirt,104000,208000,4.96875,161,https://sg-test-11.slatic.net/p/d64cf96875e157f3ab69de4e72df15c2.jpg,YIPINYOUYOU,shirts,https://www.lazada.vn/products/pdp-i2623365062.html
Áo Sơ Mi Nam Dài Tay Mùa Thu MH Mới,118000,244000,4.9035087719298245,214,https://my-live-02.slatic.net/p/31d544aca78f4c5497ceedd5c3c8208f.jpg,Hanlu Style,shirts,https://www.lazada.vn/products/pdp-i766970206.html
"ÁO SƠ MI NAM TAY DÀI SỌC CARO PHONG CÁCH HIỆN ĐẠI, NÚT GÀI, IN 3D KHÔNG PHAI, PHONG CÁCH HÀN QUỐC, VẢI LỤA MỀM MỊN, PHÙ HỢP CÂN NẶNG TỪ 40-95KG",127700,199000,,,https://vn-live-01.slatic.net/p/c73643c665027bb3e5c8cb5ffb44070b.jpg,SOMI NAM,shirts,https://www.lazada.vn/products/pdp-i3263970351.html
Áo Sơ Mi Nam Dày Dặn Mùa Đông Có Lót Lông Cừu in Họa Tiết Kẻ Caro Cổ Vuông Tay Dài Thường Ngày Thương Hiệu Không,161000,1626000,5.0,2,https://filebroker-cdn.lazada.vn/kf/S493f55946395491e978240fdbe7afc4cI.jpg,TB FASHION STORE,shirts,https://www.lazada.vn/products/pdp-i3010157220.html
Áo Sơ Mi Nam Cổ Đứng Phong Cách Trung Hoa Cổ Truyền Bằng Cotton Nguyên Chất Co Giãn Bộ Sưu Tập Thu Áo Sơ Mi Cổ Bẻ Tay Dài Ôm Vừa Vặn,130200,4797000,,,https://filebroker-cdn.lazada.vn/kf/Sbc965e72ab544d19b242802806aa3ec7y.jpg,Lazada Global,shirts,https://www.lazada.vn/products/pdp-i3253129222.html
Áo Sơ Mi Tay Ngắn Dáng Rộng Thường Ngày Cho Nam Mùa Hè Thường Ngày Đi Biển Quần Áo Du Lịch Quần Áo Cặp Đôi Áo Khoác Ngoài Thoải Mái Thoáng Khí,54270,1187000,5.0,4,https://filebroker-cdn.lazada.vn/kf/S8efc745c2b5e454fa8c9377dda791504s.jpg,TB FASHION STORE,shirts,https://www.lazada.vn/products/pdp-i2995765329.html
"Áo Sơ Mi Lụa công sở Dài Tay Nam LADOS-1779, Chất lụa mềm form regular Fit phong cách trẻ trung",141000,219000,4.983333333333333,60,https://vn-test-11.slatic.net/p/cfa2d96821470fb0860e7f8ce81ad357.jpg,LADOS STORE,shirts,https://www.lazada.vn/products/pdp-i3076828686.html
Áo Sơ Mi Nam Dài Tay Kẻ Sọc Thường Ngày Chuyên Nghiệp Công Sở Ôm Vừa Vặn Thời Trang Mùa Xuân Thu Đông Hè Chất Liệu Polyester,126000,570000,5.0,2,https://filebroker-cdn.lazada.vn/kf/S360f14249e824e8abed0e1afde3beca2H.jpg,TB FASHION STORE,shirts,https://www.lazada.vn/products/pdp-i3015639720.html
Áo Sơ Mi Nam Dài Tay Sọc Caro Thêu Logo MR Thời Trang EMEY LUXURY Cao Cấp Kiểu Dáng HÀN QUỐC 2022 chất vải Lụa Thái Siêu Đẹp,125000,275000,4.886274509803922,255,https://vn-live-01.slatic.net/p/f1514a59c78dc0d239afcca45cc48694.jpg,EMEY LUXURY,shirts,https://www.lazada.vn/products/pdp-i258261141.html
