ten_san_pham,gia_sale,gia_goc,rating,so_review,link_anh,shop,category,url_san_pham
Carhartt Carhartt Carhartt Wynton Two Short Sleeve Shirt 22 Bag Ss Tooling Male Short-Sleeved Summer 030456 I Half Sleeve,872862,891275,5.0,3,https://vn-live-01.slatic.net/p/759bd189f8681e7f832c4948c653fd66.jpg,kmf7271888,shirts,https://www.lazada.vn/products/pdp-i2420698638.html
"Áo Sơ Mi Lụa Dài Tay Nam LADOS-1779, Chất lụa mềm form đẹp",141000,219000,4.818181818181818,22,https://sg-test-11.slatic.net/p/b615283c9f4dba5f547b9583a69dec49.jpg,LADOS STORE,shirts,https://www.lazada.vn/products/pdp-i3076888150.html
Áo công sở SU26 thiết kế cổ giả sơ mi tay ngắn nhiều màu fullsize thanh lịch sang trọng - Nguyễn Tư Shop.,170000,,5.0,2,https://filebroker-cdn.lazada.vn/kf/Sbceeed605d4744929a6054196f630f33P.jpg,Shop Nguyễn Tư (M),shirts,https://www.lazada.vn/products/pdp-i3247753568.html
Hanlu Người Đàn Ông Của Polo Áo Sơ Mi Kinh Doanh Giản Dị Ve Áo Ngắn Tay T-Shirt Thời Trang Dệt Kim Polo Áo Sơ Mi,153000,328000,5.0,0,https://sg-test-11.slatic.net/p/8654d6971975a67762f49dcf2a898b1e.png,Hanlu Style,shirts,https://www.lazada.vn/products/pdp-i3030460068.html
"Áo sơ mi nam ngắn tay mango Hàn Quốc LADOS-8110 chống nhăn, lịch lãm",160000,300000,4.9411764705882355,204,https://vn-test-11.slatic.net/p/78ff8660deb47e556fddba19558ff5be.png,LADOS STORE,shirts,https://www.lazada.vn/products/pdp-i3076888164.html
Kiểu cổ điển cho nữ ZANZEA cổ ve áo 3/4 Tay áo sơ mi nút hoa in phong cách cổ điển làm việc Tops Blouse #1103,214000,450300,,,https://sg-test-11.slatic.net/p/bce15bd12364509eff1207b6d99bba4c.jpg,ZANZEA,shirts,https://www.lazada.vn/products/pdp-i3240088623.html
Áo Sơ Mi Linen Mỏng Mát Chống Nắng Cho Phụ Nữ Mùa Hè Cổ Trụ,295000,415000,,,https://filebroker-cdn.lazada.vn/kf/S65085ebacfde430287860c7965586389W.jpg,Pianli,shirts,https://www.lazada.vn/products/pdp-i3233242512.html
ÁO KHOÁC SƠ MI LƯỚI VINTAGE XUẤT NHẬT,99000,149000,,,https://filebroker-cdn.lazada.vn/kf/S185a6498eb924db396ab2ede01d85623V.jpg,Gia dụng giá rẻ Nana,shirts,https://www.lazada.vn/products/pdp-i3188207871.html
Áo sơ mi nữ dài tay trơn công sở Thời trang EMEY LUXURY Chất vải mềm mại Thiết kế nữ tính Không Kém Phần Sang Trọng,103950,210000,4.549295774647887,142,https://vn-live-01.slatic.net/p/915a3136a0fafe7d6f125a2688816da6.jpg,EMEY LUXURY,shirts,https://www.lazada.vn/products/pdp-i258263031.html
Áo Sơ Mi Nữ Công Sở Tay Lỡ Cài Nút Ngực,137610,199000,4.720754716981132,265,https://vn-live-01.slatic.net/p/66bb7d3d7090ee6a5656f332f15348be.jpg,Bán Lẻ Giá Sỉ_Áo Sơ Mi Nữ Kiểu Công Sở,shirts,https://www.lazada.vn/products/pdp-i346264091.html
"Áo sơ mi nam dài tay dấu nút vải lụa chéo Hàn LADOS-8119 sang trọng, lịch sự",160000,300000,4.929133858267717,127,https://vn-test-11.slatic.net/p/c5a18654bc831baeda603e33c548d17d.jpg,LADOS STORE,shirts,https://www.lazada.vn/products/pdp-i3076778788.html
"Áo sơ mi , áo sơ mi nam tay ngắn, Sơ mi bò vân chéo, hiện đại phong cách - H112",230000,400000,4.906474820143885,139,https://vn-live-01.slatic.net/p/0799564dd7504e66bebe51de184755df.jpg,Thời Trang Cao Cấp T&T Shop,shirts,https://www.lazada.vn/products/pdp-i1947957538.html
Áo Sơ Mi Vải Lanh Cỡ Lớn Mùa Hè Thoáng Khí Thường Ngày Cổ Tròn Tay Bảy Cỡ Lớn Rộng Rãi Che Bụng,88000,,1.0,2,https://filebroker-cdn.lazada.vn/kf/Sf61e777d3bc54453877c3089c531bd4f5.jpg,Lazada Global,shirts,https://www.lazada.vn/products/pdp-i3241690775.html
"Áo Sơ Mi dài tay cổ trụ Nam  LADOS-8133 chất xô đũi cao cấp, thoáng mát đứng form",166000,349000,4.818181818181818,44,https://vn-test-11.slatic.net/p/dd23b9e531ad8870d982c9a196d410d7.jpg,LADOS STORE,shirts,https://www.lazada.vn/products/pdp-i3076932041.html
Hàng Hóa Mặc Áo Sơ Mi Ngắn Tay Cho Nam Giới Mùa Hè Mỹ Loose Layup Người Đàn Ông Của tay áo lửng Áo Sơ Mi Đa Năng,292879,365772,4.545454545454546,15,https://sg-test-11.slatic.net/p/d1ee2bf55bb4de69abb3bd8d92fc4de2.jpg,NCE Hommes ,shirts,https://www.lazada.vn/products/pdp-i2358713870.html
"IELGY  Áo Sơ Mi Nam Tay Ngắn Nhật Bản Dáng Rộng Thoải Mái Vải Lanh Thường Ngày Phối Màu Sọc, Tay Áo Ba Phần Tư",343477,559900,5.0,6,https://my-live-02.slatic.net/p/cb61e71c3ecc70f9cfb96713284092d3.jpg,IELGY Men's Wear,shirts,https://www.lazada.vn/products/pdp-i1221874327.html
Celmia ZANZEA Áo cánh Áo sơ mi công sở thanh lịch cho nữ phong cách Hàn Quốc Áo cánh Áo thun dáng rộng giản dị Trơn Cổ Chữ V Tay 3/4 #0728,158002,307800,5.0,1,https://sg-test-11.slatic.net/p/14467ee00ceabb7b5513f132f42a366f.jpg,Celmia,shirts,https://www.lazada.vn/products/pdp-i3158427445.html
Áo sơ mi nữ kiểu tay dài cổ trụ vải manggo cao cấp,98010,199000,4.571428571428571,7,https://vn-live-01.slatic.net/p/3809d098403fabad240ffa4fdda52406.jpg,Bán Lẻ Giá Sỉ_Áo Sơ Mi Nữ Kiểu Công Sở,shirts,https://www.lazada.vn/products/pdp-i961720999.html
Hanlu Người đàn ông của polo Áo sơ mi thời trang ve áo T-shirt phong cách Hàn Quốc dệt kim polo Áo sơ mi,211000,440000,5.0,12,https://sg-test-11.slatic.net/p/8f87785a2da24b37612907837dfbe3dc.png,Hanlu Style,shirts,https://www.lazada.vn/products/pdp-i2691977189.html
Luxqlo Áo sơ mi trắng tay phụ nữ dài áo blouse công sở áo cho doanh nhân thời trang cỡ lỡn 2025,148324,230000,,,https://sg-test-11.slatic.net/p/ed8a4e4800790fb187f31a4fc1293efd.jpg,Luxqlo Store,shirts,https://www.lazada.vn/products/pdp-i3084708041.html
[DUY NHẤT] Áo sơ mi tay ngắn lai ngang Tây Đô duy nhất size L (70kg) (1LKCKS2/823),180000,315000,5.0,0,https://vn-live-01.slatic.net/p/21500a16b096669cf16bf85217a4e038.jpg,Thời trang công sở nam_Vĩnh Long,shirts,https://www.lazada.vn/products/pdp-i2806088958.html
Áo sơ mi dài tay màu xám xoắn eo vải linen Lovadova CB1101,79000,155000,,,https://vn-live-01.slatic.net/p/0e3ba55f36054be4b986a9078c389aba.jpg,Lovadova Fashion Store,shirts,https://www.lazada.vn/products/pdp-i2873761100.html
Sơ mi nữ Thái Hòa màu cam trơn,205000,,5.0,22,https://filebroker-cdn.lazada.vn/kf/S89008bf3b89a4754aa15ccb54fc9ed33i.jpg,Công Sở Thái Hoà,shirts,https://www.lazada.vn/products/pdp-i2144834242.html
Áo Sơ Mi Lót Lông Cừu Dày Dervo Dài Tay Cổ Cao Lót Lông Cừu Thời Trang Hàn Quốc Đa Năng Cho Nữ Áo Ấm Mặc Trong,82000,,,,https://filebroker-cdn.lazada.vn/kf/Sa371dba2bb834946839de81a13c70dd5J.jpg,TB FASHION STORE,shirts,https://www.lazada.vn/products/pdp-i2791802059.html
"Áo sơ mi sọc nam ngắn tay vải oxford có túi LADOS-8127 năng động, thấm hút, dày dặn đứng form",179000,379000,4.896103896103896,77,https://vn-test-11.slatic.net/p/bf3c458eafd01111af30c1974a7c912f.jpg,LADOS STORE,shirts,https://www.lazada.vn/products/pdp-i3076850417.html
Áo sơ mi nữ trắng phối hoa DMC (White 3D Flower Raw Shirt),399000,1199000,5.0,2,https://vn-live-01.slatic.net/p/77afe39011b0787dedd8047d61296ba2.jpg,DMC,shirts,https://www.lazada.vn/products/pdp-i2717364370.html
Áo Sơ Mi Dài Tay Rộng Rãi Dài Vừa Phải Mùa Xuân Hè Chống Nắng Thời Trang Cổ Polo Màu Trơn Phong Cách Hàn Quốc Dành Cho Nữ,45500,62000,,1,https://filebroker-cdn.lazada.vn/kf/S12d7425805c841a5b41b3472c0ac773bK.jpg,TB FASHION STORE,shirts,https://www.lazada.vn/products/pdp-i3182766041.html
Người đàn ông của dài tay Polo Áo sơ mi 2024 mùa thu sọc lỏng bố hàng đầu,159000,200000,5.0,8,https://sg-test-11.slatic.net/p/a51553f6a8edffec5adea1b847f05b35.jpg,Handsome men's clothing mall,shirts,https://www.lazada.vn/products/pdp-i2841233809.html
Mùa hè hợp thời trang mới cao cấp ánh sáng sang trọng nam tay ngắn Polo Áo sơ mi giản dị đẹp trai kinh doanh cổ áo t,132788,265576,5.0,0,https://sg-test-11.slatic.net/p/c5d39a7c8e0539dd9eecfd60d432fa02.jpg,Yoking Space,shirts,https://www.lazada.vn/products/pdp-i3099209053.html
Người Đàn Ông Của Giản Dị Áo Sơ Mi 3D Neo Đồ Họa Quần Áo Quá Khổ tay ngắn Tops Mùa Hè Đường Phố Giản Dị Mặc Người Đàn Ông Của Áo Sơ Mi,188821,280000,4.82051282051282,54,https://vn-live-01.slatic.net/p/ba80e71b3732c8e1977588456f72f891.jpg,Oufisun Fashion Clothing,shirts,https://www.lazada.vn/products/pdp-i2498675246.html
Nam Kẻ Sọc Áo Sơ Mi Tay Dài Dáng Rộng Thời Trang Hợp Thời Trang Sinh Viên Áo Khoác Xuân Hè Cổ Vuông Phối Điện Đơn,126700,235000,4.7073170731707314,141,https://filebroker-cdn.lazada.vn/kf/S5d737e8b133b48138efb5ab832c21b2fI.jpg,GlobalWonderShop,shirts,https://www.lazada.vn/products/pdp-i2682834868.html
Hanlu Nam màu trơn Áo sơ mi công sở đơn giản thường ngày áo sành điệu áo có tay ngắn có tay ngắn,140000,238400,5.0,81,https://sg-test-11.slatic.net/p/aec29bf3234243473d6cf80735f4885e.jpg,Hanlu Style,shirts,https://www.lazada.vn/products/pdp-i2613756601.html
Áo sơ mi nam ngắn tay Hàn Quốc công sở phối họa tiết caro có túi Đẹp thời trang PONIVALAZA cao cấp chất vải lụa thái mềm mịn thoáng mát form dáng ôm,117810,200000,4.755102040816326,49,https://vn-live-01.slatic.net/p/a16ee970850f7f141f3b8887968c25de.jpg,PONIVALAZA,shirts,https://www.lazada.vn/products/pdp-i1813612009.html
MOLAN áo sơ mi sọc caro nam Áo Sơ Mi Nam Ngắn Tay Áo sơ mi kẻ ô xu hướng mới mùa hè Áo thời trang túi đôi áo thun thường ngày,233000,501000,4.8125,164,https://sg-test-11.slatic.net/p/5e1d593c03053e621da2b52c6e641d01.jpg,MOLAN Shopping Mall,shirts,https://www.lazada.vn/products/pdp-i2596767390.html
Cổ Điển Dân tộc Áo Sơ Mi Áo Nam Thường Ngày Quá Khổ Áo Sơ Mi Ngắn Tay Tops dáng rộng cho Nam Của T-Shirts Trang Phục Kỳ Nghỉ,187629,280000,4.782608695652174,24,https://my-live-01.slatic.net/p/31ecd818607a49d53eea085554bc10d5.jpg,Oufisun Fashion Clothing,shirts,https://www.lazada.vn/products/pdp-i2782834309.html
ÁO SƠ MI NAM Dài Tay Phối Họa Tiết CARO KHÔNG LÊN LAI Mã GY57 EMEY LUXURY THỜI TRANG HÀN QUỐC CAO CẤP Hót Trend 2023,103950,230000,4.634057971014493,276,https://vn-live-01.slatic.net/p/f112704399a43937e02272c667e5513a.jpg,EMEY LUXURY,shirts,https://www.lazada.vn/products/pdp-i270616288.html
SINRANSINYA丨áo somi nam tay dài-Áo nam mùa thu mới kẻ sọc dài áo có tay nam rộng thường ngày áo khoác áo dày mỏng,223000,472000,4.953488372093023,105,https://sg-test-11.slatic.net/p/74d33843353512e27982a2c886704272.jpg,SINRANSINYA Shopping Mall,shirts,https://www.lazada.vn/products/pdp-i2519551502.html
Áo sơ mi nam dài tay phối họa tiết chữ ngang ngực SMT99782  thời trang PONIVALAZA cao cấp Chất cao cấp chuẩn form thấm hút mồ hôi tốt,125000,200000,4.714285714285714,14,https://vn-live-01.slatic.net/p/83ff396681ba74caa525ca397bebc3b0.jpg,PONIVALAZA,shirts,https://www.lazada.vn/products/pdp-i2160986281.html
Hanlu áo somi nam tay dài Nhật Bản Dài áo có tay áo sọc áo sơ mi giản dị quần áo thời trang,217000,454000,5.0,331,https://my-live-02.slatic.net/p/6a412ec67bcb11a190c3cd871fb94934.jpg,Hanlu Style,shirts,https://www.lazada.vn/products/pdp-i2348665764.html
Áo sơ mi nữ đẹp kiểu Hàn Quốc trắng thanh lịch vintage,103950,170000,4.859621451104101,634,https://vn-live-01.slatic.net/p/f2d87c01bef3652f969c4a37926ea6de.jpg,EMEY LUXURY,shirts,https://www.lazada.vn/products/pdp-i270604826.html
MOLAN Áo Sơ Mi Nam Dài Tay Áo Thường Ngày Trẻ Trung Dáng Rộng Kẻ Ca Rô Phong Cách Cổ Điển Hàn Quốc Áo Khoác Hợp Thời Trang Cho Học Sinh,127000,273000,5.0,123,https://my-live-01.slatic.net/p/f74027b3926686b836da9f9d57d1761b.jpg,MOLAN Shopping Mall,shirts,https://www.lazada.vn/products/pdp-i1662042887.html
Hanlu Người đàn ông của polo Áo sơ mi đơn giản chất lượng cao Áo phông công sở thời trang sọc Lụa băng Polo tay ngắn mỏng và thoáng khí,192000,400000,5.0,40,https://sg-test-11.slatic.net/p/723b801eb288f5748db8bf8cfb994ed8.jpg,Hanlu Style,shirts,https://www.lazada.vn/products/pdp-i2647834489.html
Người đàn ông của Áo sơ mi Hawaii đối với Mens Casual Guitar áo in họa tiết áo rộng bãi biển Áo ngắn tay camicas Homme,197480,280000,4.781609195402299,107,https://my-live-01.slatic.net/p/517456dae001bd99af83aee980e6d22f.jpg,Oufisun Fashion Clothing,shirts,https://www.lazada.vn/products/pdp-i2584390702.html
Hanlu Áo Sơ Mi Ngắn Tay Kẻ Sọc Thoáng Khí Cho Nam Áo Sơ Mi Com Lê Áo Sơ Mi Nam,307000,666000,4.936842105263158,120,https://my-live-02.slatic.net/p/82abc0061da9f37c55ebdc477a0071e6.jpg,Hanlu Style,shirts,https://www.lazada.vn/products/pdp-i2125443067.html
Hanlu Áo Sơ Mi Nam Áo Sơ Mi Dài Tay Thường Ngày Áo Sơ Mi Thời Trang Phong Cách Hàn Quốc Thoải Mái Và Thân Thiện Với Da Thiết Kế Tối Giản,130000,268000,4.964566929133858,307,https://my-live-02.slatic.net/p/06e6871ad56cd77c40f83cf025c68808.jpg,Hanlu Style,shirts,https://www.lazada.vn/products/pdp-i2114110506.html
Molan Áo sơ mi nam áo khoác dài tay ve áo thời trang theo xu hướng mới in kẻ ca rô Áo dáng rộng giản dị dễ phối,229000,503000,5.0,19,https://sg-test-11.slatic.net/p/b749136452bd342c954a048ff6c3dba5.png,MOLAN Shopping Mall,shirts,https://www.lazada.vn/products/pdp-i2543682526.html
Áo sơ mi nam Polo công sở thường ngày Áo thun trung niên nam,102000,180000,,1,https://sg-test-11.slatic.net/p/a5f0faaff8dfdbca5ecac5501c5b60e1.png,Hanlu Style,shirts,https://www.lazada.vn/products/pdp-i3228594887.html
MOLAN Áo nam ôm vừa cổ điển của nam giới Tay áo dài áo in hoa Áo sơ mi Hawaii,118000,225000,5.0,2,https://sg-test-11.slatic.net/p/01d04e80574d1db4e7803f2bd04d44a0.png,MOLAN Shopping Mall,shirts,https://www.lazada.vn/products/pdp-i3068978689.html
IELGY Áo Sơ Mi Trắng Niche Lụa Băng Thiết Kế Cao Cấp Dáng Rộng Tay Dài Cho Nam,227959,365900,,,https://my-live-01.slatic.net/p/5388af42fe96503f404c00a636442152.png,IELGY Men's Wear,shirts,https://www.lazada.vn/products/pdp-i2213184607.html
Lansboter áo sơ mi áo nam áo boy phố áo sơ mi nam boypro Linen Áo Thun Tay Dài của người đàn ông mới đứng lên cổ áo áo rộng Loose Casual Top Áo khoác,283000,608000,5.0,149,https://sg-test-11.slatic.net/p/d9f058118641a6d6746094c946e5823b.jpg,Lansboter,shirts,https://www.lazada.vn/products/pdp-i2458483206.html
Hanlu Thời trang nam polo Áo Sơ Mi Lụa băng rỗng Áo phông sọc thường ngày đẹp trai Chất lượng cao ngắn tay Polo,234000,452000,2.0,2,https://sg-test-11.slatic.net/p/e101cafc7a71138414be7f626803e358.png,Hanlu Style,shirts,https://www.lazada.vn/products/pdp-i3105868911.html
Áo sơ mi nữ dài tay kẻ sọc form rộng vừa chất Cotton nhăn thoáng mát dễ phối đồ đi làm đi chơi mặc thoải mái từ 40kg đến 83kg,124351,250000,,,https://vn-live-01.slatic.net/p/21724b79748c31180f0b596b22792ef1.jpg,LINH LINH 712 STORE,shirts,https://www.lazada.vn/products/pdp-i3268560357.html
Áo Sơ Mi Nữ Tay Ngắn Kẻ Sọc Cổ Trụ Thời Trang Công Sở Hot 2023,123750,210000,4.486486486486487,37,https://vn-live-01.slatic.net/p/b11bd24ad9889e07f8b48d04c5444a93.jpg,EMEY LUXURY,shirts,https://www.lazada.vn/products/pdp-i335750475.html
MOLAN áo sơ mi sọc caro nam Áo khoác nam đơn giản thường ngày Áo sơ mi kẻ ô xu hướng lười áo mới khí chất tay dài cho thanh thiếu niên phổ biến,120000,257000,4.846153846153846,23,https://sg-test-11.slatic.net/p/a347d3a45559c50220d2297479de59e5.jpg,MOLAN Shopping Mall,shirts,https://www.lazada.vn/products/pdp-i2626967389.html
KUYICHAOREN | Áo Sơ Mi Caro Phong Cách Mỹ Dài Tay Thời Trang Đa Năng Cao Cấp Size Lớn,699000,1125000,4.897196261682243,219,https://filebroker-cdn.lazada.vn/kf/Sb53b4d75b3614424a6fd931e8eec686bx.jpg,kuyichaoren,shirts,https://www.lazada.vn/products/pdp-i3197137007.html
Hanlu Áo sơ mi Hawaii cổ điển thời trang ngắn in thường ngày tay ngắn áo có tay cho nam,192000,370000,,,https://sg-test-11.slatic.net/p/423cbca54fbe7442954947ab2d9abfd4.png,Hanlu Style,shirts,https://www.lazada.vn/products/pdp-i3053229300.html
Áo sơ mi nam Pierre Cardin tay ngắn vải lụa băng thoáng mát mùa hè,740000,827000,4.909090909090909,22,https://filebroker-cdn.lazada.vn/kf/S8e19854dd766477b8d7cee21b5f746f5G.jpg,Pierre Cardin Global,shirts,https://www.lazada.vn/products/pdp-i3181709796.html
【Oufisun】Áo sơ mi nam phong cách mới thợ sửa chữa cơ khí hoàn toàn thăng hoa áo phông tay ngắn hàng ngày Cổ Điển Mùa Hè nút thấm mồ hôi và áo phông thoáng khí,96601,250000,5.0,5,https://my-live-01.slatic.net/p/d2fcce50f27b2e3a3b4407361e0097d0.png,Oufisun Fashion Clothing,shirts,https://www.lazada.vn/products/pdp-i3131728343.html
New Men's Casual Blouse Cotton Linen Shirt Loose Tops Long Sleeve Tee Shirt Spring Autumn Casual Handsome Men's Shirts,171539,208858,4.384615384615385,13,https://sg-test-11.slatic.net/p/2430850abb9749b7967ec06b617bd130.jpg,King billion,shirts,https://www.lazada.vn/products/pdp-i2733345690.html
Áo Sơ Mi Nữ Tay Dài Dáng Rộng Thiết Kế Thanh Lịch Mùa Xuân Thu Áo Khoác Ngoài Giả Hai Mảnh Thường Ngày Áo Sơ Mi Cổ Polo,73500,106000,,,https://filebroker-cdn.lazada.vn/kf/Sf9f7cdff429644f7aba17fa11c2a6e4cX.jpg,TB FASHION STORE,shirts,https://www.lazada.vn/products/pdp-i3237413504.html
Hanlu Người Đàn Ông Của Lụa băng Polo Áo Sơ Mi Đơn Giản Dệt Kim tay ngắn Phong Cách Ve Áo T-Shirt doanh nhân đơn giản,212000,430000,5.0,88,https://sg-test-11.slatic.net/p/2c49f5b00e411b171eaf13cb056bf7bc.jpg,Hanlu Style,shirts,https://www.lazada.vn/products/pdp-i2610559701.html
Hanlu Áo phông nam sơ mi cao cấp Hollow-out dệt kim polo Áo sơ mi Mỏng mảnh dẻ phù hợp với áo polo thời trang,163000,314000,5.0,2,https://sg-test-11.slatic.net/p/d877fe9c6aa13ded23b1187412f837ad.png,Hanlu Style,shirts,https://www.lazada.vn/products/pdp-i3061546513.html
Hanlu Áo Khoác Sơ Mi Nam Rộng Thường Ngày Dễ Phối Áo Thun Tay Dài Vải Nhung Kẻ In Chữ Cho Nam Áo Thun Tay Dài,212000,458000,4.990654205607477,165,https://my-live-02.slatic.net/p/534ba0482fd4abcf05fbbe08dee9e3a1.jpg,Hanlu Style,shirts,https://www.lazada.vn/products/pdp-i2196078645.html
Áo Thun Dài Tay Có Cổ Bẻ và Túi Cho Nam Trung Niên,268000,441000,5.0,1,https://filebroker-cdn.lazada.vn/kf/S15b45ddd08d14a2189592cc6dd5d2e13H.jpg,MEN'STIAKON men's clothing,shirts,https://www.lazada.vn/products/pdp-i3219627110.html
"Áo sơ mi nam nữ dài tay kẻ sọc basic SUN H7 mẫu đơn giản, dễ phối đồ trẻ trung Menswear Cổ Tròn Women Top",189000,250000,,,https://vn-live-01.slatic.net/p/16fd7dec6fdebab0e9c860f978b75999.png,SUN FASHIONNN,shirts,https://www.lazada.vn/products/pdp-i3218880398.html
{OETYTY} Áo Sơ Mi Nam Tay Dài Không Cần Ủi Mùa Xuân Hè Phong Cách Công Sở Sọc Cỡ Lớn Quần Áo Bố Quần Áo Rộng Rãi,149050,199429,5.0,1,https://sg-test-11.slatic.net/p/015af004ea9541d1540489894bce86c5.jpg,LINGCHENGZHINENG,shirts,https://www.lazada.vn/products/pdp-i3114087163.html
Luxqlo áo màu vàng phụ nữ văn phòng trang phục chính thức satin áo thời trang phong cách Hàn Quốc Tay Áo Dài Tops OL,150100,253000,,,https://sg-test-11.slatic.net/p/2b640b26741e0b080caf46cc715ddf7e.jpg,Luxqlo Store,shirts,https://www.lazada.vn/products/pdp-i2915282440.html
Áo sơ mi nam dài tay trơn công sở cổ trụ/ cổ tàu thời trang PONIVALAZA,99000,200000,5.0,4,https://vn-live-01.slatic.net/p/8304baa9bda7b590784787d032d2d0f1.jpg,PONIVALAZA,shirts,https://www.lazada.vn/products/pdp-i1314226054.html
Áo Sơ Mi Dài Tay Caro Chống Nhăn Lụa Băng Cho Nam Kinh Doanh Mùa Thu,351000,569000,,,https://filebroker-cdn.lazada.vn/kf/S26d92efa31c54c9f99f80ccbda80b372U.jpg,MEN'STIAKON men's clothing,shirts,https://www.lazada.vn/products/pdp-i3219628171.html
(Freeship) Áo Sơ Mi Tay Ngắn Kẻ Sọc Vĩnh Tiến Dáng Regular Vạt Ngang 295,203980,355000,5.0,26,https://vn-live-01.slatic.net/p/7542697711a7e0ebb2f2fdf568d24c2c.jpg,THỜI TRANG VĨNH TIẾN,shirts,https://www.lazada.vn/products/pdp-i558390799.html
"Áo kiểu nữ, áo công sở, áo sơ mi, Áo hãng sale, áo phom rộng, áo big size, sale áo mẫu ngẫu nhiên",62800,81700,5.0,4,https://vn-live-01.slatic.net/p/0f6f52920add92ab6bf59896cc45665b.jpg,Anfashion 0835236688.Selection,shirts,https://www.lazada.vn/products/pdp-i3081407363.html
Áo Sơ Mi Nam Vải Lanh Ngắn Tay Dáng Rộng Mùa Hè Mỏng Màu Trắng Tinh Khiết Cotton Công Sở Cổ Vuông Áo Vest,161000,298000,5.0,20,https://filebroker-cdn.lazada.vn/kf/S6a6b5bf8262e40da99ca386586e05abek.jpg,GlobalWonderShop,shirts,https://www.lazada.vn/products/pdp-i2954272403.html
"Áo Sơ Mi Dài Tay In Hoa Nhẹ, Co Dãn",267000,1303000,4.785714285714286,14,https://filebroker-cdn.lazada.vn/kf/S326e4dba11ab4dfda5097c0394d1277dO.jpg,MEN'STIAKON men's clothing,shirts,https://www.lazada.vn/products/pdp-i3219696518.html
"Áo sơ mi caro - flannel secondhand - 𝐒𝐈𝐙𝐄 𝐗𝐋 - vintage, cổ điển - Mousi 2hand",79000,,5.0,9,https://vn-live-01.slatic.net/p/59591daee25bc85dd79d70fbeae23b5a.png,Lucida,shirts,https://www.lazada.vn/products/pdp-i2073420081.html
Tucano | Áo Sơ Mi Dài Tay Phong Cách Doanh Nhân Trẻ Premium Cotton Fleece,312000,611000,5.0,1,https://filebroker-cdn.lazada.vn/kf/Sd9bbdecd470f4a0389bea67737522573y.jpg,TUCANO Men's Clothing,shirts,https://www.lazada.vn/products/pdp-i3191221200.html
Áo sơ mi nữ cổ tròn phối bèo cổ tiểu thư chất lụa mềm mịn -Gloria Shop H5,102299,139000,5.0,9,https://vn-live-01.slatic.net/p/5975e9098ba7188b64d4245cd8f9e51d.jpg,Gloria Shop_ThờiTrang Công Sở,shirts,https://www.lazada.vn/products/pdp-i2820175680.html
"Áo sơ mi tay ngắn nam nữ trơn form rộng ẨN CÚC unisex hiện đại, vải lụa Hàn không nhăn  nhiều màu - DIRAZO",95000,149000,4.555555555555555,9,https://vn-live-01.slatic.net/p/b44bf39c79f63bba68f5ec127c077eef.png,DIRAZO- Thời trang xu hướng Trẻ,shirts,https://www.lazada.vn/products/pdp-i2497483702.html
Luxqlo Áo sơ mi nữ tay ngắn áo kiểu dáng rộng đơn giản thời trang mới mùa hè phong cách Hàn Quốc Tops,145119,246000,,,https://sg-test-11.slatic.net/p/3da2d6d96ac15f8d3b20cb781960e7ae.jpg,Luxqlo Store,shirts,https://www.lazada.vn/products/pdp-i2391977538.html
"[FULLBOX] Áo sơ mi form rộng unisex dài tay, chất lụa linen cao cấp mềm mát thời trang Hàn Quốc hiện đại phong cách cá tính lyihome",149999,210000,,,https://vn-live-01.slatic.net/p/2318191648c9c5718437aa0855acb83b.jpg,Lyihome.20,shirts,https://www.lazada.vn/products/pdp-i3141350774.html
ÁO đôi sơ mi nam nữ ship hoả tốc ÁO SƠ MI KẺ nam nữ,55440,,,,https://sg-test-11.slatic.net/p/a5fb5735c16468e8dc523984c98af04a.jpg,LAYLASHOP_CHUYENHOATOC,shirts,https://www.lazada.vn/products/pdp-i2608480445.html
Luxqlo Áo Sơ Mi Nữ Tay Ngắn Hở Vai Áo 2024 thời trang mới Áo Kiểu Hàn Quốc rộng,148976,246000,4.666666666666667,3,https://sg-test-11.slatic.net/p/616b0ada0cdff8054f287e185cd4cda8.jpg,Luxqlo Store,shirts,https://www.lazada.vn/products/pdp-i2741592785.html
Áo sơ mi hoa mới 2025 thiết kế rộng thích hợp áo sơ mi hoa phong cách Hồng Kông Đẹp Trai in áo có tay dài,198626,297220,5.0,2,https://sg-test-11.slatic.net/p/044cb2f1c78de5dd76ebe5ba2e062324.jpg,MOUREN,shirts,https://www.lazada.vn/products/pdp-i3136639659.html
ASRV áo sơ mi áo nam áo boy phố áo sơ mi nam boypro Áo sơ mi nam thời trang retro Áo sơ mi kẻ sọc thường ngày dài áo có tay,118000,236000,4.5,4,https://sg-test-11.slatic.net/p/5b75c86120a04cb14306d6981e16c3dc.jpg,ASRV,shirts,https://www.lazada.vn/products/pdp-i2828034795.html
Polka Dot Áo vải chiffon Áo sơ mi đứng áo có cổ phụ nữ ngắn tay mùa hè mới thời trang nữ thần Áo sơ mi cho Nữ Ngắn Tay,137289,196000,4.674418604651163,47,https://sg-test-11.slatic.net/p/9b390bf1ce87fb0fc77c62be24beddf5.jpg,BlueOrange,shirts,https://www.lazada.vn/products/pdp-i2386978585.html
"Áo Voan Lụa Băng Áo Sơ Mi Ngắn Tay Thắt Nơ, Áo Cánh Nữ Dáng Rộng Và Mỏng Phong Cách Mới Mùa Hè Áo S Ơ Mi Nữ Ngoại Cỡ",123289,165745,4.833928571428571,650,https://my-live-02.slatic.net/p/b0a907194bcceff605e2d2ffd0b91ed0.jpg,LikeMy,shirts,https://www.lazada.vn/products/pdp-i1430089217.html
Áo Sơ Mi Tay Dài Cổ Tròn Thêu Hoa dễ Thương Phong Cách Hàn Quốc Cho Nữ B3-Trắng,109000,165000,4.583333333333333,12,https://vn-live-01.slatic.net/p/919845e7f5eb190582d4732a7624aed8.jpg,Gloria Shop_ThờiTrang Công Sở,shirts,https://www.lazada.vn/products/pdp-i2331957598.html
Áo Sơ Mi Cổ Trụ Tay Ngắn Form Ôm Phong Cách Trung Quốc,223000,653000,4.666666666666667,3,https://filebroker-cdn.lazada.vn/kf/Sc436e9feff284db097af897a9c9a5b6be.jpg,Kawadu,shirts,https://www.lazada.vn/products/pdp-i3196145986.html
Áo sơ mi ống tay phồng cổ áo vuông DUOHANZI Áo áo rộng tay ngắn kiểu Pháp tay quần soóc rộng,106000,212000,4.928571428571429,154,https://my-live-02.slatic.net/p/23be96bc149136118df6d444ffe49300.jpg,DUOHANZI,shirts,https://www.lazada.vn/products/pdp-i2302583018.html
